speech_id,speech
980096379,Mr. President. I support S. 1301. a bill to amend the Internal Revenue Code of 1954 to allow a tax credit for expenses incurred In the care of elderly family members. Put simply. this legislation Is necessary for both humanitarian and fiscal reasons. Institutionalized care for the elderly is a burden on family members and a drain on Government sponsored assistance programs. It is estimated. however. that up to 40 percent of our 1.3 million nursing home residents could live at home. In all too many instances. families are forced to institutionalize their elderly relatives because of financial reasons. This bill would provide tax credits for a portion of -expenses incurred in support of services that the chronically Ill elderly and their families require. Such services will include home health aide services. adult day care. respite care. nursing care. and medical or healthrelated supplies and equipment. This assistance will not only provide much needed emotional and financial relief for the family. it will also save money for the Government. One of the highest expenses In medicare Is institutionalized care. Nationwide. such care costs close to $20.000 annually per patient. I believe the savings medicare costs will far exceed the revenue loss.from these tax credits. S. 1301 is designed to target the greatest relief to those families most in need. The credit available will be determined ona sliding scale based on annual income. Families who have incomes under $10.000 can claim a tax credit for 30 percent of allowable expenses up to a maximum credit of $1.050. Families with adjusted gross incomes In excess of $50.000 will be Ineligible for the credit. as will the elderly whose income exceeds $15.000. Only billable services can qualify for the credit. This responsible legislation will especially assist those families whose elderly relation has a disease that is not covered by medicare or medicaid. S. 1301. for example. would help the family of an Alzheimers disease sufferer. who may be physically healthy. but mentally debilitated to the point of requiring constant care. It is this disease and many like It that makes S. 1301 so Important to the fastest.growIng group in our country. the elderly.*
980142118,Mr. Presidint. I say that the conferees knew what they were doing and did the right thing and afforded the State of Florida and its people along the west coast and beautiful gulf coast the protection to which they are entitled. 18 of the 19 Floridian Congressmen were In favor of this. The two Senators were in favor of this. and the Governor is In favor of this. As to the amendment by my distinguished colleague today. the Senator from Louisiana knows what it does. It creates a 50mile buffer. It adds 40 miles additionally between the 26th and 28th parallel and strips down the rest of the coast. strips it down to 10 miles. We are talking about mj. 1percent differential in the total area between Senator JOHNSTONs amendment and that agreed upon by the conference. That is what we are talking about. I think the people of Florida have a right to say where they wish to have the buffer. and that the place they desire to have it Is down along the coast. starting from the Apalachicola down to Naples. Additionally. the 10.3 miles was not given to Florida. No one gave that to the people of the State of Florida. That came from the Spanish deeds. The same thing happens In Texas. It is the product of a Supreme Court decision. So we did not give them 10.3 miles. The fact of the matter is the original agreement on this floor envisioned that 30mile buffer strip. 20 miles added to the basic 10 miles down along that coast. I think we knew exactly what we are doing. I think it was environmentally the sound thing to do. The senior . Senator from Florida touched on It. Let us do the environmental studies and ascertain whatever they can tell us. We should not say what a wonderful thing we did when certain lands were exempted from drilling. To get the Interior Department these days to admit these were environmentally sound lands. they must have been ecologically important. so did not do anything magnificent by doing that. I would hope that we would continue to honor the conference report because It really makes the most sense.
980160038,"Mr. President. I rise today as a cosponsor of 8. 9303. a bill introduced by my distinguished colleague. the junior Senator from Pennsylvania. This measure would repeal 10 U.S.C. 9803. commonly known as the Maybank amendment. This amendment. adopted In 1954. exempts the Department of Defense from a Pederal policy which permits Government agencies to pay a small premium on contracts awarded to firms located in labor surplus areas. This policy is intended to relieve economic dislocation. In 1980. the NortheastMidwest Senate Coalition. of whioh I am a member. led a successful effort to establish a test. program under which the Defense Logistics Agency (DLA) would annually target $4 billion in nonstrategic purchases to firms located in high unemployment areas. Preliminary results show that this test program is having the desired result. Of the 86.970 contracts eligible for award under the program. valued at $8.1 billion. 10.888 were awarded to firms in high unemployment areas during the period from February 1981. through December 1988. A price differential was paid on under 8 percent of these contracts. At an insignificant. marginal cost to the Department of $1.8 million. 11.488 Jobs were created In high unemployment areas. As an unintended benefit. competition for DLA contracts increased from 40 percent to 80 percent. This. by itself. should work to hold down the cost of all procurements. In addition to repealing the Maybank amendment. this bill provides that the Secretary of Defense shall establish a program tc. allow payment of a price differential of not more than 9.6 percent on contracts with an aggregate value of not less than $13 billion in each fiscal year. beginning in fiscal year 1986. This price differential will be payable to allow firms in labor surplus areas to win contracts for nonstrategic purchases. The President would be required to provide Congress with an annual report on the implementation and results of this program. MA A ISO I sepa""itat hi agiWI iSa use -em elh esW etw glas has to dale I cannot oveeaphaelae the Imapottence of this test ioesem at of the pea of a"" Ma throuspasage of thIsiitL e$V t Labor steustiaes daea she e New Yorkes alme we"" e en a seasonily austed oeels. a annary 1984. Proper and careful anglementation of the test program followed by repeal Of he Maybank amendment could mean go#. peratnent jobs. and a bright future for many of these eple. t 4 emai marginal cost to et of tSefense. Additionally. revenues would increase as these unemployed people return to work and other Poderal expenditures for unemployment benefits and welfare would deorease. I urge you to join with me in support of a. 3908 in order to help sppad the benefits of our economic recovery to all of the people of this Nation.0"
980164076,"Mr. President. I rise Public Law 97292. provides for na- Coln Norman which appeared in the today to cosponsor two important leg- tional clearinghouse of information on March 9 issue of Science Magazine. islative initiatives addressing the na- missing children. I was happy to be As Mr. Norman reports. officials at tional tragedy of missing children. I one of the more than 70 Senators co- DOE have recently overhauled the encommend both Senator HAWKINS and sponsoring that legislation. Under the richment program to make it more Senator SPECTER for their leadership Missing Children Act. the FBI is au- competitive. DOE has come up with a and their tireless efforts to fashion a thorized to collect information directly new contract that is designed to help meaningful and effective program to from local police. as well as from the retain the customers that it now has locate and help missing children. parent. legal guardian. or next of kin under contract. But the price of DOEs I am proud to be a cosnonsor of of a missing child when local officials enrichment service under the new conSenate Joint Resolution 252. intro- do not contact the FBI. These reports tract will be $135 per unit. while our duced by Senator HAWKINS. which are tI2n filed in the National Crime European competitors are selling their calls upon the President to issue a Information Center (NCIC) comput- product for $100. Meanwhile. enrichproclamation designating May 25 as ers. Access to the NCIC computer files ment units on the socalled secondary Missing Childrens Day. This legisla- has been of enormous benefit to the market composed of large private tion has special meaning to me as a effort of local law enforcement agen- stockpiles which are being unloaded Senator from New York. On May 25. des in locating missing children. on the market at bargain prices. have 1979. 6yearold Etan Patz disappeared Excellent as are the efforts to date. been reported as low as $80. on his way to school in New York City. however. the size of the problem is What continues to concern me and Five years later. Etan Patz is still miss- such that we need to do more. For this others is that DOE could take immediing. He is one among 150.000 children reason. I am cosponsoring the Missing ate steps to signilcantly reduce its per who disappear every year. Police esti- Childrens Assistance Act. S. 2014. unit price. For Instance DOE insists on mate that there are 20.000 runaways This bill amends the Juvenile Justice continuing to charge ahead with its 15 years of age or younger on the and Delinquency Prevention Act of Portsmouth. Ohio. gas centrifuge streets of New York. They. too. are 1974 to require the Administrator ofplant (GCEP). For several years. critamong the missing. the Office of Juvenile Justice and De- Ics have argued and studies have conIn preparing this statement. I con- linquency Prevention to establish a firmed that the technology to be used (acted the office of Child Find. a na-. tollfree telephone line to enable in the Portsmouth plant will be unecoonal nonprofit organization based In people to provide information about nomic and outmoded the day it comes New laltz. N.Y.. whose sole purpose is the location of missing children. on line. Yet. DOE persists In commiting hundreds of millions of dollars to the project. Further. as the Science article notes. next year DOE will pay $339 million to another Government agency. the Tennessee Valley Authority (TVA) for electricity that will neither be produced nor used. DOE thus far has been reluctant to aggressively pursue means for seeking relief from these excessive charges. Congress should take action to insure that the uranium enrichment program is set on the right course for the future. If not. the program could very well be on the road to bankruptcy. a disaster that could cost this Government and this Nation billions. I would strongly recommend colleagues to read ""Hard Times in Uranium Enrichment."" Mr. President. I ask that the article by Mr. Norman be printed in the RECORD."
980195022,"Mr. President. I only urge my distinguished colleague to let the Members of the body vote up or down on this. But obviously each Member has to do what he feels is in the best interest of the body. I thought we were going to have an up or down vote on it. I think the people of this country have a right to see where the Members stand on this issue. Let me suggest to you that I do not think there is another domestic program that needs as much help as the criminal justice system in the United States of America. I was not going to belabor the point. but I am how. If you want to make a motion to table. make the motion to table. I am going to relate to you a story about my first employer. His name was Freddie Durr. He gave me a job when I was 13 years old. He paid me 75 cents an hour. It was just about a quarter of a mile from where I live. On February 2 of this year. Freddie Durr. a delicatessen owner whose little deli is located 300 yards from my house. closed up his place of business at about 11:15. after working 14 hours. He got into his van to go home. and there waiting in the back was an assailant with a tire wrench. He clubbed him to death. and took the days receipts. He was someone who had been arrested approximately 10 times. received about 10 years in prison. for possession of drugs. assault. a whole long list of crimes. The story of Freddie Durr is repeated time and time again. But we say. you know. ""We have time. We have another process. Slow down."" Mr. President. right here in the Bureau of Justice Statistics Bulletinprisoners in 1983more than 30 States are under Federal Court orders or consent decrees to cap the number of prisoners they can keep in their prisons and jails. It is absolute nonsense to say that we do not have a need for more prison space in this Nation. The statement that current building efforts are falling behind. that they cannot find contractors. has never been substantiated. The fact of the matter is this is OMB speaking. This is not the Justice Department that says. ""Dont do this"". it is OMB. You cannot find a better use for this money. to see to it that the criminal justice system becomes more than a sham. more than a revolving door. And that is what we have. People have lost faith in the process. They say.. ""It doesnt work. it has broken down."" And they are right. And when the Federation of New York State Judges. and its president. Justice Murphy. says: ""Send the violent prisoners who have been convicted to prison. Dont worry about prison space because that is the function. of the legislator."" they are right. That is the function of legislators on the State and. yes. my friends. on the Federal level. as well. Mr. President. I do not believe the yeas and nays have been ordered. At this time. I ask for the yeas and nays."
980207477,"Mr. President. I rise today to cosponsor a joint resolution introduced by my distinguished colleague. the Senator from Ohio. that will designate the week of October 14 through October 20. 1984. as ""Myasthenia Gravis Awareness Week."" Myasthenla gravis. first diagnosed in the 1600s is a neuromuscular disease. although it is not a disease of either the muscle or the nerve. This disease results in a eficiency in the substance which acts _ a conductor between nerve and muscle. The major symptom of this disease is chronic fatigue. The victim experiences periods of extreme weakness. It can strike anyone at any age. An estimated 100.000 to 200.000 people now are diagnosed to have myasthenia gravis with up to another 100.000 undiagnosed cases. Unfortunately. the biggest problem with myasthenia gravis is that it is little known. Doctors often misdiagnose the disease as brain damage. emotional disturbances. or diseases of the lungs. limbs. or heart. depending on whether these parts of the body are affected by myasthenia gravis. A better understanding and more research into the cause and cure of myastinia gravis is necessary to conquer this tragic disease. Myasthenla Gravis Awareness Week will provide an mipotrtant first stepi toward the goal of iner1v.vtsld public awareness. I al ily olleagueis to join me as a co.o.lpe .r of Ifhis resolution.el tltlil- 1FOit FRIDAY ).-rs! I V I ()( 14. NITION OF SENATORt PROXMI tilE I I 11.lI P1lli THANSACTION OF IIOUTINE Mr. ItAKidit. Mr. President. there Is :.m ortiht ftor the Sivinte to convenie at !_o.mr. linorrow: is there not? .Ili 111.ti:)1 Nt OFFICER. That Is I *ffli t. Mr. l A idit. Mr. President. on toanarow. avfr the recognition of the 1%o l iecer usiler the standing order. I :i..k tiesamihnOUS COnSent th1at the dislingiai:-Ind Sonior fron Wisconsin IMr. lIm(xhilicl) be reeotgnized o speChA ordEr of .not to exceed 15 inieutes. t.) bv foliowvd by a period for the lraei..arlion of routine morning busin 1w uitil no latter than 10:15 a.m.. with stateients therein limited to 2 minutes each."
