speech_id,speech
1130001048,"Madam Chair. I rise in strong and vociferous opposition to what I view as a misguided amendment. It aims to cut funding that would help repair the seawalls and research buildings damaged by Superstorm Sandy at the Stewart B. McKinney National Wildlife Refuge in Connecticut. This is a vindictive amendment. in my view. that needlessly slashes disaster relief for one particular State. and I urge its defeat. Named after the former Republican Congressman from my State. the Stewart McKinney Wildlife Refugee spans 70 miles of Connecticut shoreline. including 800 acres of island habitats. a beach. and tidal wetlands. One of the more remarkable aspects of the McKinney Refuge is a chain of seven islands along the coast. The islands support habitat for several federally endangered and threatened species and also hosts related research facilities. These islands are key stops for birds migrating along the Atlantic Flyway. and two of them have been named ""important bird areas"" by the National Audubon Society. Some of these islands are also in close proximity to urban centers. All of them sustained severe damage during Superstorm Sandy. For example. the storm damaged the dock. seawall. and education building on the Outer Island research station. which is also the most visited island within the McKinney Refuge. As a result. the natural resources on Outer Island cannot currently be properly managed. On Outer Island. the lack of repairs will have serious environmental consequences. If the seawall isnt repaired. erosion will undermine the foundation of the main building. dislodge the septic tank and cause significant contamination. and will lead to major repair costs. Thats why we need to make available disaster aid to the McKinney Refuge so that they can recover from this storm. just as we have many times in the past for other refuges affected by disasters all across this country. Let me give you some examples. After Hurricane Katrina in 2005 and Hurricane Ike in 2008. we appropriated $71 million for wildlife refuges in Texas. $20 million in Mississippi. and $74 million for refuges in Louisiana. the sponsor of this amendments home State. One of the central responsibilities of this institution is to act on behalf of the American people whenever a major disaster occurs. Federal disaster relief is meant to restore homes. businesses. communities. and Federal facilities to their predisaster condition. We do this whether the disaster is a fire in the west. a tornado in the south. or a hurricane in the northeast. There is no good reason to make an exception of the McKinney Refuge here. The sponsor of this amendment. Congressman FLEMING of Louisiana. has argued that this bill includes $9.8 million solely to repair the damage done at the Outer Island. This is simply not true. The Fish and Wildlife Service requested over $10.9 million for repairs to the McKinney Refuge. including just over $2 million for Outer Island. The rest of the funds. however. would support repairs all along the 70 miles of affected Connecticut coast. By cutting the funding needed to rebuild the Connecticut coastline to its preSandy condition. this amendment prevents the McKinney Refuge from meeting its Federal commitment to conserve wildlife. to provide education and outdoor recreation for the public. and it unfairly singles out Connecticut and all of the protected wildlife along our shores. Is the State and refuge somehow unworthy of Federal support? Its a terrible precedent for disaster aid. When these disasters occur. we have always come together as a Nation of Americans. just as we did after Katrina and Andrew and Irene. and we should not change that now. I urge my colleagues to reject what I view as a pernicious amendment and help Connecticuts McKinney Refuge rebuild from this storm."
1130028285,"Thank you so much. Its an honor to join with you. I know where your heart. your head and your courage lie with regard to this issue. And we applaud you for your efforts with regard to the one caucus around this place that says that our goal and our mission is to make sure that people who are poor today. let us help them move out of that being poor. Let us help them move into the middle class. because in fact they do want to work. they do want to take care of their families. Theyre not just statistics. They are people to be upheld and respected and not to be vilified in so many ways as they are there. So I congratulate you and your efforts. Im proud to be here with you tonight and with my colleague. Congressman ELLISON. and the Progressive Caucus for his comments and remarks. I see that we are also joined by our colleague. Mr. JOHNSON. I want to thank you for your efforts as well. As youre talking about. what tonight is all about is highlighting severe immoral cuts that are made to antihunger and nutrition programs. particularly the food stamp program. And that is coming from the House of Representatives in the farm bill that passed out of committee. Everybody knows millions of families are struggling in this economy. Across this country. nearly 15 percent of American households were food insecure in 2010. Nearly 50 million Americansover 60 million childrenare struggling with hunger right now. It is about children. it is about the disabled. it is about seniors. And this is a problem all across this land. My State of Connecticut. in my districtConnecticut statistically is the richest State in the Nation because we have Fairfield County. and some parts of the State are known as the Gold Coast. with very affluent people. But we have such pockets of hunger that. in my district. one out of seven is food insecure. Im tired of the commentary on food insecurity. What that meansand my colleague knows this. weve talked about thisit is about being hungry. These folks. one out of seven doesnt know where their next meal is coming from. In Mississippi. 24.5 percent suffer food hardship. nearly one in four people. West Virginia and Kentucky. that drops to just over 22 percent. one in five. In Ohio. nearly 20 percent. California. just over 19 percent. The estimates of Americans at risk of going hungry here in this land of plenty are appalling. And at times such as this. our key Federal food security programs become all the more important. This is especially true of food stamps. our countrys most important effort to deal with hunger here at home and to ensure that American families can put food on the table for their kids. Right now. food stamps are helping over 47 million Americansnearly half of them childrento meet their basic food needs. They make a tremendous difference for the health and the wellbeing of families. as our colleague. Mr. ELLISON. pointed out with his examples. Food stamps have been proven to improve lowincome childrens health. their development. reduced food insecurity. and have a continuing positive influence into adulthood. You know. I listen to people that talk about waste. fraud. abuse. Food stamps always has one of the lowest error rates of any government program. Go to the IRS. go to Defense. go to a crop insurance program. and you will find waste. fraud. and abuse. Food stamps are good for the economy. Economists agree that food stamps have a powerful. positive impact on economic growth. Last month. Bloomberg ran an article called. ""Best Stimulus Package May Be Food Stamps."" because they get resources into the hands of families who are going to spend those dollars right away. Most importantly. food stamps are the right thing to do. Ninetynine percent of food stamp recipients have incomes below the poverty line. It is the job of good government to help vulnerable families get back on their feet. In the words of Harry Truman: Nothing is more important in our national life than the welfare of our children. and proper nourishment comes first in attaining this welfare. This is something that everyone in Washington used to agree on. In the past. theres been a strong tradition of bipartisanship on hunger and nutrition. From the left. leaders like George McGovern. and from the right. leaders like Bob Dole. came together. They made a difference for families who were in need. Over the past 30 years. policies aimed at debt and deficit reduction to keep programs that help the most vulnerable among us to get by have always been protected on a bipartisan basis from deep cuts. But the farm bill coming out of the House right now seeks to destroy that tradition. In the name of deficit reduction. the bill slashes food stamps by more than $20 billion. hurting millions of Americans in our economy. By eliminating categorical eligibility. their bill would force up to 2 million lowincome Americans to go hungry. Their bill kicks 210.000 lowincome children from the free school lunch program. It changes the relationship between SNAP and LIHEAP to take benefits from more lowincome Americansmostly seniors and working families with kids. Lets be clear: this has nothing to do with deficit reduction and everything to do with the ideological priorities of a House majority. Ever since the Speaker took the gavel. this majority has tried to slash through the most crucial threads of our American social safety net. Their Ryan budget cut over $130 billion from food stamps. mostly by converting it to an inadequate block grant. Last year. when the House Ag Committee had to identify $33 billion in 10year savings from the programs of their jurisdiction. they singled out food stamps for all of the cutsnot direct payments. not crop insurancejust food stamps for the entire cut. This is terrible policy. It will cause hunger and more health problems. These cuts are lopsided and are a dereliction of our responsibility to the American people. and of our moral responsibility. Let me quote the U.S. Conference of Catholic Bishops. They said last year: We must form a ""circle of protection"" around programs that serve the poor and the vulnerable in our Nation and throughout the world. And as Catholic leaders wrote last month: Congress should support access to adequate and nutritious food for those in need and oppose attempts to weaken or restructure these programs that would result in reduced benefits to hungry people. The House farm bill does the opposite. It jeopardizes the growth and development of our children. it jeopardizes seniors. and it puts at risk those disabled Americans. In my district yesterday. I went to the Cornerstone Christian Church in Milford. Connecticut. and the representatives there were the woman who volunteers in their food bank program. Reverend Stackhouse of the Church of the Redeemer. Lucy Nolan of End Hunger Connecticut. Nancy Carrington. who heads up the Connecticut Food Bank. and a young woman whose name was Penny. She had worked all of her adult life. She lost her job. She thought it was going to be easy to get another job and to be able to make her mortgage payments and all of the other financial obligations that she had. In the midst of this financial crisis. she and her husband separated. putting the burden of the family on her shoulders. She didnt know where to turn. She didnt know how she was going to put food on the table. She went to the Connecticut food bank. They helped her to be able to access the food stamp program. Thats where she is nowstill looking for a job. still wanting to work. Her pride enables her to continue to look for that job. The courage of speaking before this group yesterday and the press. and to tell that story. took great couragelike so many others are telling that story. my colleagues tonight. We do have an obligation. These are not statistics that we are talking about. These are flesh and blood Americans who are looking for a bridge. They dont want to be there forever. They want to be able to take care of themselves and their families. Its a genius of the food stamp program to say in times of need: were there and. yes. we rise in the participation. When it gets better economically. those numbers drop. We have an obligation to those peoplenot to the statistics. but to those individuals who look to the Federal Government that says in a time of challenge: give me a little help. thats all Im asking. I dont want everything. I know you dont have all those resources. Help me in this hour of need. Thats what where our moral responsibility is. Again. I say thank you to my colleagues for participating and for your steadfastness in dealing with this issue."
1130031543,Mr. Chairman. I yield myself such time as I may consume. I think its very interesting that the Food Safety Modernization Act was passed by the Energy and Commerce Committee. which has jurisdiction. as well as the FDA. and. quite frankly. it does not have any jurisdiction under this piece of legislation. and Im disappointed that it made it through the Rules Committee. However. in January 2011. the President signed a transformative food safety law that Congress had passed in a bipartisan manner to improve the health of our constituents. The legislation was supported by a broad coalition of consumer. public health. and industry groups. groups including the Grocery Manufacturers Association and the National Restaurant Association. When we crafted the final food safety bill. we struck a compromise. a compromise on the scope of the bill so that the vast majority of truly small farms and processors are excluded. including those that sell most of their food directly to the public through farmers markets and farm stands. in addition to which regional considerations were also taken into consideration. The integrity of that compromise has been maintained in the proposals released by the FDA to date. I can speak to this compromise and the agreement we reached at the time because. in fact. I helped to craft and negotiate the final language. The law also requires that the FDA take regional differences into account when crafting its proposed rules. Let us be clear: that legislation was needed. Foodborne illness remains a threat to the public health. According to the Centers for Disease Control. each year 48 million Americans become sick from the very food they eat. 128.000 are hospitalized. and 3.000 die. These figures are far too high and simply unacceptable. so we acted. We passed the first major improvement to the FDAs food safety laws in more than 70 years. Under the guise of seeking a report. this amendment seeks to further slow down the implementation of the law. a law with the potential to improve the very health of our constituents by reducing their risk of becoming sick from food. Yet nowhere in the text of this amendment or in the intent of these reports do I see a mention of the public health or consumer safety. All of the FDAs proposals to implement this critical law already go through the official rulemaking process. meaning that the agency must consider the costs and the benefit of the rules. and that every one of us and our constituents can weigh in and submit comments on the rules already. The amendment before us now simply intends to slow down the process of implementing the law. Rather than working to obstruct and delay implementation. we should be working to encourage strong implementation. Lets look at what has happened since the bill was signed into law. In that short period of time. there have been almost 20 multiState outbreaks positively linked to food products regulated by the FDA. One of those was an outbreak of listeria associated with cantaloupe. a product that had not previously been identified as associated with that dangerous pathogen. The same outbreak killed 33 Americans. the largest number of Americans lost to a single outbreak in a quarter of a century. Right now there is a multiState outbreak of hepatitis A that may have been caused by a contaminated product regulated by the FDA. More than 115 people in eight States have become ill. and more than 50 of them have required hospitalization. It continues to be supported by the majority of Americans. A recent poll showed that more than 75 percent of Americans surveyed supported the food safety law. which is why so many respected organizations that work to improve the public health. including the Consumer Federation of America. Center for Science in the Public Interest. Pew Charitable Trusts. and Consumer Unions. oppose this amendment. I urge my colleagues to heed their advice and oppose this amendment. I reserve the balance of my time.
1130040256,Mr. Chairman. my amendment would prohibit funds in this bill from being used by the Defense Department to train the Afghan Special Mission Wing to operate or maintain Russianmade Mi17 helicopters. Over 93.000 people have died in a tragic war in Syria that is being fueled by Russian arms being supplied to the Assad regime. Over 1.6 million Syrian refugees are now hosted across five countries. By the end of the year. half the population of Syria will be in need of aid. We know for a fact that the Russian arms manufacturer. Rosoboronexport. is arming Syria. The Syrian Army requested 20.000 Kalashnikov assault rifles. 20 million rounds of ammunition. machine guns. grenade launchers. grenades. and sniper rifles with nightvision sights. And Russia also recently announced it would provide Assad with advanced S300 missile defense batteries. Yet. our Defense Department continues to channel business to this Russian arms manufacturer. DOD recently skirted around a prohibition on purchasing Mi17 helicopters from Russias state arms dealer in last years Defense appropriations bill. signing a contract with Rosoboronexport to procure 30 Mi17s for the Afghan Specialty Mission Wing using 2012 Afghanistan Security Forces Fund moneys. This contract signing. flying in the face of congressional intent. incredibly came just days after this House voted 4230 to strengthen the prohibition on Pentagon business with the Russian arms dealera prohibition also included in this Defense appropriations bill. Even more egregious. it also came on the heels of a report by the Special Inspector General for Afghanistan Reconstruction that recommended suspension of the plans to purchase these helicopters for the Afghan Special Mission Wing as the Afghans do not even have the capacity to use them. The Defense Department touts the 30 years of experience the Afghans have with the Mi17 helicopters as a key reason to purchase them. yet we are still trying to train them to fly these helicopters instead of Americanmade helicopterstraining that the Inspector General report says has been slow and uneven. The report also argues that moving forward with the acquisition of these Mi17 helicopters is highly imprudent until. among other things. an agreement is reached on NATOs Afghanistan Training Mission concept for reorganization within the Afghan Government to support this Special Mission Wing. Mr. Chairman. U.S. taxpayers should not be subsidizing the Russian state arms dealer that is fueling the war in Syria. The language already included in this bill states this. We should also not be spending money to train an Afghan unit to fly these Russian helicopters. particularly when the Inspector General has raised serious questions about the content of that units capabilities. I urge support for my amendment. and I reserve the balance of my time.
