speech_id,speech
1140036677,"Mr. President. I rise today to discuss the PORTS Act. legislation I have introduced to protect the American economy from crippling labor disputes at our seaports. Somebody asked why a Senator from Colorado was interested in legislation dealing with the work stoppage or slowdown that occurred on our ports on the west coast. Well. I will tell you why. I was contacted by numerous businesses and people that had their entire furniture lines taken out of their furniture stores. I talked to ranchers who had to face threats of a $1 billion ag export market. I talked to onion growers who watched as their domestic commodity prices crashed due to the port slowdown. I watched as stories were written in newspapers about apple growers in Washington unable to export apples so they dumped apples just to rot in the fields in Washington State. Trade through U.S. seaports is critical. We have been spending weeks on this floor and the floor of the House talking about the TransPacific Partnership and talking about the importance of trade promotion authority. and none of that is possible without an active. successful port system in this country. According to the American Association of Port Authorities. U.S. ports support 23 million jobs. and the value of related economic activity accounts for 26 percent of our national gross domestic product. Contract negotiations and related labor disputes at our ports clog up these vital arteries and lead to delays. higher costs. and lost business for industries throughout our country. Strikes. lockouts. and slowdowns may have been business as usual for labor unions in the past. but an increasingly global economy means that the collateral damage done to American workers and businesses has increased exponentially. The U.S. economy recently endured a 9month labor dispute that affected all 29 of our west coast ports. The resulting logistical nightmare caused delays. higher costs. and lost businesses for industries in Colorado and throughout the United States. Ships full of cargo were anchored off our coast waiting for longshoremen to do their job on unloading international goods and loading Americanmade products for shipment to markets across the world. In Los Angeles and Long Beach alone. dozens of container ships sat anchored and idle. After 9 months and huge financial costs to our national economy. the parties reached an agreement in February to allow cargo to begin moving normally through the west coast ports again. Four months later. we are finally seeing that congestion beginning to ease. but it has taken this long. Many economists. including the Federal Reserve Board of Governors cited the labor dispute as a primary cause of the 0.7percent decline in GDP in the first quarter of 2015. That means 29 west coast ports were primarily responsible for a 0.7percent decline in GDP. Agricultural exports. including apples. hay. and Christmas trees lost export opportunities to overseas customers because they couldnt get products to market. Meat and poultry companies lost sales and faced port charges in excess of $30 million per week. Retail shipments were delayed from reaching store shelves. and some stores resorted to expensive air freight to stock goods. Manufacturers waiting on shipments had to shut down production lines and risked losing contracts with foreign customers. Colorado supplies Asia with over $500 million in beef products through the west coast ports. which accounts for about 23 percent of Colorados total exports and 57 percent of Colorados international exports. These and other meat and poultry exporters saw many of their products spoil as shipments were turned away at the port gates. Grain. machine parts. coal. fishing supplies. furniture. fresh produce. and pliable metals are all products of Colorado. and all were damaged by the labor dispute. Our exporters relationships with Asian customers disintegrated as their orders were caught in the bottleneck. And storefronts lost customers because products took months to reach show floors. When Congress enacted TaftHartley nearly 70 years ago. Congress decided the health and reputation of the greatest economy in the world should not be used as leverage in labor contract negotiations. The opening statement of the act explains that Congress intended to minimize ""industrial strife which interferes with the normal flow of commerce."" That means current law had provided a remedy. but unfortunately the administration did not use it. Under that very provision of TaftHartley. when a labor dispute threatens the national economy. the President is empowered to use the Federal courts to seek an injunction to end labor practices causing widespread disruptions. With 70 years of case law backing it up. this is a triedandtrue process that ensures that the selfinterests and greed of a few does not impact the livelihoods of the many. Yet. when the west coast ports dispute threatened businesses and entire industries in States across the country. the President refused to act. For months. the Federal Executive decided not to exercise his authority under TaftHartley. depriving the country of critical dispute resolution powers. Legislation I have introduced. known as the PORTS Act. prevents this kind of economic disruption. It would discourage disruptions at U.S. ports by strengthening and expanding the wellknown TaftHartley process. As we saw recently. the President of the United States may not be willing to adequately protect the economic rights and interests of American citizens. The PORTS Act would solve this by granting State Governors TaftHartley powers currently reserved for the President. A Governor from any State would have the opportunity to form a board of inquiry and start the TaftHartley process whenever a port labor dispute is causing economic harm. Once the board reports back. any Governor can petition Federal courts to enjoin slowdowns. strikes or lockouts at ports in their State. The act would also explicitly include slowdowns as a trigger for TaftHartley powers. preventing the President or Governors from using legal ambiguity to excuse an action. As a result. this legislation would give a stronger voice to local leaders by allowing those who are most affected by disruptionslocal community leaders. business. employees. and consumersto apply pressure on their Governors rather than trying to mobilize a national campaign to convince the President to act. In just 5 years. the labor contracts at both the east coast and the west coast ports will expire. possibly leading to labor disputes on both ends of the country. When the health of the national economy is threatened. the Federal Government has a duty to act. but it is clear the current TaftHartley powers depend too heavily on who controls the Presidency. It is critical that we have the necessary tools in place to prevent another debilitating crisis. So I urge my fellow colleagues to join me in supporting this important legislation. Countless retail organizations. individual businesses. and people across this country recognize the need to avoid in 5 years simultaneous slowdowns or shutdowns on the east and west coastswhat we just went through. Mr. President. I yield the floor. I suggest the absence of a quorum."
1140038182,"Mr. President. as we are moving toward concluding debate on trade promotion authority. I rise to speak about what the TransPacific Partnership will mean for our Nations global standing. As we have heard throughout this debate. the potential economic benefits from TPP for our Nation are simply enormous. According to the Congressional Research Service. total trade in goods between TPP member countries reached $1.6 trillion in 2014. that is. the nations represented in TPP. $1.6 trillion in trade between those countries. representing nearly 40 percent of all global trade. In my own State of Colorado. trade with countries involved in TPP currently supports over 265.000 jobs. The nations represented by the TPP agreementthe negotiations that are taking place right now265.000 jobs in Colorado result from those nations. But we know the TPP is more than just an economic agreement. It is a critical test of U.S. strategic leadership in the AsiaPacific region. a region that will be integral to our economic and national security for generations to come. As stated in the 2015 National Security Strategy: Sustaining our leadership depends on shaping an emerging global economic order that continues to reflect our interests and our values. Despite its success. our rulesbased system is now competing against alternative. lessopen models .... To meet this challenge. we must be strategic in the use of our economic strength to set new rules of the road. strengthen our partnerships. and promote inclusive development. Those are important words from the National Security Strategy issued just this year. Defense Secretary Ash Carter echoed that sentiment when he said on April 6. 2015. the ""TPP is as important to me as another aircraft carrier."" If we fail to pass the TPP. we know others will rush to fill the vacuum left behind with such ""alternative. lessopen models."" as the National Security Strategy laid out. So we should not be surprised when a rising China tries to fill the vacuum and that they would. indeed. exert efforts to fill that vacuum with policies and programs crafted from their own vision of what is beneficial for themselves and their region. Lets take Chinas recent establishment of the Asian Infrastructure and Investment Bank. the AIIB. as an example. On the face of it. the AIIB is a positive response to address the infrastructure challenges in the region. It is also the clearest evidence yet that the United States faces a very serious credibility gap in the AsiaPacific region. The AIIB is envisioned as a $100 billion enterprise. with China as the largest shareholder that will hold veto power over major investment decisions. Its rules of governance and standards remain unclear. Yet 56 nations. including some of the strongest U.S. allies. including the United Kingdom. Australia. South Korea. have indicated they will join the Chineseled AIIB. We need to understand why. Do they believe the AIIB is primarily an economic opportunity for their companies? They might. But I would contend that the reason is a lack of leadership from the United States. again going back to that credibility gap. China is also part of ongoing negotiations for another regional trade pact. the Regional Comprehensive Economic Partnership. which would join China. Australia. India. Japan. New Zealand. and South Korea with nations comprising the Association of Southeast Asian Nations or ASEAN. In addition to the Regional Comprehensive Economic Partnership. Beijing is also entering negotiations to consider 6 agreements comprised of an additional 11 countries. That brings Chinas total trade agreement portfolio to 33 countries. While the United States should continue bilateral and multilateral economic engagement with China that brings high levels of transparency and accountability. the fundamental question before us today is this: Do we want the United States or do we want China writing the rules? It is clear that while our partners and allies in the region may welcome additional Chinese investment. they want more American leadership. not less. They want more American standards. not fewer. We know the standards TPP and U.S. engagement brings include not only important economic benefits. such as removal of tariff or nontariff barriers. but fundamental American values such as transparency. good governance. respect for the rule of law. and basic human rights. U.S. economic statecraft in the AsiaPacific reflects our values and cements our leadership in the critically important region. We must look at TPP as just one step forward in this enduring commitment. Despite the crises of the day that are occurring in the Middle East. where the United States does and should play an important role. our Nations future lies in Asia. Just consider the following estimates from the Asian Development Bank. By 2050. Asia will account for over half of the global population and over half of the worlds gross domestic product. The Asian middle class will rise to a staggering 3 billion people. Per capita GDP income in the region will rise to around $40.000. making it similar to the Europe of today. We cannot miss the opportunity to be a part of this historic transformation. Working with Japan and regional partners. we must ensure that our policies strengthen existing friendships and build new partnerships that will be critical to U.S. national security and economic wellbeing for generations to come. Unfortunately. the administrations efforts to date with regard to the AsiaPacific region have fallen short. While I commend the Presidents leadership on TPP and our Asia rebalance. which many of us agreed to. the Asia rebalance policy has yielded few tangible results. and it is in need of a serious overhaul. The administration has consistently stated that the rebalance represented a ""whole -ofgovernment"" effort to redirect U.S. military. diplomatic. and commercial service resources toward the AsiaPacific region. But in April of 2014. just a year ago. the Senate Foreign Relations Committee released a report stating that ""while the United States has successfully moved forward with the initial phases of implementing the military aspects of the rebalance."" the State Department and the Department of Commerce have not substantially prioritized their resources to increase engagement with the AsiaPacific region. The report concluded that ""the administration can improve the effectiveness and sustainability of the rebalance policy by increasing civilian engagement. strengthening diplomatic partnerships. and empowering US businesses."" It is clear we need an integrated. multiyear planning and budget strategy for a rebalancing of the U.S. policy in Asia. That is why I was proud to offer an amendment to the National Defense Authorization Act that passed unanimously that would require the President to submit a strategy within 120 days to promote U.S. interests in the AsiaPacific region. Our partners in the region must know every day that the United States is here to stay. The TPP is the first step in the process. This is an important debate that we have this week. Later on today. we will have the opportunity to vote for trade promotion authority. I hope this Chamber will see the wisdom of passing that legislation265.000 jobs in Colorado from a region responsible for TPP. responsible for increasing economic opportunity. increasing wage growth. and the number of jobs that we have not only in Colorado but around this country. I yield the floor."
1140043484,"Mr. President. I thank the Senator from Washington and the Senator from Tennessee for their leadership over the past several dayslast week and this weekas we talk about the future of education in this country. I commend them for creating a bill that takes away the Federal Governments mandates on curriculum and direction and makes sure we provide local control to school districts and teachers. As a father myself of a student who is going into the sixth grade. I have heard a lot about tests over the past several years. and I want to commend the leadership for making sure we are actually getting Congress out of the classroom. So I appreciate my colleagues leadership. Today I want to talk about an amendment accepted in the education bill we are dealing with here today that deals with the use of title I funds for concurrent and duel enrollment programs at eligible schools throughout the country. According to the Georgetown Public Policy Institute. by 2020. 65 percent of the jobs available in the country today will require secondary education. In Colorado. that number is even higher. Again. by 2020. 65 percent of our jobs will require secondary education. In Colorado. that number is going to be greater. The Colorado Department of Education estimates it is not just 65 percent of the jobs that require a secondary education in Colorado by 2020. It will actually be 74 percent of the jobs in our State that are going to require some form of postsecondary education. Ensuring that our students have the skills necessary to excel in college and in the workforce is absolutely and by far and away the best way to address this concern so we can make sure that we are providing our students with successful futures. Concurrent enrollment and dual enrollment programs have a proven record of success in this arena. I was in the State legislature in Colorado when we embarked on the first concurrent enrollment ideas that came out of the legislature and that have been greatly successful. But we know it is not just the anecdotes from Colorado. but it is the American Institutes for Research that finds that participation in concurrent and dual enrollment programs reduces the number of students dropping out of high school. increasing a students likelihood of entering college. making sure they complete college. and getting through to a career. But our challenge today is that an astounding number of students need to take remedial courses when they enter college. Sitting down with junior college leaders and community college presidents and talking to our universities. they all tell stories about how many students come from high schools to their college or to their campus requiring remedial work in English or mathematics. According to a report by testing organization ETS. nearly onehalf of U.S. millennials scored below the threshold that indicates proficiency in literacy. and twothirds of U.S. millennials missed the cutoff mark in math proficiency. Students are discouraged from continuing college when they are required to take coursesnobody wants to go on to college and take the same coursethat you thought you had completed in high school. But concurrent and dual enrollment will help solve this problem by allowing students to participate in collegelevel courses. which. upon completion. will ensure that these students are indeed proficient. Not only does concurrent and dual enrollment allow proficiency. but it allows students to get ahead of the curve and doing so while in high school. A study by the National Education Longitudinal Study found that concurrent and dual enrollment participants were 16 to 20 percent more likely to complete a bachelors degree than their counterparts. Research shows that students who participate in concurrent and dual enrollment programs complete their degrees earlier than their counterparts as well. A study in 2010 by Kristen Klopfenstein. a Colorado native and graduate of the University of Texas. found that ""the results of taking one or more concurrent or dual credit class tripled the likelihood of graduating from associate programs in three years in relation to students who did not take such courses who typically graduate in four years."" ""Dual enrollment participation was also positively correlated to completing bachelors degrees in four and five years. relative to students who did not take such courses who typically take longer to graduate."" These are the types of programs that reward students for their hard work and prepare them for their college career and success. Many people recognize that courses that provide college credit are typically taken by highachieving students already on the path to college. A lot of college courses that we see are filled with people we knew were destined for college in the first place. But I think we have to talk about the times where that is not the case. where college courses were taken by people who perhaps never thought they had college in their future. I will share one such story today. We were visited in the office not too long ago by a young woman from Colorado who told her story about how concurrent enrollment in Colorado really opened the doors to a college future and a college degree she never thought was possible. The community where I come from is not one that promises a bright future. I am from a low income area of Denver. CO. and we werent expected to go to college. I had always known I wanted to pursue higher education. but was nervous that I wouldnt have the skills to succeed. Fortunately for me. because of concurrent enrollment I was able to get ahead in college for free. I graduated high school with all of my high school credits along with 15 credit hours of college credits. Concurrent enrollment has helped me in phenomenal ways. It gave me the confidence to know I had the capabilities to succeed in college. In addition. with the high cost of college I was able to save money. I am now a student at Colorado State University and made the Deans list this semester. I am on track to graduate early and it would never have been possible without the programs I participated in in high school. I want to spread the word so other students can benefit from concurrent enrollment the way that I have. Every young person who wants to go to college should have the opportunity to attend. and Im thankful I had the opportunity to do so. Those arent my words. Those are the words of a Coloradan whose future was made brighter by the fact that she was able to take advantage. while in high school. of college credit classes. Stories like this are why we have to make sure that. not just Coloradans. but everyone across this country. is able to use title I programs in the same beneficial manner. So the amendment we offered and that has been accepted. thanks to the work of Senator ALEXANDER. our great chairman. and Ranking Member PATTY MURRAY. would empower students to use these kinds of programs and would allow schools to use title I funds for concurrent and dual enrollment programs. enabling students to simultaneously receive college credit from courses taught by college -approved teachers in secondary education. It would allow eligible schools to use fifthyear program partnerships with institutions of higher education to allow students to participate in concurrent enrollment in the year directly following their senior year of high school. Earning a postsecondary degree has become a prerequisite for jobs in the 21st century. Going back to the statistics that we shared in the very beginning. 74 percent of jobs in Colorado will require. by the year 2020. a postsecondary education degree. As we face more competition in the global workplace. as we face more competition abroad. we have to have the kinds of education and educational opportunities that give the next generation of business leaders. innovators. and entrepreneurs the skills to succeed. I believe the concurrent and dual enrollment high school program not only gives them the types of skills they need while in high school but the opportunity to further a college degree and perhaps. as in the story I shared earlier today from that young Coloradan. the chance to go to college. the chance to receive a degree. and to prove they have that bright future. That is what this policy is about. That is what this amendment has been about. Again. I thank the chairman for the consideration and acceptance of the amendment. I yield the floor."
