speech_id,speech
1140076752,"Mr. President. I want to add to the comments made by Chairman CORKER. my colleague from Tennessee and chairman of the Foreign Relations Committee. as well as Senator CARDIN. my colleague on the Subcommittee on East Asia. about the work we have done over the past year to put this before the Senate today. One of the first meetings we held in the office of Chairman CORKER was to speak with my colleagues on the concern we shared about North Korea. the concern that while we have rightfully focused on the Middle East and the conflicts that have arisen in Syria and in various places around the country. at the same time we cannot take our eyes off of North Korea. Of course. Senator CARDIN from Maryland and I have worked together on a variety of committee hearings. The first series of committee hearings we held on the East Asia Subcommittee were to address cyber security issues. the cyber attacks from North Korea. and the situation in regard to security on the North Korean Peninsula. I think the work we have laid out over the past year is setting ground for this strong sanctions bill today. I rise to speak in support of H.R. 757. the North Korea Sanctions and Policy Enhancement Act. as amended by the unanimous amendment that came out of the Foreign Relations Committee on January 28. This legislation is a momentous achievement. and I thank the members of the committee and particularly Senator MENENDEZ for working closely with me as we came together with a strong bipartisan solution to what is the problem with North Korea. I also thank House Foreign Affairs Committee Chairman ED ROYCE. the sponsor of the underlying House legislation. for his years of tireless work and dedication on this issue. Having served with Chairman ROYCE in the House for a number of years. I know his passion and his dedication and his commitment to bringing peace to the peninsula. This legislation comes at a critical time. Those of you who had a chance to see the news this morning woke up to a story in Reuters where yet another top military official in the Kim Jong Un regime was assassinated by Kim Jong Un. following a long list of others in his administration who have been killed. assassinated. tortured. including his own uncle. including those who have been killed by antiaircraft guns. North Korea poses a serious and growing threat to its neighbors. our allies. South Korea. Japan. and others. It poses a threat to our homeland. the United States. and to global security. While the threat is growing daily. our policies are failing to deter the forgotten maniac in Pyongyang. Kim Jong Un. This past weekend. on February 7. North Korea conducted a satellite launch. which is essentially a test of an intercontinental ballistic missile that would be capable of reaching the U.S. mainland. Last month. on January 6. North Korea conducted its fourth nuclear test. which is the third such test during the Obama administration. Moreover. North Korea has claimed that this test was a test of a thermonuclear device. also known as a hydrogen bomba vastly more powerful weapon than the atomic devices the regime has tested in the past. Regardless of whether the claim that it was a hydrogen bomb is true. this test represents a significant advancement in North Koreas nuclear weapons capability. North Korea has violated a series of United Nations Security Council resolutions. including Resolutions 1718. 1874. 2087. and 2094all while the regimes stockpile of nuclear weapons continues to grow exponentially. Most recently. nuclear experts have reported that North Korea may currently have as many as 20 nuclear warheads. with potential for over 100 in the next few years. Yesterday James Clapper. the Director of National Intelligence. testified before the Senate Armed Services Committee that North Korea has restarted its plutonium reactor at Yongbyon and ""could begin to recover plutonium from the reactors spent fuel within a matter of weeks to months."" The regimes ballistic missile capabilities are rapidly advancing. DNI Clapper stated that ""North Korea has also expanded the size and sophistication of its ballistic missiles forcesfrom closerange ballistic missiles to intercontinental ballistic missiles [ICBMs]-and continues to conduct missile test launches .... Pyongyang is also committed to developing a longrange. nucleararmed missile that is capable of posing a direct threat to the United States."" ADM Bill Gortney. the head of U.S. Northern Command. NORTHCOM. which is based in my home State of Colorado. at Peterson Air Force Base in Colorado Springs. has publicly stated that North Korea may have already developed the ability to miniaturize a nuclear warhead. mount it on their own intercontinental ballistic missilesomething called the KN08and ""shoot it at the homeland."" Those are not the words of a committee chairman or the words of a subcommittee chairman. those are the words of our commander of NORTHCOM. who believes that they may have developed the ability to shoot it at the homeland. North Korea has demonstrated time and time again that it is an aggressive. ruthless regime that is not afraid to kill innocent people. On March 26. 2010. North Korean missiles sank a South Korean ship. killing 46 of her own crew. and several months later. North Korea shelled a South Korean island. killing 4 more South Korean citizens. Pyongyang is also quickly developing its cyber capabilities as another dangerous tool of intimidation. as demonstrated by the attack on the South Korean financial institutions and communication systems in March of 2013 or the Sony Pictures hack attack in November of 2014. According to a November 2015 report by the Center for Strategic and International Studies. ""North Korea is emerging as a significant actor in cyberspace with both its military and clandestine organizations gaining the capability to conduct cyber operations."" According to the Heritage Foundation: Contrary to perceptions of North Korea as a technically backward nation. the regime has a very robust and active uyber warfare capability. The Reconnaissance General Bureau. North Koreas intelligence agency. oversees 3.000 ""cyberwarriors"" dedicated to attacking Pyongyangs enemies. A South Korean cyber expert assessed that North Koreas electronic warfare capabilities were surpassed only by the United States and Russia. We should also never forget that this regime remains one of the worlds foremost abusers of human rights. The North Korean regime maintains a vast network of political prison camps where as many as 200.000 men. women. and children are confined to atrocious living conditions and are tortured. maimed. and killed. On February 7. 2014. the United Nations Commission of Inquiry on Human Rights released a groundbreaking report detailing North Koreas horrendous record on human rights. The Commission found that North Koreas constituted a crime against humanity. What then has been this administrations policy to counter the North Korean threat? Our policy is something called ""strategic patience."" which started in 2009 under thenSecretary of State Hillary Clinton. The main idea behind strategic patience. it seems. is to patiently wait until Kim Jong Un peacefully surrenders. The latest developments show that we are reaping the rewards of this illconceived policy. and it can no longer be allowed to remain in effect. The simple fact is that strategic patience has been a strategic failure. All that our socalled ""patience"" has done is to allow the North Korean regime to continue to test nuclear weapons. to expand its testing of intercontinental ballistic missiles. to grow its military power. and to develop cyber warfare technologies while systematically continuing to torture its own people. We have neither militarily deterred this regime nor effectively used our punitive tools. Our sanctions policy toward North Korea has been weak. This was noted in that same CSIS report: The sanctions against North Korea pale in comparison to the level of sanctioning against Iran .... The number of individuals and entities sanctioned by the U.S. and UN are 843 (U.S.) and 121 (UN) for Iran. but only 100 (U.S.) and 31 (UN) for North Korea. When we do impose sanctions against North Korea. they are often repetitive or ineffectual. Again. I quote from the Heritage Foundation report: In response to the North Korean cyberattack on Sony. President Barack Obama issued Executive Order 13687. which. though expansive in legal breadth. was only weakly implemented. The Administration targeted 13 North Korean entities. three organizations already on the U.S. sanctions list. and 10 individuals not involved in cyber warfare. That was our response to North Korea. To date. we have not imposed specific human rights sanctions on a single North Korean individual. There are 200.000 men. women. and children in political gulags in North Korea. and the United States has not imposed a specific human rights sanction on a single North Korean leader. It is a disgrace given the gravity of the abuses that have been perpetrated by this regime. These policy failures are why a year ago I began working on the legislation that is before us today that would reverse course and apply the pressure necessary to stop the forgotten maniac in Pyongyang. Last August. I had an opportunity to visit South Korea and meet with South Korean President Park. We talked about the situation on the peninsula. and we agreed that the status quo with North Korea is no longer sustainable. To witness the proximity of the threat for our South Korean allies. I visited the demilitarized zone. or the DMZ. Only days after I departed. North Korea fired artillery across the border. further illustrating the danger that South Koreans live under each and every day and the danger of armed escalation of this conflict. I also traveled to China and met with Foreign Minister Wang as well as highranking officials of the Peoples Liberation Army to discuss North Korea. From my conversations. however. it became evident that although they are growing exasperated with the North Korean regime. Beijing has done little with the intention of undertaking meaningful action to stop Kim Jong Un. Last October. I introduced S. 2144. the North Korea Sanctions and Policy Enhancement Act. I thank 17 of my colleagues in this Senate for cosponsoring this legislation. The substitute before us today represents a slightly modified version of S. 2144. In particular. this legislation mandates and not simply authorizes that the President impose sanctions against persons who materially contribute to North Koreas nuclear and ballistic missile development and who import luxury goods into North Korea. mandatory sanctions against perpetrators who enable its censorship and human rights abuses. who engage in money laundering and manufacture of counterfeit goods and narcotics trafficking. who engage in activities undermining cyber security or have sold. supplied or transferred to or from North Korea precious metals or raw metals. including aluminum. steel. and coal for the benefit of North Koreas regime and its illicit activities. These sanctions are tough. and we know that a significant portion of the foreign currency that North Korea receives is for trade in its precious metals. raw materials. aluminum. steel. and coal. We know that about 90 percent of North Koreas economy is through its relationship with China. Senator CARDIN previously mentioned that nobody faces a greater threat than South Koreas neighbors Japan and China. which border a regime that is killing its own people and testing ballistic missiles in violation of Chinas determinations. the United States determinations. and certainly the United Nations determinations. I will note that the mandatory sanctions on North Koreas cyber activities and the mandatory sanctions on the minerals are unique to the Senate legislation. This bill also codifies the Executive orders that the President issued last year. 13687 and 13694. regarding cyber security as they applied to North Korea. which were enacted last year in the wake of the Sony Pictures hack and other cyber incidents. That is also a unique feature of the Senate bill. Lastly. if enacted and signed into law. the mandatory sanctions on cyber violators will break new ground for Congress. It is something that we can take as a model and apply to other nations that perpetrate against the United States. We need to look for every way to deprive Pyongyang of income to build it weapons programs. strengthen its cyber capabilities. and abuse its own people. We have to send a strong message to China. North Koreas diplomatic protector and largest trading partner. that the United States will use every economic tool at its disposal to stop Pyongyang. Finally. I would like to quote the Washington Post editorial board from this past Monday. February 8: President Obamas policy since 2009. ""strategic patience."" has failed. The policy has mostly consisted of ignoring North Korea while mildly cajoling China to pressure the regime. The editorial concludes: Both China and North Korea must see that they will pay a mounting price for what. to the United States. should be Mr. Kims intolerable steps toward a nuclear arsenal. ""Strategic patience"" is no longer a viable option. Mr. President. I ask unanimous consent that the Washington Post editorial be printed in the RECORD."
1140076872,Madam President. we have heard from a number of colleagues who have come to the floor in support of the legislation before us today. the North Korea sanctions legislation. Members of both sides of the aisle recognize the need to address the forgotten maniac in North Korea. We have also heard Members speak about a number of firsts that this legislation contemplatesthe first time that this would put in place mandatory cyber sanctions for cyber attacks. This is something that applies. yes. to North Korea today but in the future could apply to any nation that wishes to use its means to attack the United States or our businesses. So it is critically important. that piece of legislation that we are going to pass today that can have a lasting impact on the security of this country. We have also heard from a number of Members who have spoken about their concern with China. This legislation is not targeted at China. this legislation is targeted at North Korea. We have talked about how it is not targeted at the North Korean people but at the regime of Kim Jong Un. The legislation does everything we can to try to give the people of North Korea a better way of life. to try to find ways to communicate. to break down the silence they are faced with in this economic deprivation zone. to give them tools. perhaps radios and cell phone technology so they can find out what is happening beyond the confines of the torturous regime. But it does have an impact on those who try to get around the sanctions and the prohibited activities of the legislationin fact. some of the strongest language in the legislation. whether exporting to or from North Korea. whether exporting to or importing from North Korea goods. raw metals. precious materials that can be funneledthe money from that funneled to weapons of mass destruction and other activities prohibited by the legislation. So when North Korea is exporting gold or coaland we know that gold and coal are chiefly responsible for the North Korean foreign currency reservesthen that could be designated as a sanctioned entity under the legislation. Perhaps those entities are in China. The fact is. we need cooperation with China. We need cooperation with Japan and South Korea. We had that so strongly. and there is a possibility we wont. We have an opportunity for trilateral alliancethat is cooperation between the three nationsand that will allow us to work together. to share intelligence. to share the cooperative efforts and exercises when it comes to North Korea. and to work with China to help make sure that it is sticking by what it says it wants to do. which is to denuclearize the North Korean regime peacefully. I think it is key to our cooperation with China as we work on any number of issues. whether it is trade issues. whether it is issues dealing with the Internet. whether it is issues dealing with the South China Sea. Those are things that we continue to work with China on and are working to resolve. but we also have to make sure part of that conversation is North Korea. China controls a tremendous number of levers and power in North Korea. Ninety percent of their economic activities in North Korea can find their way to some way of subsistence with China. to create a reliance on China. an economic reliance that they have right now. So this legislation will target those who are doing too much to empower the Kim Jong Un regime and to give them the money they have used to develop missiles and to develop weapons of mass destruction. Just to give an example of some of the commodity trade that we have seen. trade commodity sanctions in this bill would address the issue of rare earth minerals and coal and steel and other goods that are exported to other countries to earn foreign currencies for the North Korea regime. To give people an idea of how much money that is. expert estimates put rare earth minerals and steel exports at around $1.8 billion and $245 million respectively. That is a lot of money that the regime is currently getting from outside in trading these goods. But if that $1.8 billion and that $245 million goes back to build weapons of mass destruction. this act will begin sanctions. The President is required to. unless the issue is a very narrow. casebycase national security issue. There is a mandatory investigation into those activities. So I think this is a strong step that is receiving tremendous bipartisan support. With that. I suggest the absence of a quorum.
1140076893,Madam President. I want to thank all of my colleagues for their thoughtful input during this debate. We have had great discussions from numerous Members who have come to the floor throughout the day to discuss North Korea and the North Korea Sanctions and Policy Enhancement Act. I want to thank Senator CORKER for his leadership on the committee. the product of which is a very good bipartisan sanctions action. I hope and agree with Senator MENENDEZ. our colleague from New Jersey. that this will indeed receive unanimous support. I wish to thank Senator MENENDEZ through the Chair for his efforts to make this a success. and thanks to the ranking member of the committee and ranking member of the Asia subcommittee. as well. for their work. We set out a year ago to work on this problem and address this challenge. The purpose of the North Korea Sanctions and Policy Enhancement Act is very simple. The purpose of the bill is to peacefully disarm North Korea through mandatory sanctions that would deprive the regime of the means to build its nuclear and ballistic missile programs. to deprive the regime of its means to carry out malicious cyber activities. and to deprive the regime of the means to continue its gross abuse of the human rights of its own people. That is the purpose of this bill. Obviously. there is more work to do. The discussions today talk about the work we have to do with our colleagues on the other side of the aisle. in the other Chamber. and the work we have to do around the globe to make sure that the United Nations Security Council recognizes this challenge and that China understands our basis of cooperation depends on actions against something we both agree on. and that is that we shouldnt have a nuclear North Korea. Lets build that relationship of cooperation with China. Lets build that relationship of trilateral alliance among South Korea. Japan. and the United States. Those are the things we can begin to accomplish with this legislation. I had a conversation with Admiral Gortney not too long ago about North Korea. He is the head of NORTHCOM. headquartered in Colorado Springs. CO. It was a conversation about North Korea and what he sees. Through his comments. you can tell he is concerned. and he believes the situation in the Korean Peninsula is at its most unstable point since the armistice. Over six decades. we today are seeing the most unstable point on the Korean Peninsula because of a rogue regime that tortures its own people. kills its own leaders. and deprives its citizens of human dignity. Strategic patience has failed. One expert said we have moved from strategic patience to benign neglect. That is not leadership. So today we start a new policy based on strength and not patience. This legislation would mandatenot simply authorize but mandatethe imposition of sanctions against all persons who materially contribute to North Koreas nuclear and ballistic missile development. import luxury goods into North Korea. enable its censorship and human rights abuses. engage in money laundering and manufacture of counterfeit goods and narcotic trafficking. engage in activities undermining cyber security. have sold. supplied or transferred to or from North Korea precious metals or raw metals. including aluminum. steel. and coal for the benefit of North Koreas regime and its illicit activities. that is. $1.8 billion in raw metals. $245 million in other goods that are sanctioned under this act. including those entities that decide they would import from North Korea if that money they would generate from the sale of that import goes to the development of proliferation activities. The cyber sanctions and strategy that we require are unique to the Senate bill. They will be the first mandatory sanctions in history passed against cyber criminals. This bill also codifies Executive orders 13687 and 13694 regarding cyber security. as they apply to North Korea. which were enacted last year in the wake of the Sony Pictures hack and other cyber incidents. It is also a unique feature of our Senate bill today. The mandatory sanctions on metals and minerals are unique to the legislation. Expert estimates. as we just said. put North Koreas rare metal minerals and steel exports at around $2 billion. so these sanctions could have a significant impact in deterring the regime and its enablers. The sanctions in this bill are secondary. as we have discussed. which means they would be applied to individuals and entities. not just in the United States but around the world. who would assist the Government of North Korea and the designated entities that engage in the activities prohibited by this legislation. It mandates a strategy and sanctions against North Koreas human rights abuses. You can see what it does on the chart. You can see the opportunity we have before us and the American people and our obligation to make sure we are doing everything we can to stand up for the people of North Korea and stand up to the totalitarian regime of North Korea. I urge my colleagues to support this legislation tonight. this bipartisan product of countless hours of debate and discussions and negotiations. and to come away with a good product that we can be proud of. to work with the House Members so that this is on the Presidents desk. I urge my colleagues to support this bill. I yield my time.
