speech_id,speech
1140045063,"Mr. President. I rise to speak about the west coast port slowdown and comments that were made by the administration as they relate to that slowdown. along with legislation I have introduced called the PORTS Act. legislation I hope to pursue during the transportation debate we are going to commence with over the next several days and also as it relates to that west coast port slowdown. the economic impact that slowdown had on our economy. On June 30 of last year. the labor contract that covered nearly 20.000 workers at 29 west coast ports expired. Port management and the ILWU began negotiations a year before. but in September of 2014 those talks ground to a standstill. Instead of remaining at the table and trying to find a solution and negotiating in good faith. both parties decided to begin jockeying for leverage. The longshoremen purposefully slowed down their work and drastically decreased productivity while still taking home a full days pay. In the real world. employees cant show up at work and not do their work or slow it down dramatically. not have the productivity they are expected to. and still get everything they want. but in the back worlds of labor union politics at the ports. that is business as usual. And business has been good at the ports. According to employer data. a fulltime longshoreman earns about $130.000 a year. fulltime employment $130.000 a year. while foremen earn about $210.000. That is a pretty good paycheck. and the contract raises these wages even higher. Workers pay nothing for health coverage that includes no premiums and $1 prescriptions. Providing this health care costs employers about $35.000 per employee per year. They are also eligible for a maximum pension of over $80.000 per year upon retirement. so $130.000 salary for a longshoreman. $210.000 if you are a foreman. $35.000 for health benefits. and $80.000 per year worth of pension upon retirement. But what happened for the rest of us this past year when the slowdown occurred on the 29 west coast ports. the effect of the slowdowns werent just limited to the port owners. When the longshoremen decided to slow down their work. the goods flowing through these ports backed up and international trade ground to a halt. This has had devastating economic impacts in States far beyond the west coast and around the Nation as a whole. Nine excruciating months after the labor contract expired. the parties finally reached a deal but not before costing U.S. businesses and consumers billions upon billions of dollars and ruining the credibility of our exporters abroad. When it comes to the administration. though. the response was pretty alarming as well. Labor Secretary Perez was just asked about this economic disaster of the west coast ports slowdown when visiting the ports of Los Angeles and Long Beach. His response: ""The collective bargaining process worked."" As a result of the west coast port slowdown. the administrations response was: ""The collective bargaining process worked."" The Labor Secretary made these comments while visiting Los Angeles. Long Beach. the two busiest ports of the country. So lets take a look at what the collective bargaining process did at those ports. This is a ship finder map of Los Angeles and Long Beach showing ships anchored offshore this week. This is recent data. These are ships that are anchored off the shore of Los Angeles and Long Beach just this past week. This is what it looks like when the ports are operating and functioning normally. You will notice there is a lot of blue ocean and not many ships anchored offshore. Ships can quickly unload imported products and load Americanmade exports for distribution around the world. There is no backup. no congestion. and no disruption to our countrys economy. But this is what Los Angeles and Long Beachthe ports of Los Angeles and Long Beachlooked like during the slowdown during the crisis. Dozens upon dozens of ships anchored and idled waiting for ships in port to be unloaded. You can see all the ships that are backed up compared to the previous chart. The Journal of Commerce reported that there were 32 ships anchored off the ports of Los Angeles and Long Beach at one point during the slowdown. There has been a lot of discussion recently about the need for a longterm surface transportation bill that invests in 21st century infrastructure. but just take a look at the kind of dysfunction antiquated labor laws can cause. This is an aerial shot. You can see this is off the wing of an airplane where you can see all of the ships that are backed up waiting at these ports to be unloaded. ships that carry the goods for our economy. the goods that make our economy run. Congestion like this is a nightmare for American farmers. businesses. and consumers. Farm exporters were charged exorbitant fees for warehouse space to store their agricultural goods as they rotted and spoiled. Meat and poultry companies alone faced port charges in excess of $30 million per week. So if people were earning $130.000 a year and not doing their work unloading ships. American farmers. poultry. and meat producers were charged $30 million per week. Businesses further up the supply chain were also affected. One large U.S. base manufacturer has calculated the cost of lost sales. warehouse space. additional inventory. and transportation at $100 million in total as a result of the delays at the west coast ports. Those are just the direct costs. American businesses also lost credibility and future customers as the foreign buyers turned to other nations for more stable supplies. The Wall Street Journal recently reported that the west coast port delays forced layoffs and downsizing in the U.S. leather industry. Chinese tanners are now turning to European and Brazilian producers to fill their orders. This is a $3 billion industry that had to lay off workers because of the dispute of the west coast ports. Apparently. the administration again thinks the process worked just as it was supposed to work. Efficient trade through U.S. ports is critical to maintaining and growing economic opportunity in States across this country. According to the American Association of Port Authorities. U.S. ports support 23 million jobs. and the value of related economic activity accounts for 26 percent of our national GDP. Twentysix percent of our national GDP comes from our ports system. Contract negotiations related to labor disputes at our ports clog up these vital arteries and cause problems throughout our national supply chain. If you need further proof of whether this impacted our economythat picture we just saw of all the ships stacked up at L.A. and the ports in Californiaaccording to Federal Reserve economists. the disruptions on the west coast were great enough to affect the entire economic output of the country. This chart shows the quarterly change in national GDP. Once negotiations stalled. you will notice GDP growth started to decline. So here we are in the third quarter of 2014. Remember. we started talking about September of 2014. when the slowdowns really started. By the time we get to the last quarter of 2014 and the first quarter of 2015. you can see the labor dispute contributing to the decline of our national GDP. Our economy shrank as a result of port slowdown. In the first quarter of this year. when the slowdowns were in full swing. the economy actually shrank by 0.2 percent. You can see it. in the third quarterthis is the last quarterto the first quarter of this year. Twentysix percent of our GDP depends on these ports. The Fed economists also found that disruptions disproportionately affected exporters sending Americanmade goods abroad for sale overseas. Exporters didnt have access to imported raw materials and parts they needed to build their products. This caused supply chains to back up and eventually reduced output and employment. So the Fed is telling us that the collective bargaining process at the ports measurably reduced economic growth and American jobs across the country by crippling American businesses. but only in the backward worlds of labor union politics could this economic disaster be considered everything is working just fine. Only in a uniondominated industry could this catastrophe be considered a success. That is why I have introduced the PORTS Act. Our legislation would discourage disruptions at U.S. ports and incentivize speedy resolution of disputes by strengthening and expanding the wellknown TaftHartley process. Over 100 national agricultural. manufacturing. and retail organizations support the PORTS Act because they are fed up with the status quo. They disagree with the administration. which thinks shrinking our economy is everything working just fine. There are some who oppose the PORTS Act. and those are the labor unions. In fact. earlier this month. the AFLCIO put out a statement saying legislation like the PORTS Act was not needed. You can see what has happened without the PORTS Act is economic decline. people being laid off. farmers losing millions of dollars. products rotting in warehouses because of the backups. In just 5 yearsS years from nowthe labor contracts on both the east coast and the west coast will expire. Imagine what would happen if we had labor disputes occurring on the west coast and the east coast at the same time. people who were willing to threaten that 26 percent of our national GDP over a dispute. while the administration says everything is working just fine. It is critical we have the necessary tools in place to prevent another debilitating crisis. If we learned anything from this past dispute. it is that Labor Secretary Perez is wrongthe current process does not work. And the AFLCIO is wronglegislation like the PORTS Act is desperately needed. I urge my colleagues in the Senate to join me in supporting this important legislation. Let us not pinch our economy in an economic vice from the east and the west. Lets find economic opportunity to grow our Nation together. Mr. President. I yield the floor. I suggest the absence of a quorum."
1140046319,Mr. President. today I honor the veterans of Honor Flight Northern Colorado that have made their 14th trip to Washington. DC to visit the memorials that stand in our Nations Capital. This group includes veterans from various wars and generations. but all are linked by their service to our country. Ten years ago. the Honor Flight was created to fly veterans that had served in World War II to Washington. DC so they could visit their memorial located in our Nations Capital. Now. the Honor Flight welcomes veterans from all over the country to fly to Washington. DC. free of charge. to visit the memorials of the wars these heroic veterans fought. Of the 123 veterans on the most recent Honor Flight. 25 served in World War II. 59 served in Korea. and 39 served in Vietnam. Few words are sufficient to show the gratitude and respect we all have for the courageous men and women who have fought for our country. They have preserved our rights to life. liberty. and the pursuit of happiness. We stand here today to honor those who have risked their lives to protect the United States of America. Please join me in honoring Earnest Adams. Paul Babish. Oliver Bashor. Russell Brady. Martin Bunker. Arthur Crosthwait. Michael DeJiacomo. N Kenneth Furlong. Francis Gallagher. Roland Garner. Harold Hubbard. Erling Johnson. Howard Johnston. William Karr. John Kennedy. Herbert Leis. Charles Linhart. Russell MacCachran. Ray Madsen. Harriet Martin. Fred McClory. David Meier. Ronald Smith. Donald Stonebraker. Leo Weaver. Charles Archibeque. Donald Anderson. William Bacon. Bobby Barker. Louis Barrientos. Virgil Beck. Jack Benham. Alfred Benson Jr.. James Birdsell. George Blake. Thomas Bornhoft. Robert Brezee. Alfred Brophy. Ralph Carlson. Charles Campion. Lewis Carder. Richard Cella. Marinus Christensen. Kenneth Clements. Earnest Cummins. Robert Davenport. Donald Deboodt. Kenneth Doty. Joseph Eckert. James Hagihara. Norman Harpole. Richard Hecker. Bobby Jones. Roy Kipfinger Jr.. Richard Korth. John Lebsack. Robert Lionberger. Donald Matula. Paul McDill. Lawrence McGlone. Raymond Miller. Clifford Morey. Richard Orton. Placido Pando. William Peebles. Lupe Rodriguez. Evaristo Sanchez. Michael Schaughency. James Schofield. Earl Simmons. Frederick Smith. Ralph Spellman. James Stallard. James Stewart. William Strunk. Wilbur Tritthardt. Henry Trujillo. Melvin Veldhuizen. Allan Walcker. Orlin Williams. Charles Wood Jr.. Donald Wuertz. Clarke Wykert. Rudolph Younger. Larry Arndt. Bruce Axelrod. Marvin Bartholomew. Jim Biggs. Alexander Bless. Clyde Brewer II. Randy Brooks. Lanny Clary. Guy Coombes. Robert Cowan. Robert Chapman. Waldo Decker. David DeJiacomo. Terry Diedrich. Kenneth Gareis. Bonifacio Hernandez. Larry Huddle. David Jovola. Donald Ketels. Clarke Lambert. Gary Lebsack. Dewey Mattly. Lorrie McLaughlin. Calvin Melcher. Irving Morales. Bryan Morgan. Richard Orton. Norman Peterson. James Porth. James Ray. Stephen Ray. Dave Sloan. Lawrence Stoddard. Harley Sullivan. Michael Torgerson. Andrew Valdez. Gregory Walent. Daryl Wiest. and Terry Wright.
1140066141,"Mr. President. I come to the Senate floor today to talk about the broken promises of ObamaCare and the negative impacts this poorly written law have had on my State of Colorado. While there have been many broken promises of ObamaCare. there have been three major broken promises that are the center of focus for hundreds of thousands of Coloradans. I want to start with broken promise No. 1. If you like your plan. you can keep it. The President said over 35 times that Americans shouldnt worry about ObamaCare because if you like your plan. then you can keep it. And it wasnt just the President. time after time. supporters of ObamaCare came to the floor of the House or the Senate or before townhalls in their States or districts and repeated those words: If you like your plan. you can keep it. In fact. these words were used to justify the reason they supported ObamaCare in the first place. Coloradans quickly learned this promise was far from the truth. In late 2013. roughly 335.000 insurance policies in Colorado were canceled because of ObamaCare. These cancellations also affected my family health care plan. Unfortunately. the cancellations in 2013 were the very beginning. In January of 2014. the Colorado Division of Insurance canceled an additional 249.000 plans because those plans didnt meet the requirements of ObamaCare. The President said: If you like your plan. you can keep it. Supporters in Congress said: If you like your plan. you can keep it. But what he meant was. as long as the government approves of your plan. you can keep it. In 2015. an additional 190.000 plans were canceled. In total. according to the Congressional Research Service. over 750.000 health insurance perhaps plans in Colorado were canceled between 2013 and 2015. The factchecking organization PolitiFact said this promise was ""impossible to keep"" and went on to deem President Obamas promise that if you like your health care plan. you can keep it the ""Lie of the Year"" for 2013. Supporters of ObamaCare will tell you that it is OK that this happened because these 750.000 individuals must have had inferior health insurance and that the government knows best. You see. that is the exact problem with government. That is the arrogance of government and the arrogance of ObamaCarethat people in the government. bureaucrats and others. believe they know better than the American consumers what is best for them. They believe it is OK to cancel 750.000 policies because they must have been bad. so go ahead and cancel them. They will also say that it is all right because there are additional plans they can choose from. But that wasnt the promise of ObamaCare. Broken promise No. 1: If you like your health care plan. you can keep it. Broken promise No. 2: ObamaCare will reduce the costs for families. businesses. and our government. Remember. when ObamaCare was passed. they said the family would save $2.500 a year relatively soon after its passage. Unfortunately. Coloradans have felt that broken promise as well. It is a broken promise that hit their pocketbooks and has broken the bank as well. For example. take the Western Slope of Colorado. I have a chart here. According to the Colorado Division of Insurance. individual insurance premiums for 2016 on the Western Slope of Colorado will rise by an additional average of 25.8 percent. There are people across America who are familiar with Colorados Western Slope. These are the incredible mountain vistas. our forests. our national parks. our ski resorts. They received a 25.8percent increase in their health care costs this year. That is far from the promise of lowering the health care costs that ObamaCare was passed with. No one can afford these high prices. In fact. in 2013 one of my Democratic colleagues in the Colorado delegation even tried to exempt one of the wealthiest counties in Colorado from ObamaCare. citing that health insurance premiums would be too expensive. Let me say that again. A Member of the U.S. House of Representatives. a Democrat. tried to exempt portions of his district from ObamaCare because it was making his constituents pay too much for their insurance. Here is a quote: We will be encouraging a waiver. It will be difficult for Summit County residents to become insured. For the vast majority. its too high a price to pay. It doesnt matter whether you live in the Eastern Plains. Fort Collins. or the Western Slope. ObamaCare has simply made it more costly. Plans are getting more expensive. and promises are being broken. Broken promise No. 3: President Obama promised greater competition in the marketplace through consumerrun coops. Yet over 80.000 Coloradans are feeling the impacts of this broken promise. To date. 12 out of 23 coops created by ObamaCare have been shut down across the United States. including the coop in Colorado. which failed in October of this year. Nationwide. the failed coops were loaned over $1 billion. which came from the hardworking taxpayers of this country. That taxpayer money was supposed to help get these coops off the ground. but now with these failures. that taxpayer money is at risk of never being paid back to the people of this country. and the health care of nearly 700.000 individuals across the United States is in jeopardy. ObamaCare allowed policies to be offered that were never actuarially sound because they assumed there would be a bailout by the government to help make them actuarially sound. By banking on a bailout. they sold the American people a bill of goods. Today we have a path forward that is turning away from the failed health care law that has been built on broken promises. The first step of this path forward is to repeal ObamaCare. and I urge my colleagues to support the repeal of ObamaCare that we will be voting on this week. Repealing ObamaCare will clear the way for a replacement plan and will put our countrys health care on the right track. First. we have to restore the ability of individuals to choose what is best for themselves instead of having Big Government choose for them. Coloradans dont want Dr. Congress. They want to keep the doctor they were promised they could keep in the first place. The best way to do this is to ensure that people get to keep the health plans that they want. and that is why I am working with Senator RON JOHNSON from Wisconsin on his amendment that simply says that if you like your health care plan. you can keep it. I heard from countless individuals in Colorado who lost the plans they liked and wanted to keep. They were certainly promised they could keep them. and just because ObamaCare cant fulfill the promise that it was sold under doesnt mean we shouldnt do our jobs to make that promise a reality. The amendment Senator JOHNSON and I have offered would allow individuals to continue receiving health coverage on plans that would otherwise be canceled because of ObamaCare. Second. we must ensure that taxpayer dollars are used responsibly. I filed an amendment that will help recover taxpayer money that was loaned to the failed coops. More than $1 billion in Federal loans were awarded to these failed coops. Congress has a duty to spend taxpayer dollars responsibly. and this amendment will ensure just that. Lastly. we must make sure individuals have certainty in the health coverage they choose. My final amendment will make certain that coops cant rely on bailouts when they are calculating insurance premiums. setting false expectations for consumers. Several coops counted on these bailout provisions to keep premiums artificially low. Because these premiums were artificially low and since many coops were planning on receiving the bailout. many could no longer cover their expenses. Allowing coops to rely on a bailout was irresponsible and has resulted in nearly 700.000 individuals nationwide whose health coverage is now uncertain. It is time to act. It is time to take the path forward. It is time to repeal ObamaCare. which is simply one big broken promise after another. This path to repeal ObamaCare will allow us to replace ObamaCare and will have fewer health care regulations for businesses and individuals. It will put us on a path forward for individual freedoms and a more prosperous America. I yield back my time. I suggest the absence of a quorum."
