speech_id,speech
970007402,Mr. Speaker. I think bf the recommendations made by President Reagan last night. Mr. Speaker. we on the majority side of the aisle should not be obstructionists at this critical time In the history of our Nation. We must be willing to work with Mr. Reagan and the Republicancontrolled Senate to formulate a new economic policy for America that will reduce the oppressive level of inflation and put the American people back to work in productive jobs. Mr. Speaker. I hope you will take the lead in this effort. tue5 LinietianUL IJeUIJW UesOvL Vo VU PRSIEN RAGN H that the Reagan proposals we heard PRESIDE EAN WSHAND last night of both budget cuts and tax PN BEOIS PENISE NDE cuts. If totally enacted. will still create PON FOLS INBDE the largest deficit in American history. CUTS I cannot agree with that programn be- (Mr. WIRTH asked and was given cause I am in favor of a balanced permission to address the House for 1 budget. and I think if we are going to minute and to revise and extend his have tax cuts. for every $1 cut In remarks.) taxes. we need to have a $1 cut In the Mr. WIRTH. Mr. Speaker. in analyzbudget. Ing President Reagans address last Mr. Speaker. what is more. based on night. we must repeatedly emphasize what the President said last night. we to our colleagues and to the Nation vee In for 4 years of proposals that the importance of taking a longrange benefit the rich. I think the Democrat- view of our Nations economic probIc Party should restructurE the tax lems. and of facing the difficult deciproposals so- that they benefit lower- sions today wlhh will lay the groundand middleincome Americans. We work for a sound future for our econoneed to help the working families of my. America by providing relief from I hope that the President shares the social security taxes and the marriage strong. traditionally bipartisan view penalty. that our Nations investment in basic Let us not be stampeded. Tax relief scientific research and In research and io needed. but it must be fair. Let us development efforts is a critical eleenact a tax bill that does not make the ment in economic growth and Amieririch richer. as the Reagan KempRoth can competitiveness In world marplan does. ketsthat maintaining our Nations ___________traditional leadership In the sciences Is one of the keys to our economic DEMOCRATS GOLDEN OPPOR. future. TUNITY FOR COOPERATION As with many other areas of the WITH REAGAN ADMINISTRA- Federal budget. the President has proTION posed reductions in scientific pro-
970008458,"Mr. Speaker. February is Black History Month. As we come to the end of It. I would like to point out how inappropriate it Is that the shortest month of the year is the one in which we hionor black Amenlcans and their contributions to our country. The list Is long. the accomplishments many. and far too many of them were made in the face of extreme adversity. Rather than naming names and citing contributions. I want to talk about just one aspect of black achievementand that is black business. There are many triumphs to list here. all the more remarkable In the face of the problems that inexperienced blacks have met trying to borrow money to finance business ventures. It is like the old dilemma of trying to get your first job when everyone you apply to demands experience. In the last decade. though. almost every Federal agency has made available some sort of incentive program to stimulate formation and support of minority businesses. The two major sources of aid to black businesses have been the Small Business Administration and the Minority Business Development Agency In the Department of Commerce. There is still a long way to go down the road to business equality. ""The Negro Almanac: A Reference Work on the AfroAmerican."" 1976. reports the annual sales of the countrys top black firm. Motown Industries-$46 millionwere no more than those produced by General Motors in onehalf of 1 day. Incidentally. Mr. Speaker. I was proud to observe that the 10th largest blackowned business listed in the almanac got its start in my Fifth Congressional District in Dallasthis despite the fact that. in 1973. only 6 of the 100 largest black businesses were located in the Sbuth. February is far too short to conmemorate black history. We should be aware all year of the contributions black citizens have made to the economic strength of the country. More Important. we must continue to encourage black business skills to come to full flowver. We knowv there is a pressing need for greater economy in Government. Cuts will be made in the Small Business Administration. But we have to be absolutely sure that any cuts are made across the board. and that fledgling black businesses do not bear more than their share of the pain.*"
970092971,"Mr. Chairman. I rise In opposition to the sale of the AWACS package to Saudi Arabia. The decision to provide sofbhisticated weapons to an unstable government In an unstable region is. In my judgment. simply wrong. It Increases the possibility of this secret technology falling into the hands of our enemies In the region. It endangers the security -of Israel. our only stable ally in the Middle East. it will further escalate the arms race In the Persian Gulf. and it will not increase Saudi Arabias security or improve United States credibility as an ally. The sale of sophisticated equipment to a government as unstable as Saudi Arabia will endanger. rather than promote. United States interests In the Middle East. Sadats assassination by religious extremists. the fall of .the Shah of Iran. and the recent Shiite uprisings In Saudi Arabia Itself underscore the Instability in the region and In Saudi Arabia In particular. If Moslem extremists can penetrate the security forces of Egypt. which were regarded as among the best In the Middle East. why should we believe that they will not be able to Infiltrate the AWACS crews and hijack Americas most sophisticated weaponry to Libya? Even our NATO allies. which have a form of the AWACS. use It under U.S. control and supervision. The Jackals that surround Qaddafi must be Indeed howling with glee at the prospect of obtaining some of the most powerful. weapons in the American arsenal. Above all. the threat the package poses to Israel Is real and not. imagined. The AWACS and other equipmentmost notably the 1.177 AIM9L Sidewinder missiles. which were responsible for shooting down the two Libyan Jets over the Mediterraneanare part of a system that forms a formidable offensive unit when Integrated with the P15 aircraft we have already sold them. It can dispatch enhanced F15s at a moments notice and coordinate an attack on all fronts. Should technology on ground stations and communications equipment being sold to the Saudis fall into the hands of the Soviets or Libya. It could be used to create a communications linkup with other Arab nations. all of whom could Join in a concerted attack on Israel. Mr. Chairman. Saudi Arabia has repeatedly called upon other Arab nations to join in -a holy war against Israel. Its contempt for the Camp David peace process Is well known. and It led the Arab boycott of Egypt because of the peace treaty with Israel. It continues to finance the terrorist activities of the PLO against Israel and Jews around the world. It Is therefore impossible to believe. as the administration claims. that further arms sales would cause Saudi Arabia to moderate Its antiIsrael and antiEgypt stance. The 1978 sale. of F15s did not moderate Saudi attitudes toward Israel or the* Camp David accords. Senator RUDY"" BoSCH WITZ Of Minnesota said at a recent Senate meeting on the proposed sale that the difference between the Saudis and the rest of the Arabs was a tenfold Increase In oil prices compared to an elevenfold increase. ""What kind of friends are they?"" he asked. ""If the Saudis are moderates. the rest of the Arabs are real SOBs."" If anything. antiIsra~l attitudes have hardened. In sum. Saudi Arabia has shown no inclination to moderate its antiIsrael attitudes or Its antipeace policies. and Congress should not rubberstamp an arms package with such dangerous Implications.e"
970101143,"Mr. Chairman. I must admit that this Is one of the most significant pieces of banking leg. Islation that is going to come through this House in a long time. I think it is actually rather ridiculous that this matter is going to receive only 1 hours worth of discussion. I think the sum amount of time that is being allotted to the opponents of this bill Is the 3 minutes that I have been granted. so let me say very quickly what I have to say. Our last speaker. the gentleman from Connecticut talked about this bill being a bigger hammer for a bigger Problem. The gentleman is absolutely right. It is a bigger hammer to flatten out the entire financial structure of this country. October 27. 1.981 The proponents of this legislation are making one of the most serious mistakes I think that could ever take place. When this bill comes back from the Senate. you are going to see a. Christmas tree bill like nothing we have ever seen. I have seen It repeatedly in the legislative pattern. We say. ""Well. it was not our intention to change It. but circumstances changed. They changed so drastically that we had to do it. We had to get this bill through to save the mutual savings banks of New York City."" It is with considerable reluctance that I rise to oppose H.R. 4603. the Deposit Insurance Flexibility Act. I am reticent because. as a member of the Banking Committee and an advocate of viable financial Institutions. I am very aware that extraordinary economic conditions require appropriate remedies. This bill does a lot of that. It allows the FDIC. the FSLIC and the NCUA. unprecedented latitude to help troubled financial Institutions. especially savings and loans and mutual savings banks. All this Is desirable and necessary. It allows regulators to step In when an institution is on the verge of failing and taking actions to protect the institution. its depositors. its shareholders. and Government interests. Instead of leaving well enough alone. this bill goes further and becomes fatally flawed: It undermines the very foundation of our basic financial system by specifically authorizing interstate and Interindustry acquisitions. This runs directly counter to primary protection of the financial system afforded by the McFadden Act and the Bank Holding Company Act. These protections are necesary to protect small and medium sized financial institutions of our decentralized system from predatory practices by giant institutions and giant nonbanking corporations. Consistent with the bills Intent as emergency assistance. these exceptions would expire September 30. However. legislation is already being considered by the Senate Banking Committee that would capitalize on this bill and make the exceptions larger and permanent. I would stress that this is not a partisan issue. Within the Banking Committee. these destructive provisions were opposed by many Republicans and Democrats. in fact nearly all subcommittee chairmen argued and voted against them. It is not regional. except that most of the beneficiaries. large financial institutions. are located in a few major cities. The potential victims. Independent institutions. are located throughout the country. Who are the intended beneficiaries? Supposedly. savings and loan institutions. but the U.S. League of Savings and Loans testified against the bill because of these flawed provisions. October 27. 1.981 Col Mutual savings institutions? They also need assistance but oppose this help if It includes interstate and interindustry authorization. The Conference of State Bank Supervisors .appeared against the bill. The National Governlors Association and the National Conference of State Legislatures oppose it The Chairman of the Federal Reserve Bank contends the Fed already has Implied powers to approve InterState acquisitions as does the Chairman of the Federal Home Loan Bank Board contend the same foi savings and loans. This bill would legitimize those assumptions. Who does want this bill then? Certainly not the supposed beneficiaries. Certainly not nearly al financial institutions. Certainly not State banking officials. Although well intentioned and with some good provisions. this bill is fatally flawed so long as It authorizes big banks to acquire savings and loans. so long as it allows thrifts to acquire banks. so long as It allows Institutions in one State to take over institutions in other States. all destructive to the very foundations of our banking system. In authorizing such takeovers. this bill does far more harm than good and I urge my colleagues to vote against it."
970102215,I have absolutely no Manhattan. Sears. McDonalds hamIdea. I think the gentleman asks an ex- burger shops. First National Bank In cellent question. If this bill Is not Japan or Germany or France. or even going to cost us anything. If the regu- Atlas Sporting Goods. lators say they really do not need It The bill provides guidelies and proand are not going to use It. and If the cedures for the use of authority to archairman admits that the amend- range mergers and acquisitions which ments being acce~pted really mean assures consideration of local needs. little or nothing. why in the world are local banking interests. and the dual we passing it? banking system. Without a bill the What we ought to be doing Is Pass- agencies will have to use their perIng a law that prohibit the regulators ceived powers and the results might from engaging In the anticompetition. well not be what we. the. Congrens. type of abuse In which they are engag- -wouid prefer. This bill is needed and It ing. I wish that I could explain to. each Is needed now. Member the concern I have over this (Mr. WYLIE asked and was given piece oflegislation. I have fought it In permission to revise and extend his resubcommittee. fought it in committee. marks.) and I am doing my best to fight it onl Mr. WYLIE. Mr. Chairman. since the floor. I hope the Members have -this has been a bipartisan effort from the good sense and good wisdom to the very beginning. I believe It Is apoppose this legislation and vote propriate for me to express my wholeagainst Its final passage. I think it will hearted agreement with the remarks pass. but I think it is going to be a real of the distinguished Chairman. disservice to the people of this coun- I have stated several times during try. the debates on this bill that one of the I would hope that if the Members major concerns which motivated me to have not taken the time to visit with support this bill Is that if there were the small financial Institutions In their failures of commercial banks. the audistricts. that they would pick up the thorities would have no alternative phone now and call a couple of them. but to arrange a takeover by a foreign They will tell you that they are OP- bank. This has happened in the posed to this legislation up and down Franklin National case and in several the line. Members should ask whether other widely publicized cases in the you received any pieces of mail from past. It is for this reason that Dr. your small institutions askings for You Arthur Burns proposedseveral years to support this legislation. It Is a mis- ago that the regulators be authorized. take for us to pass thiskind of legisla- to arrange Interstate mergers of large tion. What we are doing is simply failing banks so there would be an algoing along with the trustbuilding ternative to foreign takeovers. ideas of this currelit administration. I I Join the Chairman in expressing apologize for the folks on our side of some dismay that this provision has the aisle who would engage In allowing been deleted from the bill. It Is my these kinds of things to happen. hope that we will not come to regret it
970127097,"I am talking inthe general context of this administration about. a kind of doubletalk that is taking place here today. That doubletalk deals with full employment. on the one hand and then talks about prosperity. but talks as if those 9 mlllion Americans who are unemployed do not exist. Yet this Is the highest number in the last 22 years. Tell them about this doubletalk program that is bringing us Into real prosperity. I am glad to be able to get to address this group because I am oppose to this resolution. I think It is an absolute mistake. I think it Is an absolute mistake we are engaging in passing this resolution and I would ask my colleagues to vote against it. The GrammLatta program that we passed was full of hal truths. was full. we learn now. of basically dishonest figures. We learn now that it was put together in haste. and now that we knowi that It was a mistake. how can we Justify continuing with it In the future? I do not think that we can. When we look. at exactly what the real figures show. the figures In this resolution are absurd. This resolution says we are going to have a defict of $37.85 billion. The reality that is floating out of the 0MB now is that the real deficit that Mr. Stockman and others have been attempting to hide is somewhere in the neighborhood of $109 billion for this fiscal year. $109 billion with cumulative effect estimated on the low side of $380 billion in the next 3 years. I submit to my colleagues when we look at those figues. if the people who stood before is say we are for a balanced budget. it Is unreal. It is amazing to me that only yesterday the Republcan Party basically was saying deficits do not cause inflation. Now today deficits do not matter. Now if. that is not doubletalk I have never heard of it. and I would say to the gentleman from Ohio. that deficits do cause inflation. and I would say that they are going to casue some problems. they are going to cause more unemployment. and I think In the long run we wouldbe far better off if we defeat this resolution. Mr. Speaker. today we are considerIng the second concurrent resolution on the budget for fiscal year 1982. What we have before us is a reaffirmation of the Oramm/Latta substitute adopted on May 20. 1981. This substitute projects a deficit of $37.65 billion. It Is being sold on the floor of the House as a ""stopgap measure"" In order to give the President and .the administration sufficient time to place their economic program in tune with reality. I oppose this measure. The Gramm/ Latta -proposal was nonsense in the first place. It was based on unrealistic assumptions. and It was hastily contrived. -Moreover. Its. principal salesman. David. Stockman. did not believe In It. we cannot have an economic recovery program. no. matter what.adminlstration sponsors it. that Is based upon half truths or. in some instances. deliberate falsehoods. We cannot formulate public Policy based upon mere aocomodation to political pressure because we feel the President is popular. We do not have a $37.65 billion. defi. cit. we have a $109 billion deficitand the Republican economic advisers say that high deficits do not matter. I assume that all of my dear colleagues on the other side of the aisle will have to throw away all of their old newsletters wherein they complained about deficit -spending. I suspect they will now be quoting JACxKu M. who said that the Republican Party ""no longer worships at the altar of the balanced budget"" This GrammLatta fiasco. which Is before us. is being considered under a closed rule which I recall the Republicans generally oppose when they have an amendment. The reason we have a closed rule is to prevent anyone from offering an amendment that would reduce the deficit or balance the budget Certainly. we have also precluded any positive action. either on the revenue or spending side. that would address the problem or rising unemployment. We cannot continue to dodge the Issues In this country In order to accommodate an economic recovery program that has not only failed to meet the administrations expectations. but has failed to meet anyones expectations. I do not Intend to participate In this makebelieve game. I urge Members of both parties to face -reality. Let us start designing program that will balance the budget and protect necessary national priorities Therefor. .1 vigorously oppose this resolution. I wish to Insert also for the RECORD my dissenting views: The House Budget Committee has reported out a resolution that incorporates the same figures and is based on the same economic assumptions contained In the OrammLatta First Budget Resolution. Obviously. since none of these figures Is valid. this action Is Intended as a stopgap measure. In order to confrom to the provisions of the Budget and Impoundment Control Act. which requires a spending ceiling and reve.nue floor be In place before adjournment. in essence. action has been defcrred until next year. By then we will have a more realistic assessment of- the policies that have been enacted In terms of their impact on our economy. . Of course. it goes without saying the GrammLatta proposal was nonsense In the first place. It never had any realistic assumptions and was rothing more than a careless. hastily contrived measure. which Its principal salesman. David Stockman. didnt believe In. Nevertheless. this actoni has been necessitated because. of the failure of this Administration to develop and implement a consistent economic plan that conforms toeconomlc realities. We receive proposals In September that are labeledas qbsolutely essential for the success of the economic recovery Program. only to have them- delayed or abandoned a few weeks later. It Is going to be very difficult to knoWL What to believe when this Administration gets Its act to. gether. If It ever does. and presents a budget to us next year. Budget Director Stockmans Private assessments. which have now been madb public. are that Reaganomics wont work. that the tax bill favors the rich at the expense of the poor and middle class. and that the Defense Department has at least $30 billion worth of waste and inefficiencies. Stockmans various comments. as reported In the Atiantic Monthly. reflect his growing disenchantment with the Administrations program: ""None of us really understands whats going on with all these numbers. Youve got so many different budgets out and so many different baselines and such complexity now .. And it didnt quite mesh. Thats what happened. But. you see. for -abouit a month and a half! we got away with that because of the novelty of all these budV et reductions . . . There was Ia certain dimension of our theory that was unrealistic .. The supplysiders have gone too -far. They created this nonpolitical view of the economy. where you are going to have big changes and abrupt turns. and their happy vision of this world Is growth and no inflation with no pain."" Mr. Stockman also acknowledged that ""the defense numbers got out of control . .""lHe said. ""As soon as we get past this first phase. in the process. Im really going to go after the Pentagon. The whole question Is blatant Inefficiency. poor deployment of manpower. contracting Idiocy . . . think theres a kind of swamp of $10 to $20 to $30 billion worth of waste that can be ferreted out If you push hard."" Regarding the tax cut. which Is partial to the rich. Stockman said. ""The hard part of the supplyside tax cut Is dropping the top rate from 70 to 50 percentthe rest of It Is a secondary matter . .. KempRoth was Vlways a Trojan horse to bring down the top rate."" He went on to admit. ""Its kind. of hard to sell trickledown so the supplyside formula was the only way to get a tax policy that was really trickle down. Supplyside is trickle down theory."" In any event. the Budget Committee Is willing to take a waltandsee attitude. I do object. however. to the fact that we have not updated the economic assumptions and applied them to this res olution. Let no one be mislead by this Republicansponsored proposal to reaffirm the First Budget.Resolution which states the deficit in 1982 will only be $37 billion or that we will have a balanced budget by 1984. The real deficits are $100 billion in Fiscal Year 1982. $119.0 billion in Fiscal Year 1983. and $132.4 billion in Fiscal Year 1984. This Is a cumulative deficit of $360.4 billion In the next three years. Thus. every figure contained In this report will have to. be changed next year. I can only hope that our delay will not contribute to the current recession. Unfortunately. I believe It will and. therefore. I cannot support this resolution."
