speech_id,speech
970128661,Mr. Speaker. the residents of south Dallas have recenty discovered just how devastating President Reagans budget cuts can be. The community health clinic located in the Martin Luther King Community Center has received a notice from the Department of Health and Human Services. which funds the facility. that it must close Its doors as of December 31. 1981. This section of the city has an infant mortality rate double the national average. the Incidence of tuberculosis Is four times the national average. and the rate of deaths due to heart disease Is 13 percent above the national average . These figures show the great need for health care In this area of Dallas. The health center is the only such facility serving this portion of Dallas. Its patients are primarily lowincome wage earners and senior citizens. It opened on May 27. 1980. and has 7.000 families registered to participate In its health program. In 1 year It had over 16.000 patient visits for medical and dental treatment. Ninetyfive percent of the people It serves have incomes at or below the poverty level. Half of its adult patients are female heads of households. Threequarters of Its adult patients have illnesses which require longterm care. such as hypertension. diabetes. and heart disease. Forty percent of the adult patients are over 50% years of age. At this moment. the health center has 5.000 patients in active care. This means that they must return for followup visits. The Reagan administration has cut $70 million from the community health center program. These cuts have forced the Bureau of Community Health Services to close over 100 community health centers nationwide. The Dallas center Is one of the facilities wvhich Is scheduled for closure. I have met with both regional and national officials of the Bureau to point out the disastrous effect that the closure of the clinic will have on the surrounding community. Although the center has had some management difficulties. It is doing a job of great benefit to the residents of the area. The mayor and the city council of Dallas have gone on record as supportIng the facility and have offered to lend the center any managerial and accounting expertise that they can. The Citizens Council of Dallas has also offered to aid the clinic with Its management difficulties. Despite these offers. the Bureau of Community Health Services Is remainIng firm in its determination that the program cannot be saved. I disagree with this position. The center has only been in operation for 18 months. and I believe that its problems can be resolved. I do not feel that the people who use Its services should be deprived of medical care because of management problems at the facility. I have requested that the Bureau grant the clinic a 6month probationary period In Which to correct the difficulties. I will be discussing this option further with the Bureau and am working hard on saving the center for Dallas residents. While I agree with the need for Federal budgetary constraint. I do not believe that budget saving should be made at the expense of the health of Dallas residents. Our most Important resource in this time of economic trouble Is our citizenry. and the health of our citizens Is an important factor in our ability to work and be productive members of our society.* E 5801 E 5802
970134906,Mr. Speaker. this month we mark the 100th anniversary of one of our greatest PresidentsFranklin Delano Roosevelt. This man who overcame the crippling effects of polio went on to lead our Nation through its gravest domestic crisis and most severe international challenge in this century. In each case. he weathered the test. In meeting these challenges. he left as his legacy programs that define our presentday social and economic system and a style of leadership that is the test against which we measure the performance of our Presidents today. As we face a time of economic trial today. it is helpful to look back to see how F. D. R. met the grave economic challenge of his time and to see what lessons we can draw for ourselves today. The programs enacted during the Roosevelt administration are now so much a part of the fabric of our society that we tend to take the benefits of these programs for granted. We assume they have always been there. One way to appreciate the Roosevelt legacy is to remember what it was like before F. D. R.s New Deal. Before F. D. R.. no Federal program provided the elderly with any degree of security in their retirement years. After F. D. R.. there was social security. Before F. D. R.. no ones savings deposits were secure. After F. D. R.. the Federal Government Insured savings accounts. Before F. D. R.. adequate regulation of the securities market did not exist. After F. D. R.. the stock market was regulated to protect investors and the larger economy. Before F. D. R.. workers could be fired for union activity. After F. D. R.. the workers right to organize into free trade unions was secured. As Joe Alsop reminds us in his recent book on F. D. R.. the Roosevelt legacy may be summed up by saying he included the excluded. Until Roosevelt. many of the economic and political benefits of this land were denied to those who were not rich. not white. and not of an AngloSaxon Protestant background. F. D. R. began the process. still incomplete. of including the previously excluded groups of Americans into our society. economy. and politics. Roosevelts greatness lies not only in the programs he left us. but also in the way he exercised leadership. For many of us today. the way that F. D. R. exercised leadership still provides the model against which we evaluate contemporary Presidents. What were some of the keys to F. D. R.s effective leadership? One key to his leadership was that he was a master communicator. F. D. R. was effective in all settingslarge audiences as well as small groups. He was particularly effective in the use of radio. which was the most important means of communication in his time. F. D. R. also had a gift of explaining some very complex ideas and proposals in a way that was understandable to everyone. Another important element in his leadership was his emphasis on experimentation. F. D. R. was not a prisoner of any ideology. He wanted results. In order to achieve results. he was open to ideas from just about any source. If something did not work. he would reject it and try something else. F. D. R. was also very effective in conveying a sense of optimism about the future. But it is not enough Just to convey optimism. Such optimism has to be credible. I I Many Presidents who try to convey optimism are unconvincing. Roosevelts optimism. however. was believable. People believed that things would actually get better. They felt this way because they saw he actually had a program that was workable and was fair to everyone. Wlat useful lessons for today can we draw from the Roosevelt years? First. we must not stray from the inclusionary principle laid down by F. D. R. It is the right path. It is the fairest. It has brought unequaled benefits to the people of our Nation. But in following the path of F. D. R.. we must also remember his emphasis on experimentation and results. We should continue his work but do it as he would have done itwith an openndss to new ideas and an emphasis on what works. Just like Roosevelt. we should not be blindly attached to policies of the past that have become outmoded. Our test should be what works. Conditions change. Problems are solved. We should be willing to reassess policies in the light of changing conditions. And if we decide that a policy is no longer appropriate. it is not an admission that the policy was always wrong. It is only an admission that it is not appropriate or useful under todays conditions. To continue the work begun by F. D. R. of including the previously excluded and to do so in the manner of F. D. R.-with an openness to new ideas and a willingness to discard policies that dont workthis is how we can best honor the memory of F. D. R.e
970176978,"Mr. Chairman. in April 1981. when the Budget Committee was considering the fiscal 1982 budget. I proposed an amendment that would have balanced the budget in 1982. My amendment accepted most of the administrations budget cuts but it omitted the enormous tax cut that the administration advocated and that has contributed to the deficit that we face today. My amendment failed. In fact. I got only four votes. Later the House adopted the administrations budgetthe GrammLatta substitute. The administrations budget was based on the radical ""supplyside"" theory that you do not have to balance the budget. It was based on the theory that an enormous gap between what you spend and what you take in in revenue will somehow send a positive signal to Wall Street. During the Budget Committeep markup last year. my good friend. the gentleman from New York who is the architect of the administrations tax cut. made a statement that I found shocking and almost incredible at the time. However. events have proved the accuracy of Mr. KEMPs remarks. On April 7. 1981. the gentleman from New York. Representative KEMP. the coauthor of the Presidents tax program. had this to say about the philosophy underlying the administrations program: Balanced budget. I used to think that * * I do admit to that. Whats radical about Reagans economics. and Stockinans economics. and Republican economics today i we dont any longer worship at the shrine of the balanced budget Well. Mr. KEMP may not worship at the shrine of the balanced budget. Mr. Stockman may not worship at the shrine of the balanced budget. Mr. Reagan may not worship at the shrine of the balanced budget. and Republicans in general may not worship at the shrine of the balanced budget. but millions of Americans do. Millions of Americansincluding a good number of folks in the the financial marketscontinue to believe that the Federal Government should balance its own accounts so that it spends no more than it takes in. I find myself now in a very difficult situation. It is hard to know what is the fiscally sound course to take. I voted to report the Budget Committees recommendation. because I believed we needed a vehicle to bring this debate to the floor and that was the fairest and soundest proposal I had seen until that point. But we are now in the middle of a debate in which achieving a deficit of $110 billion is considered a great victory for fiscal responsibility. Last Friday. the Republican Senate passed a budget with a deficit of $116 billion. The Republican alternative that we have before us has a deficit of $110 billion. according to the most recent CBO analysis. This is the budgdt that President Reagan endorses. I never thought I would have lived to see the headline: ""Republican President endorses $110 billion deficiti"" How things have changed How did we get to this point where a $110 billion deficit is hailed as a great victory? We all know the answer to this question. The answerin one wordis ""Reaganomics."" Reaganomics has produced a 1983 projected deficit of $182 billion. Compared to a Reaganomics deficit of $182 billion. $116 billion looks good. But only In comparison to the outrageous result imposed upon us by Reaganomics. Last year the administration told us we needed a massive military buildup. They said we needed to spend $1.5 trillion on the military over 5 years. Along with this massive increase in military spending. they said we needed an enormous tax cut. To be more specific. they said that the wealthy and big corporations needed a big tax cut. The message was: The Ntion needs this big military buildup. but we do not have to pay for it. In fact. we need to make major cuts in our revenues. This illogical combination of spending increases and tax cuts was somehow supposed to instill confidence in the financial markets. This has not happened. What has happened was what was predictable all along. The financial markets saw that Reaganomics produces increasing deficits and so they kept interest rates high and stifled recovery. In addition to a $182 billion deficit. Reaganomics has also given us the Worst recession since World War II. Last month. unemployment reached 9.4 percent. 10.3 million Americans are out of work. Industries like liousing and autos are in a neardepression state. I only wish that this administration would give a greater sign that it is finally realizing what its policies have produced. Reaganomics has given a tax reduction all right. jobless people do not pay taxes. This is now day 490 of the Reagan administration. Fourhundred and ninety days ago a President was inaugurated who the American people believed would balance the budget. In day 490 of the Reagan administration. we are further away from a balanced budget than we have ever been in the history of our Nation. I am running for attorneygeneral of Texas. I will not be around to remind the administration of its promise to balance the budget. I hope that you who remain will do this for me. The time has come to reject this folly called ""Reaganomics."" The time has come to reject the foolish and dangerous idea that we can have a massive increase in military spending without paying for it. If we truly need it. we shoidd be willing to pay for it. The time has come for our Republican colleagues to join with us Democrats to restore a sound fiscal policy to this Nation. We need to work together to fashion a budget that is fair to all Americans and that is based on accepted standards of fiscal responsibility. The Latta budget is untair and irresponsible. It hurts the elderly. it denies educational opportunity to mil. lions of Americnns. and It is a ""back door attempt"" to cut social security benefits. We cannot afford to repeat the mistakes of a year ago. Defeat the Latta budget."
970197473,"Madam SpeakerWe hold these truths to be selfevident. that all men are created equal. that they are endowed by their creator with certain unalienable rights ... Those words to not apply only to men. they must apply to all. It is evident in our society that they do not. we. therefore. are reintroducing today the equal rights amendment (ERA). The ERA. which was first introduced in 1923. failed to become part of the U.S. Constitution before the original deadline for ratification ran out and has failed to attain enough States for ratification before the extension limit ended on June 30. The States that did not ratify the ERA should hang their heads in shame because they are collaborating in the continuation of discrimination. We. the supporters of equality. pledge not to give up this mighty struggle until not only the ERA. but also equality for all citizens is reached in this great country of ours. We feel certain that the States which have stood firm through this first endeavor will act immediately upon passage of this legislation to again ratify the ERA. All rightthinking Americans should accept this new amendment as their rallying cry for equality. It is encouraging that so many Members of this Congrt - are strongly in favor of this legislation. The wording of the ERA is simple. ""Equality of rights under the law shall not be denied or abridged by the United States or by any State on account of sex."" We have considered changing this simple language to try to refine it and to satisfy some of its critics. but we have decided that there is no real reason for that action. What needs to be said is said in a clear. straightforward manner. Equality of rights is the cornerstone on which our representative democracy is built. I am. and will continue to be. a strong adherent to the cause for equal rights. not only for women. but for all citizens of this Nation. In 1971. when the Texas State Legislature ratified the original equal rights amendment to the U.S. Constitution. I strongly supported its action. At that same time. the legislature placed on the ballot an amendment which would include equal rights language in our State constitution. I was running for the State legislature in 1972 and had the privilege of campaigning actively or that State equal rights amendment. Passage of the amendment was an important part of my platform. I was elected. and the amendment passed overwhelmingly. In 1975. I served as a member of the committee of the Texas House of Representatives which had jurisdiction over constitutional matters. The committee reviewed the claims of opponents of equal rights. The committee was presented with statements of the appalling effects equal rights laws would have on our State. We found then. and I am happy to report now. 10 years later. that none of the evils forecast by ERAs detractors have come to pass in Texas. ERA has served as a positive force in our State. Many laws have been changed to erase the inequality women have faced in the areas of credit and property rights. In 1978. as a member of the U.S. House of Representatives. I again had the privilege of showing my support for equality for all citizens by voting for extension of the ratification deadline for the ERA. Along with other supporters. I participated in marches and counseled legislators in other States in order to encourage the ratification of the amendment. As an individual who had been a long time supporter of equality. I wanted others to know that political success is in no way thwarted by backing the equal rights amendment. In good conscience we cannot say that women deserve fewer rights than men. Women are the backbone of our families and our Nation. They are taxpaying citizens. Those who oppose the ERA forget the contributions that women have made. They overlook the fact that women carry many of the burdens and only reap part of the benefits. It took more than 140 years for women to obtain the right to vote. Until 10 years ago. they did not have an equal opportunity for education or a right to equal pay. We are slowly moving to rectify the imbalance. The ERA is one of the ways in which we can do this. Along with ERA advocates. I felt the bitter disappointment of not gaining enough States for ratification. Nevertheless. I have learned from our history that if we do not give up in our struggle for right. success will come. Thr e is old saying: ""When the going getz tough. the tough get going."" In the face of adversity. we need.to get going. We need to stand up for what is right. We Americans pride ourselves on our freedom and it is right that we should. We are the greatest free nation in the world. We are a beacon of liberty. People the world over look to this Nation as as example of a free society. We of all people should not forget that freedom is more than a word. it is a right. We need to realize that in restricting the rights of others. our own are restricted. Abraham Lincoln pointed out that ""in giving freedom to the slave we assure freedom to the free."" America should stand as an example for other countries in the area of human rights and we should use our influence to advance the cause of womens equality internationally. We already use our Nations influence abroad to fight racial discrimination. We should also use our influence to fight discrimination against women. Before we can do this. we must be certain that our own house is in order. We must wipe out any vestiges of discrimination against women in the laws of this Nation. I believe that women. indeed all Americans. are entitled to equal access and equal treatment under the law. If we err in our judgment as to the rights of individual citizens. we should err in the direction of liberty and not in the direction of restriction. I agree with Woodrow Wilson when he said that: ""Liberty does not consist in mere declarations of the rightpof man. It consists in the translation of those declarations Into definite actions."" My colleagues I will be leaving the Congress this year. but I will continue to support the cause of equal rights for all citizens. I intend to push for ratification of the ERA and defend the rights of all our Nations citizens in whatever position. or capacity. I may hold in the future.e"
