speech_id,speech
980000570,Mr. Speaker. today I am joining Representatives JOEL PRITCHARD. WILLIAM HUGHES. and DON BONKER in introducing legislation intended to facilitate the conduct of marine scientific research. This bill is needed to respond to major changes which have occurred over the past decade in the manner in which marine research is regulated by coastal countries. Not long ago. oceanograpliers were free to plan and ca:ry out research projects virtually anywhere on or under the seas of the world. The United States developed the globes largest and bestequipped oceanographic fleet. and U.S. scientists were pioneers in research related to oceanic energy resource. the effect of ocean conditions on weather. marine pollution. and marine biology. In recent years. this situation has changed. Dozens of coastal states have asserted the right to regulate marine research within 200 miles of their shores. The legitimacy of this right. moreover. has been recognized in the text of the Law of the Sea Treaty recently opened for signature in Jamaica. The United States would be hard pressed at this point to deny that a coastal state is entitled to regulate marine research within 200 miles of its shores. subject. of course. to the appropriated delimitation of overlapping zones. Official U.S. policy. nevertheless. continues to recognize such a right generally only within 3 miles of shore. up to 12 miles for fisheries research. and with respect to shelf research throughout the coastal states Outer Continental Shelf. The divergenceg between U.S. policy and that of foreign countries has caused major hardships to U.S. marine scientists in recent years. The Department of State has not been willing to forward requests by U.S. scientists to conduct research in waters adjacent to other states. unless a portion of the research to be conducted is in areas over which the United States explicitly recognizes the right of the foreign state to exercise research control. Many scientists have thus been forced to significantly alter the scopeand costof research projects simply in order to gain State Department cooperation in forwarding research requests. Scientific efforts have also been hampered by the view prevalent In some developing countries that industrialized nations. such as the United States. derive an inequitably large share of the benefits of oceanic research. This attitude stems from a view that much research has important commercial and military implications. and that more developed countries are better able than other states to process and make use of data derived from research. As a result. many countries have begun to place restrictions on foreign scientists seeking to work In their waters. Rights accorded to coastal states by the Law of the Sea Treaty include the right to authorize research. to ask for additional information about particular projects. to participate in and share data derived from research efforts and even to control the publication of information obtained. Under the framework of the treaty. scientists would be required to seek governmental permission to conduct research in waters comprising 42 percent of the worlds oceans. and containing the vast majority of the living and nonliving marine resources in which mankind presently has an~interest. The text of the Law of the Sea Treaty reflects the increasingly uncertain and difficult conditions under which marine scientists are forced to operate. In recent years. U.S. scientists have almost completely abandoned efforts to conduct research in waters close to countries such as India and Trinidad and Tobago. which have made their work exceptionally difficult. In addition. many proposed projects have been curtailed due to actual or anticipated opposition from coastal states. or to uncertainties about the regulations under which the research would be conducted. These difficulties have combined with reductions in Government support for research to create a major crisis for American marine science. These problems cannot be resolved completely through domestic legislative action on the part of the United States. but I believe that Congress can play a role in focusing attention on the crisis. and in pointing a way toward at least a partial solution. The legislation we are proposing today will update U.S. policy to reflect the present stage of evolution of international law. Under the bill. the United States asserts the right to regulate marine scientific research within 200 miles of our shores and on the U.S. Outer Continental Shelf. It provides. further. that marine research may be conducted by scientists in all areas subject to U.S. research jurisdiction. provided that the research is conducted in a lawful manner. In addition. the Secretary of State will be required to promptly transmit to appropriate foreign officials requests from U.S. scientists for permission to conduct research in areas over which a foreign state legitimately asserts the right to authorize and regulate research. The right of a foreign state to regulate research will be considered legitimate with respect to areas within 200 miles of the shores of that stateagain subject to appropriate delimitationor on its Outer Continental Shelf. These provisions are designed to eliminate the problem which the State Department now has in forwarding research requests to other countries. The United States will both assert for itself. and recognize for other states. the right to regulate marine research on the Outer Continental Shelf and in coastal waters out to 200 miles. By making it clear that the United States does not deem it necessary to enact new restrictions on research in U.S. waters. we will be in a position to argue that other governments should adopt a liberal regulatory regime as well. Clearly. some coastal States may continue to regulate marine research in their waters in a manner which will make it difficult for U.S. scientists either to obtain permission to conduct research. or to carry out projects in an economically feasible or scientifically productive way. This is regrettable. but Congress has no power to legislate for other countries. The bill which we are introducing seeks to make the best of the situation. however. by instructing the Secretary of State to initiate negotiations aimed at obtaining bilateral and multilateral agreements with other nations on the subject of marine research. In conducting these negotiations. the Secretary shall seek agreement on procedures which will minimize fiscal and procedural restraints on marine research. These agreements are to be sought Initially with countries or groups of countries within whose areas of marine research jurisdiction U.S. scientists have expressed the greatest interest in conducting research. The proposal to seek bilateral agreements is consistent with a recommendation made by the ocean policy committee of the National Academy of Science in 1978. and with congressional testimony submitted by leading scientists last year. It is predicated on the view that most coastal States can be persuaded not to interpret their right to regulate marine research in a manner which will make it difficult or impossible for U.S. scientists to conduct responsible research in their waters. Article 243 of the Law of the Sea Treaty provides. moreover. that: States and competent international organizations shall cooperate. through the conclusion of bilateral and multilateral agreements. to create favorable conditions for the conduct of marine scientific research in the marine environment. By adopting an approach which is consistent with international law. and by stating our own willingness to accept research by foreign scientists within U.S. waters. the legislation is designed to create the best possible international climate within which U.S. scientists may submit proposals for research. The bill being introduced today is not intended to reflect either a positive or a negative judgment on the Reagan administrations decision to refrain from signing the Convention on the Law of the Sea. Its purpose is simply to deal as effectively and as practically as possible with the very serious problems presently being experienced by marine scientists of the United States. Before concluding. I want to emphasize my belief in the importance of marine scientific research. This is not a problem. after all. which is of concern solely to oceanographers. academics. and laboratory technicians. It is a matter critical to all those who live near. or who derlve their livelihood in whole or in part from. the resources of the sea. Political boundaries are. from. a scientific perspective. irrelevant. The ability to gather additional data and to compare phenomena in one part of the world with those in another is crucial to understanding both living and nonliving marine resources. Cooperation among scientists and nations is essential to the study of fisheries migration. and to concepts of proper fisheries management. Satellitecollected data on surface water temperatures and on the availability of plankton are important to predictions of fish population. but satellite collection techniques are valueless unless supplemented by onsite sampling conducted from ships. Ocean researchers have provided important information about the movement of the geological plates which make up the Earths crust. Studies in this area are valuable for predicting the presence of oil and mineral resources beneath the ocean floor. Scientists played a key role. as well. in recent discoveries of hydrothermal sulfide deposits thought likely to be of greater importance than the managanese nodules which have for years been the target of proposals for deep seabed mining. Studies of ocean pollution will be severely hampered if political boundaries are permitted to interfere with research. Ocean currents. which disperse pollutants. are significantly lacking in respect for lines drawn on maps. Studies in one part of the world may be indispensable for assessing the potential effects of an action contemplated in another geologically or climatically similar region 10.000 miles away. Marine biologists are faced with the enormously difficult task of studying the chain of life in a vast and everchanging environment to which scientists may only at great cost and difficulty obtain limited access. The effectiveness of their efforts should not be strained further by burdensome restrictions on the geographical scope and efficiency of their research. Theories about marine life on the Outer Continental Shelf of the United States need to be tested against data derived from other parts of the ocean. such as those located in comparable latitudes in the Southern Hemisphere. Certain types of research. moreover. may best be conducted in relatively pollutionfree waters rarely found off the U.S. coast. It should not be necessary to point out the importance of the oceans to the survival of human life. It is clearly in our interest. therefore. to facilitate efforts aimed at learning everything we possibly can about the oceans and about their effect on our climate. our food supply. and our capacity to generate energy. In turn. we need to learn more about the effect of our industrial. commercial. and recreational activities on the longterm health of the oceans. The legislation we are introducting today will not. in itself. untie the politieal knot presently restricting marine scientific research. It is my belief. however. that the bill. if enacted. would represent a significant step forward. and I think it is about as much as Congress can accomplish through legislative action at the present time. During the weeks ahead. I am hopeful that interested members of the public. and particularly those from the scientific community. will be sharing with Congress their own views on the marine science problem. and on the possible legislative and administrative options which we might take. Representative NORMAN DAMouRs. chairman of the House Subcommittee on Oceanography. has already expressed his intention to hold hearings on the marine science issue. and I am confident that this problem will. under his leadership. receive the attention and action it deserves.e ZIP+4
980068123,I thank the chairman for yielding. Mr. Speaker. this legislation is the product of a cooperative effort between the Committee on Ways and Means and the Committee on Merchant Marine and Fisheries. This cooperation was nurtured by similar accommodation and understanding among those most directly affected by the bill. Those representing recreational boaters. sport fishermen. and the manufacturers of boating equipment and fishing tackle have overcome direct competition of interests to join in active support of this legislation. This bill will serve three purposes: First. it will guarantee that revenues derived from the motorboat fuels tax will be used constructively. and for purposes which benefit those required to pay this tax: Second. it will provide additional. muchneeded revenue for the DingellJohnson sport fish restoration fund. and .Third. it will provide $15 million in additional resources to the U.S. Coast Guard. perhaps the single most efficient and versatile agency in the entire Federal Government. This legislation extends the authorization of Federal support for State boating safety programs until the end of fiscal 1988. These programs were initiated 11 years ago in response to a dramatic increase in the number of accidents and fatalities associated with recreational boating. The Federal Boat Safety Act proved to be that rarest of Government initiatives: It accomplished precisely what it was intended to accomplish at substantially less than the anticipated cost. During the past decade and actual number of persons killed annually in boating accidents declined. while the number of boats almost doubled. This means that the rate of fatalities has been cut in half. Although H.R. 2163 seeks to renew support for State boating programs. the funding will be derived directly from the fuels tax paid by recreational boaters. rather than from the general revenues of the U.S. Treasury. This is the approach favored by the boaters. themselves. It is an equitable approach. comparable to the policy of using automobile Prcsoline taxes for highway construction and repair. and it is even more appropriate now that Congress has increased the size of the motorboat fuels tax by a nickel to 9 cent a gallon. It is a premise of this legislation that State governments should begin to play a greater role in certain areas where responsibility now rests almost entirely with the U.S. Coast Guard. I believe. for example. that State governments may be able to establish and maintain aids to navigation in waters used solely by recreational boaters. that they might be able operate search and rescue stations in remote areas. and that they can be of greater assistance to the Coast Guard in responding to violations of maritime law. including drug laws. The Coast Guard Roles and Missions Study. which was prepared last year by the Reagan administration. fully supports this thesis. The funding contained in this bill is essential if greater participation in maritime matters by the States is to become a realistic objective. The Coast Guard has too many important jobs to do. and not enough resources to do any of them as well as the public interest demands. This legislation recognizes the fact that the Coast Guard performs a variety of services for the recreational boating community. Accordingly. $15 million of the amount paid by recreational boaters in the motorboat fuels tax will be dedicated under this bill to the operating expenses account of the Coast Guard. This is fully consistent with the Reagan administrations concept of assessing user fees for certain Coast Guard services. It is. moreover. an application of that concept which is accepted by the public. which will be of direct benefit to the Coast Guard. and which is clearly connected to services for which the taxes involved are assessed. The changes made in this bill by the Committee on Ways and Means will streamline the administration of the act. and fine tune the provisions related to the taxing of sportfishing tackle and equipment. They do not. however. in any way alter the fundamental balance of interests which this legislation is intended to achieve. This bill was designed to make equitable and constructive use of revenues derived from the motorboat fuels tax. and to enlarge the sources of funding for the DingellJohnson program. It achieves both objectives admirably. and I hope very much that it will be approved by this House.
980080850,"Mr. Chairman. this bill seeks to end U.S. Involvement in an operation which is illegal under both American and international law. Which has failed dismally to achieve either its real or its purported goals. Which has undermined U.S. diplomacy worldwide by making nonsense of the very principles of international behavior which we ask others to observe. Which has. inevitably. I trust. in a free society. become less a covert operation than an ongoing embarrassment played out daily on the front pages of our newspapers. Which has damaged regional peace initiatives. and retarded the development of a consensus in Congress about U.S. policy toward Central America. Which has resurrected questions and criticisms about the role of the CIA in protecting U.S. interests overseas. and Which has distorted and aggrandized the role of the military in Honduras. has involved it in acts of U.S.sponsored adventurism. and thereby retarded the development of strong civilian political institutionsfrom the Presidency on downin that country. The Reagan administration has not been honest with either the Congress or the public in describing and defending this operation. The individuals we have trained and financed to fight against Nicaragua are not under our control. they have their own agenda. they have no history of support for Democratic principles. and they are actively seeking to trigger a civil war in which thousands of innocent people seem sure to die. H.R. 2760 embodies a mature congressional response to a brutal. ineffective project of the executive branch. It calls the bluff of the President. who told the world the operation was designed solely to interdict arms. and the bluff of Nicaragua.. which claims there are no arms to interdict. Nicaragua is much to blame for its poor relations with its neighbors. for the injection of EastWest isues into the region: and for its failure to generate confidence within Nicaragua in the integrity of its political institutions. Those shortcomings have produced a temptation. even among some men of good will. to wage war to make Nicaragua ""safe for democracy."" It is already too late to expect the Nicaraguan junta to fulfill voluntarily all the promises of the revolution. But it is far too early to assume that U.Ssupported armed intervention is the only means by which Nicaragua or Nicaraguans may avoid the Cuban path. A political dissident. even in todays Nicaragua. may be ignored he may be harassed. he may fear for his life. he may. accordingly. choose exile. But compare this to El Salvador where even according to President Reagans own certification. political dissidents are simply killed. When the United. States resorts to. or encourages the use of. armed force. it must do so in a manner and for purposes which are consistent with our values and our best traditions. and for reasons understood and supported by the American public and. in this instance.. by our friends in Latin AmerIca. It is by reinforcing our. traditions and ideals. rather than by abandoning them. that we may compete most suc aessfully with those we consider adversaries. To underline this point. I would like to read briefly from an essay written 2 years ago. after the Bay of Pigs. by Walter Lippmann:"
