speech_id,speech
980092359,Mr. Chairman. I rise in vcry strong support of this bill and. in lieu of a prepared statement. I would like to respond to a couple of questions that have been raised in the course of this debate and to some statements which I think demonstrate some uncertainty as to the true nature of thle legislation before us. This is not essentially a new program. It is not an attempt to reach out and find new Federal dollars to achieve new purposes hitherto unaddressed by Federal programs. This is an attempt essentially. having some of thle verbage stripped from it. to salvage three existing. modest. and very successful Federal programs. Thle admninist ration has sought to abolish the coastal zone management program. the sea grant program. and the coastal energy impact program. which is. in fact. part of the CZM program itself. These programs have been enormously successful in their operation over a number of years. Absent the legislation before us now. if the trend in declining appropriations were to continue at the administrations request and insistence. we would find ourselves in 1 or 2 or 3 years at the most essentially without any of these programs. And they meet. I suggest. a very. very important need on the part of the coastal States of the Nation. The coastal zone management prograins authorization expires In 1985. The sea grant programs authorization expires this year. in 1983. And thle coastal energy impact program expires in 1988. Take. for example. the sea grant program. a very small. a very modest program. No Member of this Institution needs to be reminded about the importance and the historical significance of our land grant colleges and the extraordinary role they have played in the assistance of our landbased agriculture in the history of the United States. going back more than a century. The sea grant program is a recent and extremely modest attempt to lend that kind of expertise and support to the development of our marinebased resources. particularly the fisheries of the Nation. It has been funded at a very small level and it has been very successful. The coastal zone management program. if there is a program on the books of this land that ought to appeal to this administration it is the CZM program. It is federalism incarnate. It recognizes the shared responsibilities of both the Federal and State governments with respect to decisionmaking having to do with the production of energy in the waters of this Nation. It is not a Federal decision that has to be made. it is not a Stale decision that has to be made. it is a genuinely shared responsibility. And this is a very finely tuned. very carefully balanced approach to what is In fact and what ought to remain a shared responsibility. To those Members who somehow. have conjured fears of a vast new Federal program being created by this legislation or vast new Federal dollars being sought by its authors. you can put those fears to rest. The simplest. way. I think. to express that is that the three programs which we essentially seek to save In this bill are authorized under current law. in the current fiscal year. for a total of $364 .million. If this bill instead were lavi. those three programs would have an authorization of only $300 million. So in terms of the authorizal ion Itself. this actually constitutes a reduction in the authorized Federal commitmnent for the programs about whichwe are concerned. The bottom line of course arnd the need for this legislation stems not from those authorizing numbers. but from what has happened to the actual appropriated dollars In the past few years. In 1978. these programs were appropriated to the tune of $197.7 million. In the current fiscal year that has gone down to $43.4 million and It will go directly to zero. very promptly. In a year or two or three. absent this legislation. That is why It is Important. that is why it is crucial and that is why It seems to me It ought to appeal to all Members of this House. I urge Its adoption. Mr. Chairman. I rise in strong support of H.R. 5. the Ocean and Coastal Resources Management and Development Block Grant Act. This bill has widespread supt5ort. among Members of Congress from coastal districts because it has as Its central purpose tile preservation of two Federal Government programs which have clearly proven their value to all those who live near. or who derive their livelihood from the resoarces of. the sea. During the 96th Congress. I served as chairman ot the Subcommittee on Oceanography. We undertook an extensive series of oversight hearings prior to considering legislation to reauthorize thle coastal zone management programs originally created in 1972. 1 embarked on that process genuinely skeptical about the value of coastal zone management. I had thle suspicion that perhaps this was a programlike many othersthat wats treasured only by the State and Federal bureaucrats employed by it. and that the public at large would be indifferent at best to its continuation. But I was wrong. Our subcommittee developed thousands of pages of testimony from town officials. from fishermen. from thos6 dependent on thle tourist industry. from beachifront property owners. from environmentalists and from many others who were convinced that coastal zone management had servedand could continue to serveprecisely the purpose for which it. was created. thrt is. to provide for the balanced. prudent use of thle coastal areas of our Nation. Thle sea grant program. whose future is equally entwined with the fate of the bill we are considering today. has for a decade been generatingat very little costthe kind of scientific expertise which our .Nation must have to understand and to utilize with confidence thle resources of the marine environment. The Reagan administration has opposed funding for these programs from the first day it took office. During that period. Interior Secretary James Watt has attempted to turn his Department from the legally appointed guardian of our Nations natural resources Into their most aggressive salesman. In doing so. he has sought not only to sell the publics resources as rapidly and as cheaply as possible. butin alliance with 0MBhe has attempted to deprive State and local governments and the scientific community of the means to fight back. These policies have not worked. By seeking to eliminate or to ignore the procedural requirements of our offshore leasing statutes. the administration has forced State governments to rely more the more on the courts to Septeniber 14. 1.983 guarantee the protection of their rights. The coastal zone management program is designed to permit State governments to work In partnershipboth with the Federal government and with their own town and local governmentsnot to block coastal development. or to prevent oil leasing on the OCS. but to pursue a coordinated and balanced program. combining development with conservation and appropriate safeguards In a manner as satisfactory as possible to all. The bill we are considering today. H.R. 5. seeks to achieve the same goal. If it is accurate to generalize about this bill. at all. I would characterize it as legislation designed to protect the right of State governments to have a say In what the Federal Government does in coastal areas within or adjacent to their territory. It is as simpleand It should be as noncontroversialas that. This bill Is fully consistent with the Federalist traditions which this administration claims to support. it would guarantee the continuation of programs which have been carefully scrutinized by the Congress. and which have proven their value to the public. It has the support of a bipartisan and geographically diverse coalition of Members who are dedicated to serving coastal areas throughout. our country. and I urge the House to follow the lead of the gentleman from North Carolina . and the gentleman from New Hampshire (Mr. DAmou~s). and approve this bill by an overwhelming margin.
980147192,Mr. Chairman. I rise In support of the amendment. I. like many others. have been concerned by recent reports that the Reagan administration may contract out for nautical chartmaking services and other functions essential to the safety of marine navigation. I believe it is always useful to reexamine the extent to which services now provided by the Government might better be provided by the private sector. I suggest. however. that we concentrate this examination In areas where problems are known to exist. or where the Government Ia able to provide a service only at exorbitant cost. The nautical chartmaking mission of NOAA is fulfilled. at present. by about 150 Individuals working with a budget of roughly $4.000.000. The quality of their work is respected worldwide. It has been relied upon without disappointment by our fishermen. commercial pilots. recreational boaters and cargo vessel operators for many years.. There Is little. If anything. to be gained In dollars. and much to be risked In safety. by considering a contracting process for this type of service. Expertise In areas of vital importance to the economy. safety and security of our country--and tat Is precisely what the NOAA chartmaking service now providesought to reside within. not outside. the Government. Its value to our country cannot be duplicated through a contracting proc. ess. If the administration does propose to contract out for certain services now provided by NOAA. I think Congress should consider those proposals objectively. But Congress has an obligation not to permit major changed In areas where change is not needed. where change will save little or no money. and where change may endanger the lives of those who require dependable information for navigation at sea. The amendment we are now considering Is intended only to make certain that Congress will have an opportunity to review any administration proposals which are indeed forthcoming. It ought not to be a controversial amendment. but I believe. nevertheless. that It is an Important one and I urge Its adoption.
980173008,I thank the gentleman for yielding this time to me. Mr. Chairman. I rise in strong support of the MARAD authorization bill. I am especially pleased that the legislation includes $5 million to be used in conversion of the cargo ship. Santa Mercedes. to a training vessel for the Massachusetts Maritime Academy. Since December 1981. when a tragic fire destroyed the training ship. the Bay State. and took the life of one cadet. the Massachusetts Maritime Academy has been without its own vessel. In recent years. the school has been forced to borrow a ship from either the Maine or New York academies. an arrangement that has created large administrative problems and worked to the detriment of all students involved. In fiscal year 1983. Congress authorized and appropriated some $10 million for MARAD to either repair or replace the Bay State. I am pleased that the Santa Mercedes has now been purchased for this purpose. However. I am concerned that MARAD does not have adequate funds available to carry out the needed conversion. Approximately $5.8 million remains from the $10 million already made available by the Congress. but this is clearly insufficient to do the job right. MARAD and I say this in respone to the observations of the gentleman from Kentucky. will need at least the $5 million made available by this bill to provide the academy with the facility that Its students deserve and require. The gentleman is correct that no one can say with certainty at this point what the final bill will be. but I think if anything is certain in this world it is that this will not cover it. I also want to take this opportunity to. on behalf of the faculty and students of the Massachusetts Maritime Acaeemy. thank the gentleman from New York . the chairman of the subcommittee. for his efforts. As he well knows. what we do with respect to the determination of the adequacy of conversion of this vessel will set a precedent for conversions of vessols still to come. presumably for the remaining academies. one of which. as the gentleman well knows. is in the State of New York. I thank the gentleman very much for his leadership and I urge strong support of the bill.
980182422,Mr. Speaker. I am today introducing. along with Representatives BIAGGI. MARKEY. MAVROULES. FRANK. MOAKLEY. BOLAND. and DONNELLY. a bill Intended to restore the Atlantic striped bass to its historic status as one of the most valuable and plentiful commercial and sport fish species on the east coast. This spectacular fish has become imperiled by environmental problems exacerbated by continued pressure from fishermen. Over the past 20 years. striped bass catch has declined by 90 percent recent annual landings are the lowest on record. Delaware Bay has ceaAed to serve as a significant spawning ground for the species. and reproduction rates in Chesapeake Bay have fallen far below that needed to sustain current levels of population. The need for action is clear and urgent. However. because the fish has the good sense generally to avoid Federal waters. it has been less clear who it is that must act. S9tate action would be preferable. but it must be cufficient to guarantee that the striped bass will recover and. thus far. this has not been the case. The approach taken by the legislation we are introducing today is simple. effective. and fair. Member States of the Atlantic States Marine Fisheries Commission (ASMFS) will be encouraged to implement the recommendations of the Commission with respect to regulating the taking of striped bass. Those recommendations call for a 55 percent further reduction in striped bass catch from levels proposed by the Commission in 1981. The new proposed level reflects the best scientific judgment about the reduction needed to permit full restoration of the species. The target date for State compliance will be December 1. During that month. and every 6 months thereafter. the ASMFC will be required to notify the Secretary of Commerce if any State has failed to establish and enforce the guidelines needed to reduce striper catch by the required amount. Upon receiving this notification. the Secretary shall impose. and the Federal Government shall enforce. a moratorium on the taking or landing of striped bass in that State or States. The moratorium will remain in effect for each State to which it has been applied until the State comes into compliance with the recommended guidelines for reducing striper catch. The approach taken by this legislation is intended to preserve the primary role of State governments in the management of fish species within its waters. The Federal role will be to enforce decisions reached by an organization whose judgment reflects the collective wisdom of the States. the ASMFC. But the purpose and the effect of the bill is clear. Action will be taken to protect the striped bass. The legislation we are introducing today is a logical successor to earlier actions taken by the Federal Govern. nent in response to the growing need to protect the striped bass. Five years ago. Congress mandated a study to identify the source of the problem and to recommend a solution. Two years ago. Congress ordered that fisheries research funds be denied to State gov. ernments unwilling to cooperate in restricting striper fishing in their waters. This bill responds to the evidence produced by the scientific study. and it takes one step further the notion that the Federal Government has an obligation to encourage prompt and effective action by the States. Enactment of this legislation is necessary to protect the striped bass. but it should be accompanied by further environmental restoration efforts i striper spawning areas. and by additional scientific research. These three steps will insure our success. and I hope that all those with an interest in the future of the striped bass will come together in support of this effort.*
980190369,Mr. Chairman. I yield myself such time as I may consume. Mr. Chairman. I think as we come to what I think in the judgment of many Members is perhaps the most important and certainly the most controversial section of the bill. that it is important that Members understand the situation we are faced with at the moment in terms of parliamentary procedure. There are two amendments in order under the rule to the section dealing with Central America. the one which is before us now. offered by myself. There are 3 hours of debate available on that amendment. 1% hours controlled by myself and 1% hours controlled by the ranking minority member. the gentleman from Michigan . After the disposition of this amendment. there is a second amendment in order under the rule which will be offered by the gentleman from Michigan. and there will be 3 hours of debate on that amendment. onehalf under the control of the gentleman from Michigan. the author of the amendment. and onehalf under the control of the chairman of the Committee on Foreign Affairs. the gentleman from Florida . What that adds up to. my colleagues. is. on the assumption that all the time is taken. a debate of as long possibly as 6 hours on the question of U.S. policy in Central America. I understand. and I think most Members understand. and we certainly had a preview of this last evening. that not only is this in many Members minds the most important and the most controversial section of the bill. but it will clearly be that section and that portion of the debate which will generate the most emotion. As I said. in anticipation of the possibility and indeed the likelihood of considerable emotion on this floor in the ensuing 4 or 5 or 6 hours of debate. I wonder if at the beginning it might be possible. before we get to the arguments of the wisdom or lack of wisdom of U.S. policy. to stipulate perhaps in somewhat simplified fashion the facts of the substance of the amendments that will be before us. I am going to attempt to do that. I grant it may be a bit oversimplified. but I think most Members will concur. before we get into the debate itself on questions of policy. in the essentially three alternatives that are before this committee. The amendment before us at the moment. the amendment offered by myself. would condition all U.S. military aid to El Salvador on the ability and willingness of that Government to meet a series of conditions and on the willingness of the President of the United States and the Congress of the United States to concur that those conditions had been met. In that case. under the amendment before us. all the military aid requested by the President for El Salvador for fiscal year 1985 would be forthcoming. That is one approach. The second approach. the middle ground. if you will. is embodied in the committee bill which will be defended by the chairman of the committee. the gentleman from Florida . Essentially that approach would say that if the President wishes. onethird of the money for military assistance to El Salvador would be forthcoming. but the remaining twothirds would be conditioned both on the agreement by the President that certain conditions had been met and on affirmative action by the Congress. Finally. Mr. Chairman. although this is perhaps a bit oversimplified. as I say. I think fairly one could summarize the approach which will be offered by the gentleman from Michigan
980252778,Mr. Speaker. I rise in strong support of the conference report on S. 2463. the offshore oil revenue sharing bill. I support this legislation because it is equitable. because it will insure the survival of Federal support for State coastal zone management programs. and because it will help State governments respond in a variety of constructive ways to everincreasing economic and environmental demands on their coastal resources. This bill is fair. because it will do for coastal States what has long been done for interior States. the very States just recited in that list by the gentleman from Texas. which is to provide a portion of the revenues derived from Federal mineral leasing in or adjacent to their boundaries to the State governments affected by that leasing. The survival of coastal zone management programs is important because those programs were established to perform a difficult but vital task. and they have done so with growing sucI194180 cess in recent years. As chairman of the House Subcommittee on Oceanography during the 96th Congress. I conducted a series of hearings throughout this country on the Coastal Management Program. I began as a skeptic. but the message our subcommittee received from fishermen. coastal property owners. local government officials. businessmen. and State officials was unanimous: This program works. it is vital to sound and balanced planning in the coastal zone. keep it alive. The demands we as a nation place on the coastal areas of this country are increasing every day. Transportation. recreation. the commercial recovery of resources both living and nonliving. the disposal of a variety of wastes. the continuing need to accommodate a greater and greater proportion of our population seeking to live near the ocean. these demands are creating everincreasing economic and environmental pressure on the coasts. This is not solely a State problemit is a national problem. The legislation we are considering today recognizes the scope of that problem. and responds to it in a manner that recognizes. as well. the partnership that should exist between the State and Federal Governments in dealing with coastal Issues. This bill is the very essence of federalism. a concept that for at least a couple of days back in 1982 was warmly embraced. through public speeches and press releases by this President. and the officials of his administration. In closing. I want to congratulate our distinguished chairman. the gentleman from North Carolina . and the equally distinguished chairman of the Oceanography Subcommittee Mr. DAmouns. for their leadership in bringing this bill to this point. I congratulate as well the ranking minority member of the full committee. Mr. PRITCHARD. and of the subcommittee. Mr. CARNEY. for their vital support. I think a special word of praise should also go to Tom Kitsos. of the Merchant Marine and Fisheries Committee staff. who believed in this bill long before anyone with a firm grip on logic or reality could be persuaded to do so. Let me say in response to the gentleman from Texas. as the gentleman from North Carolina has stated. this is not by any stretch of the imagination an entitlement program. Not only is it subject to appropriations annually. but it tries to keep alive a variety of programs that have been authorized for a great many years. and which this administration has been attempting to eliminate. such as the Coastal Zone Management Act. the Coastal Energy Impact Program. and many fisheries programs. among others. These are not new programs. They have been on the books for a great many years and they work and they ought to be supported. above all else. by those who believe in a proper balance of responsibility between the State and Federal Governments. I hope this conference report will be adopted today by an overwhelming margin and that our friends in the other body will cooperate by putting this legislation where it belongs: on the desk in the Oval Office. where I trust our Nations leading proponent of the New Federalism will sign it enthusiastically into law.
980271317,Mr. Chairman. th amendmentswhich I am offering blocwere prepared in response t( number of suggestions that have b made by the administration and Members of both bodies of Congr concerning specific provisions of H The amendments would make I following changes: First. the Secretary of Comme: will be required to consult with t Secretary of Interior prior to Impos a moratorium on fishing for stril bass in any State. This changewhJ I do not believe will have any substi tive effectwas recommended in ci gressional testimony by both the Co merce Department and the Depa ment of Interior. Second. the Commerce and Inter Secretaries will be required to revi the adequacy of the plan developed L the the Atlantic States Marine Fisheries Commission to protect the striped and bass. and to report back to Congress with its findings and recommendations nact. within 6 months. ihall 0 1200 rt to the I think such a study will be useful. and especially in light of the recent deciom- sion by the State of Maryland to instipor- tute a moratorium in striped bass fishnate ing in the waters of that State. iblic Finally. the amendment provides for I to the termination. I would say to the luch Members with some question about for be the bill. the amendment provides for con. the termination of the bills provisions the after 18 months. This will give ConIped gress ample time to review any additional scientific information that might become available and to make ipon an informed judgment about whether e to to continue with the language of this the legislation or to adopt a revised and method of guaranteeing protection for the striped bass. ore It is. in other words. an 18month sunset provision for the legislation. low. I would like also to acknowledge at this point the assistance provided in ipri- our efforts to save the bass by the rce. senior Senator from Massachusetts. and and the junior Senator from Rhode ated Island. and I hope these amendments year cre- which have been cleared by both sides. and will be adopted. the The CHAIRMAN. The question is on ties the amendments offered by the gentch. tleman from Massachussetts [Mr. bass STUDDS]. !ake The amendments were agreed to. uch
