speech_id,speech
1140001893,I thank my good friend. the distinguished gentleman from Queens. for anchoring this Special Order hour and for yielding a few moments for me to reflect on the passing of our great Governor. Mario Cuomo. Mr. Speaker. like many other members of the New York delegation. I also served in the New York State Assembly. But unlike most. I didnt get the opportunity to serve alongside Governor Mario Cuomo. I arrived several years after he had completed his three terms in office. So I speak today not from the perspective of someone who served in government alongside Mario Cuomo. but as a young man who grew up in Mario Cuomos New York. What an opportunity to be able to come of age in the 1980s with a Governor. a leader. who articulated such an eloquent vision of equal protection under the law for everyone. What an opportunity to be able to come of age under a Governor who believed in opportunity for everyone. who recognized that New York States greatest strength was our diversity from every community. every perspective. and every religious background. It was great to be able to come of age and look up at a Governor who. notwithstanding the political potential pitfalls. stood on principle. was ahead of his time as it relates to his firm opposition to the death penalty at a time when that was not a popular position to take. He was a great leader. a charismatic intellectual. a wonderful family man. a tremendous lawyer. and a wonderful statesman and Governor. I can only imagine that when Mario Cuomo arrived up in Heaven he was prepared to get to work. But I think that there was probably a greeting committee that was there at the gates of Heaven. one of whom was FDR. a former Governor of the State of New York. the other of whom was FDRs cousin. Teddy Roosevelt. two former great Governors of the State of New York. And I think they probably ushered Mario Cuomo to a place in front of the throne of glory where Almighty God Himself may have said to Governor Cuomo: Listen. you can take your suit off and put this robe on. Governor Cuomo. you can rest now. You have been faithful over a few things. You can rest now. Well done. My good and faithful servant. well done.
1140007311,"Mr. Speaker. I rise today in full support of President Obamas fiscal year 2016 budget. It is a budget that is firmly rooted in middle class economics. designed to benefit working families and middleincome Americans. It is a budget that will facilitate access to quality. affordable child care and will dramatically expand prekindergarten education in a way that will allow the children of middle class Americans to get off to a faster start in life. President Obamas budget. with the full support of House Democrats. will also address wage stagnation. It is designed to put more incomemore moneyin the pockets of middle class Americans and of those who aspire to be part of the middle class. It will address the fact that. since the early 1970s. the productivity of the American worker has increased consistently. yet middle class wages have remained stagnant. That is a systematic problem that President Obama. Leader PELOSI. and House Democrats are determined to address on behalf of the middle class. President Obamas budget is also designed to increase the affordability of a college education. We know that Americans right now are burdened with more than $1 trillion in student loan debt. That type of debt limits the ability of younger Americans to purchase a home. to start a family. to open up a new business. to take a chance. It limits their ability to robustly access the American Dream. President Obamas budget is designed to allow the sons and daughters of the middle class to pursue their dreams in a more meaningful fashion. When President Obama took office. he inherited an economic train wreck as a result of the Great Recession that was handed to him by the policies of the previous Republican administration. Through the leadership of President Obama. working closely with Democrats in the House and the Senate. we have turned the economy around. We have gotten it back on the right track. So the question that we in this Congress face today is: Will we continue the policies of middle class economics. which are designed to benefit working families and moderate income Americans. or are we going to regress to the policies of trickledown economics. which have failed middle class Americans time and time again? I am in my second term. When I first got to the Congress. I assumed that trickledown economics was dead. doomed by the fact that it has failed over and over again. Apparently. it has been revived. In its most recent incarnation. House Republicans would like to drop the top tax rate from 39.6 percent on the wealthiest Americans all the way down to 25 percent. Their argument is: ""Dont worry. everybody is going to benefit."" But that hasnt worked in the past. In fact. I am convinced that middle class economics is far more preferable to trickledown economics. which. as it relates to the middle class. simply means you may be lucky to get a trickle. but you are guaranteed to stay down. That is what the record says. Bill Clinton inherited a recession. The top tax rate on highincome earners was 31 percent. He raised it to 39.6 percent. and the purveyors of trickledown economics predicted economic doom and gloom. What happened when President Clinton focused on the middle class? More than 20 million jobs were created. He then handed over a budget surplus to President Bush and his coconspirators in the Congress. and like drunken sailors. they blew that budget surplus on failed wars in Iraq and Afghanistan and on a tax cut that disproportionately benefited the wealthy and the well off. Did trickledown economics work when they dropped the top tax rate to 35 percent? No. During the Bush Presidency. 650.000plus jobs were lost. President Obama inherited this economic mess. and in partnership with Democrats in the House and in the Senate. he renewed his focus on the middle class. He even raised the top tax rate back up to 39.6 percent. Doom and gloom was predicted. but what happened? The economy is humming. The stock market is way up. Gas prices are way down. The unemployment rate has come down. Economic growth is exceeding all of the competitors across the world. There is more to be done. but for us to be successful. we have got to abandon the focus on the wealthy and the well off and pursue middle class economics."
1140012092,I thank the distinguished gentlewoman from Illinois for yielding. and of course I want to thank Congresswoman KELLY and Congressman PAYNE for their wonderful leadership in creating this opportunity for members of the Congressional Black Caucus to speak directly to the American people on an issue of great significance. the justice system generally. but specifically. the urgent need to confirm Loretta Lynch as our next Attorney General. Let me say parenthetically that it feels good to be in the presence of my two classmates. R. KELLY and D. PAYNE. I feel like I am in the midst of celebrity. Certainly. they have done a tremendous job in calling us all together. We have got a serious issue that we need this Capitol to confront. In the midst of terrorists who are all across the world who want to strike at our homeland. not only are we dealing with a dynamic where some in the House of Representatives refuse to fully fund the Department of Homeland Security because of an unnecessary obsession with the Presidents executive action on immigrationlet me note. of course. though individuals may differ on its legality. every President since Dwight Eisenhower has taken executive action on immigration. It has occurred 39 times since the 1950s. President Eisenhower did it. President Nixon did it. President Ford did it. President Reagan did it. President George Herbert Walker Bush did it. and President George W. Bush did it. Every President since Eisenhower has taken executive action to provide some form of immigration relief. But. of course. when President Obama steps forward to deal with our Nations current problems. a constitutional crisis has been provoked. What also seems to be interesting. Mr. Speaker. is that the effort to address the issues that some may have with President Obamas executive action has crossed over into trying to stop. delay. and obstruct Loretta Lynch from becoming our Nations next Attorney General. Some over on the Senate side have even said as such: Well. we are concerned that she has got a supportive attitude as it relates to President Obamas executive action. Well. many of my good friends on the other side of the aisle are socalled strict constructionists. They believe in the sanctity of original intent as it relates to the Constitution. Well. the Constitution had an article I legislative branch. an article II executive branch. and an article III judicial branch. And the Founders suggested that if there are issues that need to be worked out. it is the courts job to do it. So there is a lawsuit right now pending in Texas challenging the legality and the constitutionality of the Presidents executive action on immigration. Let the courts do their job. Stop holding hostage our Nations safety and security. and stop holding hostage the confirmation of Loretta Lynch. If you take a look at her resume. no reasonable person could argue that she is not exquisitely qualified. Her resume reads like the American Dream: a Southern girl born in North Carolina. raised by a school librarian mother and a Baptist preacher father. She excelled in her elementary and high school studies so much so that she went off to college at Harvard University and then got a law degree from that same institution. one of the best law schools in the world. She then joined a highpowered litigation law firm in New York. excelled there. but then after several years took. I believe. what was a 75 percent cut in salary and left the private sector so she could go work as a Federal prosecutor and do some good. In that office. she quickly rose through the ranks. tried highprofile cases in the rough and tumble of New York City with grace and with dignity. always making sure that she was guided by the law and the factsnot politics. drama. and hyperbole. Loretta Lynch was confirmed twice. I believe. by the United States Senate unanimously. The American people recognize that this is a Congress that cant agree on basic things. yet unanimously Loretta Lynch has been confirmed twice as the lead prosecutor in the Eastern District of New York. By the way. she is a proud Brooklyn resident now. and I had the honor and privilege of representing Ms. Lynch when I was in the State legislature. She has excelled as the consummate law enforcement professional. She is fair. she is equitable. she is tough. and she is just. So we are here today simply to say it is time to confirm her. The President has made the observation: You cant stand Eric Holder. The easiest way to get rid of him is to confirm Loretta Lynch. What is the hold up? Allow her to take the helm over these final 20 or so months so that we have some stability at the allimportant Department of Justice. We need all hands on deck right now as it relates to the war on terror. We need the FBI. the CIA. the NSA. and the Department of Homeland Security. We have got to be correct 100 percent of the time. Terrorists only have to be right once. It seems to me that if you have a confirmation pending of a clearly qualified individual to head the Department of Justice. the responsible thing to do is to act. and to act now. Mr. Speaker. I just want to thank my good friends R. KELLY and D. PAYNE for giving me this opportunity to spend a few moments on behalf of a tremendous Brooklynite. by way of North Carolina. who is clearly qualified to be our Nations next Attorney General. It is time to bring the confirmation to the floor and to allow her to serve the American people.
1140018301,"I thank the distinguished gentlewoman from New Jersey for her very eloquent and passionate remarks. Mr. Speaker. one of the things that we clearly have to grapple with in this country is the fact that the criminal justice system is broken. and there are many components to that. We have got a situation in which far too often a police officer crosses the line. engages in unlawful conduct. and is not held accountable for that conduct. What kind of incentive does that create for good conduct to take place moving forward if. in the overwhelming majority of instances when police officers cross the line. such as in the Eric Garner case. a grand jury or a local prosecutor will often fail to hold them accountable? The other problem that we have got to address is of overcriminalization in America. of mass incarceration. If you look at some of these encounters that have taken place and that have gone wrong and that have resulted in tragedy. they often have begun with what was. really. overly aggressive. unnecessary policing strategy being deployed to tackle. at best. nuisancelike activity. Eric Garner is dead today because he was selling loose cigarettes. and someone at One Police Plaza gave the order to aggressively police this activity. Crime is down in New York. but there are still a couple hundred homicides committed every year. There is still some gang activity. There are still some assaults taking place. But we want to use police resources to aggressively go after someone who is selling loose. untaxed cigarettes? That is an overcriminalization problem connected to broken windows policing. Walter Scott is dead today because he had a broken taillight. Four children are without a father because Walter Scott had a broken taillight. We have got to evaluate this overly aggressive policing strategy connected to the phenomenon of mass incarceration. I am pleased to have had the opportunity in this Congress to have worked closely with someone who is one of the leaders in the House of Representatives and in the Capitol in dealing with our broken criminal justice system and who works closely with colleagues on the other side of the aisle. like TREY GOWDY and JASON CHAFFETZ and others. who are interested in trying to figure out. collectively. how we can make America a fairer. more efficient place in terms of our criminal justice system. Let me now yield to the distinguished gentleman from the great State of Louisiana. who represents the wonderful city of New Orleans. We refer to him. of course. as the ""franchise"" because of his prolific baseball abilities. but he is also one of the most talented legislators here in the Capitol. I yield to my good friend. the Honorable CEDRIC RICHMOND."
1140044860,Mr. Speaker. this is the final amendment to the bill. which will not kill the bill or send it back to committee. If adopted. the bill will immediately proceed to final passage. as amended. The murder of Kate Steinle in San Francisco was a national tragedy that certainly shocked the conscience of America. We must continue to mourn her passing. We must continue to stand behind her family. We must continue to make sure that her killer is prosecuted to the full extent of the law. but we should not respond with irresponsible public policy. Our Founders indicated that the House of Representatives is supposed to reflect the passions of the people. but the passions should be properly channeled into an appropriate legislative vehicle. On December 14. 2012. 20 children were brutally gunned down in Sandy Hook Elementary School. More than 30.000 additional Americans have died as a result of gun violence since that fateful day. Mr. Speaker. 952 days have passed. This House has done nothing. On June 27. 2013. the Senate passed a bipartisan comprehensive immigration reform bill. 52 Democrats. 14 Republicans. 2 Independents. That bill would have secured our borders. That bill would have reduced the deficit by more than $850 billion over 20 years. That bill would have required undocumented immigrants to learn English. pay back taxes. pass a criminal background check. and then get at the back of the line. Mr. Speaker. 757 days have passed. This House has done nothing. Instead. we are here today considering a misguided legislative response to a terrible tragedy. That is why I offer this amendment. which will prevent the elimination or reduction of funds to State or local law enforcement organizations if the Attorney General determines that the elimination of funding would result in an overall increase in the crime rate. particularly with respect to domestic violence. sex trafficking. and crimes against children. or if it would result in a decrease in the number of trained law enforcement officers on American streets.
1140072253,"it is my honor to stand here today as we undertake an urgent dialogue on how we. as elected Representatives of the people. can work together to end gun violence. I look forward to engaging with Congressman JEFFRIES and our Congressional Black Caucus colleagues in scholarly debate on the issues plaguing African Americans. African American communities. and to develop solutions to the problems our constituents face. As the conscience of the Congress. the Congressional Black Caucus will remain on the forefront of issues that affect Black Americans in particular. and the Nation. in general. For tonight. our anchor. Congressman JEFFRIES. has pointed out the CBC will continue to shed light on the epidemic of gun violence. standing our ground. ending gun violence in America. Mr. Speaker. last week we opened the Second Session of the 114th Congress. Four hundred thirtyfive of us traveled back to Washington ready to serve our constituents and work for the betterment of our Nation. Unfortunately. Mr. Speaker. whatever spirit of bipartisanship may have been present at the end of 2015 as Republicans and Democrats worked together on key pieces of legislation has disappeared at the precise time our Nation is calling on Congress to pass commonsense legislation to keep guns out of the wrong hands. We find ourselves confronted with startling statistics that no Nation should endure. Let me just take a moment to share just a few. We know that the impact of gun violence affects every community and every congressional district. However. African American children and teens are 17 times more likely to die from gun homicide than White youth. according to the Centers for Disease Control and Prevention. While African Americans make up 15 percent of youth in America. African Americans accounted for 45 percent of children and teen gun deaths in 2010. According to Everytown for Gun Safety. 88 Americans die every day from gun violence. Mr. Speaker. Roughly 50 percent of those killed are African American men. who comprise just 6 percent of the population. Homicide is the primary cause of death among African Americans ages 1524. Mr. Speaker. these numbers should be unthinkable. unimaginable. but they are the unfortunate reality in which African American communities live. In the words of Dr. Martin Luther King. whose legacy we honor next Monday. he said: We find ourselves ""confronted with the fierce urgency of now."" And Mr. Speaker. it is now that our Nation is in an urgent crisis. yet we are trapped in congressional inaction. Shameful. So our President decided he would not stand by idly while Congress did nothing to prevent another Newtown. another Charleston. other Tucson. With tears in his eyes. he reflected on the senseless killings caused by gun violence over the course of his administration. President Obama announced new executive actions to confront the epidemic of gun violence in America. While mocked by some Republicans for showing emotion at the loss of so many lives. I am here to say I proudly stand with my President on the actions he has taken to prevent gun violence in America. These executive actions will save lives and make the country safer without infringing on lawabiding individuals rights to firearms. You will hear from our colleagues tonight talking about the Presidents actions. I look forward to continuing to work with my colleagues and to address gun violence."
