speech_id,speech
1130031822,Mr. President. I am here today to briefly discuss an amendment to an important provision in the immigration bill that the Senate is considering concerning Stateless persons. Section 3405 of the comprehensive immigration bill would. for the first time. recognize and provide protections to those people in the United States that have no nationalitythey are Stateless. There are countless men. women. and children in the United States today who cannot claim any nation as their home. Many lost their nationality when their country of origin ceased to exist as a result of political upheaval. rampant persecution. or violent conflict. The comprehensive immigration bill would encourage these people in the United States to come forward and apply to be recognized as Stateless persons. Under the proposed law. if an individual is recognized as Stateless. they could seek conditional lawful status. provided they meet the appropriate requirements. and be protected from being deported back to a State they no longer recognize as their home. The amendment I am offering to the immigration bill would advance this important effort to recognize and protect Stateless persons living in the United States. We live in a time when political turmoil. persecution. and war are no longer the only conditions creating Stateless persons. Today. rapid and extreme environmental change threatens to erode national boundaries and make States uninhabitable to people. This is not an abstract challenge. Lowlying island States and atolls in the Pacific and Indian Oceans today face an existential crisis due to inexorable sea level rise that is making them uninhabitable. In Kiribati. for example. rising seas are contaminating local water tables with salt water. denuding fertile land and decimating island crops. The threat of higher seas also makes Kiribati. the Marshall Islands. and other island States more vulnerable to extreme weather that will inundate these countries with swells of storm surge and leave whole communities literally underwater. And in a short time. these island States will disappear beneath the waves. Sea level rise is just one of the dramatic challenges the world faces as a result of climate change. Other environmental stressors are manifesting in States around the world that carry similar consequences as well. In North Africa. for instance. countries such as Morocco. Tunisia. and Libya lose hundreds of square miles of fertile land each year to desertification. driving away farming communities that are accustomed to living off the land. In Southeast Asia. salt water intrusion from sea level rise is destroying aquaculture ponds that communities rely on for economic development and food. uprooting families from their homes and driving them inland in search of new ways to support their livelihoods. And rapidly receding glaciers in the Himalayan Plateau threaten to make the headwaters of the regions major rivers run dry. with consequences for downstream communities that may eventually be forced from their homes in search of new water sources. Scientists expect that climate change will exacerbate these environmental stressors. including drought. glacial melt. and heat waves. transforming once fertile landscape into barren and uninhabitable land. Besides these slow onset challenges. there are more people at risk today of being made permanently homeless by extreme weather events like typhoons. hurricanes. and other storms that threaten to decimate communities. And. unfortunately. the populations most at risk also happen to be the worlds poorest people who too often have no other choice but to abandon their homes once disaster strikes. By the end of the century. climate change will eclipse war as the greatest driver of homelessness around the world. We can and must protect those people who are in the United States from being deported to a country that is no longer inhabitable due to sea level rise or other environmental changes that leave the state uninhabitable to people. The amendment I am proposing is quite simple. If enacted. the Secretary of Homeland Security. in consultation with the Secretary of State. may designate individuals or a group of individuals displaced permanently by climate change as Stateless persons. Again. let me be clear about what this amendment does. It simply recognizes that climate change. like war. is one of the most significant contributors to homelessness in the world. And like with States torn apart and made uninhabitable by war. we have an obligation not to deport people back to a country made uninhabitable by sea level rise and other extreme environmental changes that render these states desolate. It does not grant any individual or group of individuals outside the United States with any new status or avenue for seeking asylum in the United States. Finally. the amendment also recognizes that the climate challenges that other States face are not unique to people beyond U.S. borders. Indeed. Hawaii. Alaska and other States are and will continue to experience increased environmental pressures. with sea level rise. drought. wild fires and extreme weather driving Americans from their homes. As such. the amendment would require the Government Accountability Office to conduct a study assessing the impact of climate change on internal migration in the United States and U.S. territories. The GAO report will assess the impacts and costs on existing Federal. State. and local services of various regions resulting from climate changeinduced migration of U.S. citizens. This important study will help the United States chart a path forward for responding to internal persons displaced by environmental change and extreme weather events. and identify what resources the Federal. State. and local governments need to invest in to adequately respond to climateinduced migration. Climate change is one of the greatest challenges the United States will confront this century. But with the kinds of forwardthinking and pragmatic policies I am proposing today. we can put the United States on a path to respond to the challenges the country will face. and help protect those communities most at risk. I look forward to working with my colleagues to advance this important effort.
1130041269,Commonsense solutions to the threat of climate change are everywhere. We have been talking a lot about the risks of climate change. but lets talk a little bit about the opportunitiesthe opportunities to fight climate change. to transform how we produce and consume energy. and to grow a clean energy economy. We know what we need to do. We also know how to do it. Congress may not enact comprehensive climate legislation this year. but it can still take action to make a difference. As I see it. we have an opportunity for common ground in three areas: energy efficiency. tax incentives. and innovative financing structures to promote clean energy deployment. Perhaps the greatest opportunity for compromise is in energy efficiency. the commonsense idea that we ought to save money and reduce pollution at the same time by simply consuming less energy to perform the same tasks. Senators SHAHEEN and PORTMAN have taken this up and are writing excellent legislation to improve and enhance energy efficiency across the Nation. Their bill includes sensible measures that will help to achieve significant reduction in energy use. Buildings use close to 40 percent of the energy used in the United States. This bill will contain provisions that will update the building codes. increase efficiency goals for Federal facilities. and provide incentives to industrial facilities. commercial buildings. and homes. In recent weeks. we have been hearing that ShaheenPortman may come to the floor. We are encouraged by that. We encourage both the majority leader and the minority leader. as well as the managers of this legislation. to move it to the floor expeditiously so that we can take care of it before the August break. Second. I urge my colleagues to support tax incentives for clean energy. many of which expire at the end of this year. Senators on both sides of the aisle have repeatedly worked together to extend these incentives. especially the wind credit. We can build on this common ground to support sensible solutions. We not only have the opportunity to extend clean energy incentives as a part of tax reform but to improve upon them. We should focus on creating credits that reward performance and innovation and do not pick winners and losers. They should help industries scale up. bring costs down. and become competitive on their own. Finally. the Federal Government must do more to help new and innovative technologies reach the marketplace. New technologies face significant barriers to market entry. barriers that focused government intervention such as loan guarantees and other financing mechanisms can help overcome. The Senator from Rhode Island may also have thoughts on other commonsense solutions. I yield to him for any comments he may have.
1130046998,"Mr. President. I rise to speak on the Affordable Care Act. At home in Hawaii we have a saying. ""Lucky you live Hawaii."" That can mean a lot of different things to different people. but when talking about access to affordable. effective care. this phrase has particular meaning. In the early 1970s. the rate of uninsured in our State was about 30 percent. meaning roughly 1 in 3 in our population would live in fear that sickness or injury could cause financial ruin for themselves or their families. The people of Hawaii knew this was unacceptable. In 1974. the State government passed an innovative piece of legislation. the Prepaid Health Care Act. Now simply known as Prepaid. this legislation requires employers to provide affordable and quality care for hundreds of thousands of individuals and their families. Our uninsured rate is one of the lowest in the country. with only 8 percent of our population lacking any type of insurance. Even though Hawaii has been at the forefront in making health care a right and not a privilege. we still have a way to go. Even with Prepaid. there are more than 100.000 people in our State still uninsured. When the Affordable Care Act passed 3 years ago. I knew it meant that those who are uninsured or underinsured in Hawaii would find some relief. We have already seen major successes since this landmark legislation passed. Yet people are still afraid of ObamaCare. This is because a lot of people have spent a lot of time and money to make the American public believe that somehow this legislation is bad for them and will harm them. That is why. when asked about health care reform as a whole. many Americans say they are concerned. they have anxiety. But when you talk to people back in Hawaii and across the Nation. and even those who think they dont like health care reform. they like what it does. For example. parents like that they can keep their children on their health insurance until the age of 26. which affects 6.000 young adults in the State of Hawaii. People will no longer have to live in fear of lifetime limits on health benefits. which will help more than 460.000 residents of Hawaii. including 115.000 children. More than half a million people in my State will no longer have to worry about being denied coverage because of a preexisting condition. As a State that has committed to Medicaid expansion. Hawaii will also now be able to provide care to close to more than 68.000 residents starting in People like these policies. People like what health care reform is already doing for them. While my colleagues across the aisle are looking to repeal this historic legislation. I am looking forward to how we can build on its success. Let me be clear. The fact that health care reform is working is exactly why the detractors of the ACA are trying so hard to stop it from being fully implemented. They know the American people are embracing ObamaCare because of all the good it will do for our families. In particular. I am looking forward to the opening of our marketplace. the Hawaii Health Connector. on October 1. Many of the people I have spoken to want to know what the marketplace may mean for them. Simply. the Hawaii Health Connector is going to provide a consumerfriendly way for residents of my State to view and compare a wide variety of plans. Then they will be able to pick the coverage that best suits them and their families. My office has been in constant contact with the Connector. and their staff in Hawaii has been working tirelessly to set up the online and phone interface. and to provide assistance and navigation in the form of kokua. a word in Hawaiian that essentially means pitching in to help your neighbors and your community with no regard for personal gain. This is reflective of the values we have in Hawaii. that everyone deserves to be healthy and have access to affordable and quality care. That doesnt mean we still dont have a lot of work to do. I am hoping a number of bills I have introduced. including the Rural Preventive Health Care Training Act and the Strengthening Health Disparities Data Collection Act. will be considered and voted on by the full Senate in order to solve some of our worst issues in providing care to rural and underserved populations in Hawaii and across the Nation. I believe ACA is working the way it should be. It is increasing the number of insured Americans. promoting preventive care that will help to reduce the human and financial costs of avoidable illness and lowering the costs of care for everyone. Many of my colleagues in Congress choose not to see any of this. The only option for them is total repeal. with zero tolerance for open discussion or compromise on this landmark legislation. but that kind of thinking is what causes the gridlock Americans are so tired of. I understand there will be parts of this law. which is a sweeping piece of legislation. that will need to be amended over time to resolve any kinks. These kinds of revisions have been done with every other landmark domestic social policy that has been passed in this country. including Medicare and Social Security. I am willing. as are my colleagues on the Democratic side. to come to the table and work with Republicans to make necessary improvements over time. but I refuse to engage in the process of political and parliamentary gymnastics designed to score small. shortterm wins at the expense of the American people and the economy. It must be pointed out that anyone who wants to grind the entire government to a halt over the implementation of this severalyearsold law will cause harm to the economy and harm to their communities. because Federal funding provides essential services and programs to constituents in every State and every county in every district. If improvements or changes need to be made. they can be done through the regular order with hearings. serious discussions. and bipartisan support. Ultimately. what we are seeing in Hawaii and across the Nation is President Obamas historic health care package is making inroads in improving our health care system. Efforts to stop that cannot be tolerated by Members of Congress and the people of this Nation. I will continue to support its full implementation and look forward to working with all of my colleagues in the Senate to build upon its success. I yield the floor and I suggest the absence of a quorum."
1130056062,Madam President. yesterday Senate Republicans rejected a cloture motion on a strictly partyline basis for a simple measure to prevent default for the United States of America. This bears repeating. Yesterday we voted on whether to proceed to a bill to prevent default. and not one Senate Republican voted for it. I think it is fair to say that many of the Senate Republicans are operating in good faith and have a strong desire to get out of this mess. but they are concerned about embarrassing and undermining the Speaker of the House by moving too quickly on this measure. Too quickly came and went a couple of months ago. Worrying about undermining the Speaker of the House should not be our primary concern given the crisis upon us. We should be singularly focused on protecting the dollars as the reserve currency. maintaining our ability to borrow at the lowest possible rate. and retaining our ability to solve problems as the greatest Nation in the world. The time for worrying about the implications for one or the other political party or a faction within it has long since passed. It is time to reopen the government. to pay our bills. to ensure the full faith and credit of the United States. and to return to the negotiating table on all of the challenges in front of us. In short. it is time to get back to governing in the way we should. I would like to emphasize a point that is not made often enough about the current crisis. that is. there is simply nothing conservative about the behavior of the House Republicans. Conservatives traditionally have been characterized by holding a respect for institutions. a focus on the needs of the private sector. and a desire to not waste money. Are these principles being upheld or subverted by the actions of House Republicans? First. with respect to our Democratic institutions. the procedural violence being done to the Congress is hard to overstate in this case. The idea that a faction of a party is demanding concessions in exchange for ceasing their infliction of pain on America is unbelievable. Why? Because we are all Americans here. We all want to do right by our country. So the idea that one party is willing to inflict terrible pain on our country. or else. was so beyond the pale that there is no rule against it because no one ever contemplated that a major political party would ever behave in such a way. The assumption has always been that elected leaders would find a better way to stand for strongly held beliefs than by threatening to bring the American economy to its knees. Up until now that has been a safe assumption. This is the least conservative behavior imaginable because it throws us into a permanent crisis. unable to solve major problems for the foreseeable future. Second. conservatives traditionally have wanted to protect the free marketplace. Some default deniers surmise that maybe the U.S. Government can service its debt while delaying other payments. that we can simply prioritize. The United States of America cannot do that. Even if it were operationally possible. which the Treasury Department assures us it is not. it would cause such severe harm to markets and undermine our credibility so terribly that even talking like that may be doing damage to our economy. In 2011. Congresss delay in raising the debt limit forced the Department of the Treasury to take extraordinary measures to ensure that our government could pay its bills. GAO estimates that this raised Treasurys borrowing costs by about $1.3 billion in fiscal year 2011. That is $1.3 billion in added government costs just for coming close to defaulting. This does not include the lingering added costs of borrowing that continued beyond fiscal year 2011. It also does not include the wasted time and resources that these extraordinary actions meant. After all. this manufactured crisis took the Treasury Departments focus away from other important cash and debt management responsibilities. The Bipartisan Policy Center projects that the full cost of that crisis to the Federal Government alone. not to the economy. just to the Federal Government. will be around $19 billion over the maturity of the debt. There is nothing conservatively virtuous about defaulting on what we owe. It will cripple free markets. It is Russian roulette played with a bullet in every chamber. There so nothing conservative about that. Finally. there is the conservative principle about saving taxpayers dollars. Two points: First. with the likely passage of the House bill to provide retroactive pay to Federal employees. let me tell you what is happening. We are paying Federal employees to stay home. We are paying our dedicated Federal workers. who want to do their jobs. not to do their jobs. This is not conservative. This is not liberal. for that matter. It is upside down. We are preventing Federal employees from doing their important work. such as assisting small businesses and combating terrorism. Let me be clear. Federal workers did not cause this shutdown and should not lose pay because of it. That is why I cosponsored Senator CARDINs bill to make sure they receive back pay when the government reopens. Our Nations furloughed public servants want to work. and many Federal civilian employees are being required to work during this shutdown without pay. While it does not make sense to punish Federal workers for Congresss dysfunction. it makes way more sense to simply reopen the Federal Government. Still. the House refuses to vote on a clean continuing resolution that can reopen the government tomorrow but instead voted to give backpay after the shutdown ends. What is conservative about paying people to stay home? Second. this shutdown is costing us money. not saving us money. In just the first week. it cost the economy $1.6 billion in lost economic output and is estimated to cost an average of $160 million each additional day. This is hurting small businesses and working families across the country. and it is completely avoidable. As the Presiding Officer knows. people are in real pain. This needs to stop. There is nothing good in this shutdown or in the threat of default. As a progressive. I have talked on this floor about how it hurts our economy. the American people. and the priorities I am fighting for. But you do not have to share my priorities to think this is an awful mess. You can be a rockribbed conservative too. This is bad for all of us. There is a simple way to move forward: Open our government. pay our bills. and start negotiating on the issues that matter. I yield the floor.
