speech_id,speech
1130066861,The budget agreement that we passed is an important step forward for our country and for our government. I know Chairman PATTY MURRAY worked tremendously hard to get to a conference in the first place and to reach this agreement with the House. I commend Chairman MURRAY for all of her work. The U.S. Government has been lurching from crisis to manufactured crisis and using shortterm stopgaps to fund the government. The threat of a shutdown and the lack of uncertainty has hurt our economy and has eroded the American peoples confidence in our ability to solve problems. It is our job to produce a budget and to figure out a way to work together and not shut the government down. That is what the people expect of responsible leaders in a divided government. This budget agreement is the way to move forward. It ends the reckless threats of government shutdown and lays a clear path to end sequestration. The sequester hit my home State of Hawaii very hard. The acrosstheboard arbitrary cuts from sequester have been devastating for our middleclass families and to our economy. I wish to read a letter that I received from a professor at the University of Hawaii at Manoa in September. He wrote: I was contacted today. as I often am. by a student wanting to join our graduate program in the Department of Geology and Geophysics. Unfortunately. I had to tell this student that funding for accepting new students is low right now. which may make it impossible for me to accept him as a graduate student. despite his excellent qualifications. This exchange reminded me that one source of the problem is the budget cuts to NSF (and other science funding agencies) that are the result of sequestration. The current situation is having the following impacts. which are happening right now at research centers nationwide. including UH Manoa: Many scientific workers are being laid off or are not being hired this includes individuals in Honolulu. Research groups are being forced to cut infrastructure that took decades to build. Some scientific discoveries that could help our society are not being made. Some bright young students are not being given opportunities to advance their scientific careers. I think that this last point is the saddest result because. it negatively impacts the hopes and dreams of many young people. Furthermore. these students are the future of our scientific workforce people that will be leading us toward the innovation and problemsolving that is crucial for our countrys future. This professor urged me and this Congress to do everything that we can to roll back the sequester. That is one of the many reasons why I supported the budget today. Sequestration caused Federal workers to be furloughed or laid off throughout Hawaii. Sequestration hurt our national defense. U.S. competitiveness. and harmed education programs. Head Start in Hawaii had to cut children from its programs this year. This early education program is critical for a young childs success later in life. Some of these kids and parents dont have other options without Head Start. Without this budget agreement. there would have been an additional $20 billion cut to our defense programs hitting next month. Those defense cuts are going to disproportionately hurt my home State of Hawaii. Without this budget agreement. 25.000 Federal civilian workers in Hawaii could be furloughed or laid off. Hawaii cant afford that. I voted for this budget to prevent those cuts. The bipartisan budget agreement finally provides relief from the sequester and a path forward to get our economy on the right track. Most importantly. the budget protects Social Security and Medicare benefits. Although this budget is the right choice for many reasons. we know it is not perfect. I do believe we need to work together to improve parts of it. I find it unacceptable and inexplicable that the House of Representatives left town for the holidays without extending longterm unemployment benefits. and I know we are working on making it a priority as soon as we return in January. In addition. Senator SHAHEEN has introduced legislationwhich I am proud to support and cosponsorto protect military retirees from the costofliving pay adjustment. The costofliving pay adjustment wont take effect until January of 2015. which means that we have time to fix this issue. but we must fix this issue. This legislation that I am cosponsoring with Senator SHAHEEN will fully pay for the change by closing a loophole that some companies are using to avoid paying U.S. taxes with offshore tax havens. This is a commonsense fix that I believe we can get bipartisan support for. We need a longterm budget. but not at the expense of our military retirees. We can replace the money raised by closing this tax loophole that some companies are abusing. We have time to fix this issue. and we have to do so before 2015. But now is the time to move forward. to protect jobs. and to give our country some economic certainty. I yield the floor.
1130083621,Mr. President. I rise today to discuss the important role that energy efficiency plays in our transition to a clean energy economy. and the importance of supporting energy efficiency efforts with strong Federal policy. Today. Senators CARDIN. FEINSTEIN. and I introduced comprehensive legislation. called the Energy Efficiency Tax Incentives Act of 2014. to reform. improve. and extend crucial tax incentives for energy efficiency. Our legislation focuses on three key sectors: commercial buildings. homes. and industry and manufacturing. My colleagues have spoken ably about the first two already today. and I would like to spend a few moments discussing the third title of this bill. This bill would create targeted. nonpermanent incentives to help the U.S. industrial sector become more globally competitive by employing smart technological improvements to reduce energy use and encourage water reuse. We have continually seen the eagerness of U.S. industries to innovate and improve the processes by which they produce countless highquality goods. This set of incentives will help U.S. manufacturers accelerate and expand cuttingedge ideas while also reducing costs. Industrial and manufacturing facilities have processes specific to each industry and even to each facility. Therefore. industrial efficiency improvements must be focused on these processes. not building retrofits like we see in commercial and residential efficiency measures. My colleagues and I have worked to develop incentives that target energyintensive processes common to the industrial sector. They include advanced motors. water reuse. combined heat and power and waste heat recovery. thermal biomass. and efficient chillers. I would like to take a few moments to describe the various sections of the industrial efficiency title of the bill. On average. motors account for over 65 percent of an industrial energy users electricity use. according to analysis by the International Energy Agency. This bill creates a credit for advanced industrial use motors. including variable speed motors. New advances in power electronics and controls over the past 5 years have advanced the potential for new smart motor technologies to provide a significant energy savings potential if these new motors are placed widely into service. According to the National Water Reuse Association. the U.S. currently reuses only 7.3 percent of its water. and there is significant potential for gains in this area. The industrial sector. which is responsible for 62.5 percent of domestic freshwater withdrawals. is an ideal place to introduce transformative water reuse and water saving technologies. The bill would create a technologyneutral. performancebased investment tax credit for reuse. recycling. and/or efficiency measures related to industrial water reuse in the manufacturing sector. A recent Department of Energy study estimates that achieving the Presidents goal of 40 gigawatts of Combined Heat and Power. also known as CHP. would save energy users $10 billion a year compared to current energy use. In 2008. Congress enacted a 10 percent investment tax credit for combined heat and power systems. The bill would expand that credits applicability. from the first 15 megawatts to the first 25 megawatts of system capacity. The bill would also remove the existing overall system size cap of 50 megawatts. allowing a greater number of combined heat and power projects to be financially viable and move forward. Finally. the bill would create two new tiers of the credit for CHP systems that achieve especially high efficiency levels. By encouraging adoption of CHP and waste heat recovery technologies. this bill is a commonsense set of incentives that will help manufacturers to become more efficient. reduce energy costs. create highly skilled jobs. and ensure the delivery of reliable power. New technologies have developed recently that can take advantage of lowgrade heat sources. Called Waste Heat to Power. these systems can achieve even greater levels of efficiency from industrial and manufacturing applications. Currently no incentives exist to promote thermalonly biomass use for commercial and industrial applications. Using biomass for thermal applications has numerous advantages over using biomass to produce electricity. Thermal use is significantly more efficient. less polluting. and more appropriatelyscaled to biomass resources. Finally. large watercooled chillers are the engines of airconditioning systems for almost all large buildings. This bill would establish a tax credit that incentivizes the replacement of older chillers that still use environmentally harmful CFC refrigerants with chillers that are both more efficient and use fewer harmful chemicals. Recent years have seen a resurgence in American industry and manufacturing. As we work to get our economy back on track. become more competitive globally. and fight climate change. we should consider robust efficiency incentives for our industrial sector as a crucial tool in achieving those goals. I would like to commend my colleagues Senator CARDIN and Senator FEINSTEIN for their hard work on this bill. It represents the latest thinking in terms of straightforward. performancebased technologyneutral. nonpermanent efficiency incentives. As we aim to improve efficiency in the industrial. commercial building. and residential sectors. I urge my colleagues in the Senate to support this critical bill. By Mr. ROBERTS (for himself.
1130090482,Mr. President. on the Senate floor we have been focusing on policies that give Americans a fair shot. bills that would help to reverse the growing trend of income inequality and create more opportunities to climb the economic ladder. the idea that if you work hard and plays by the rules. you can do well for your family and you can create a better opportunity for your children and their children. Making college more affordable and reducing student loan debt is central to these goals. In fact. I think it is the middleclass issue of our generation. It is hard to get ahead nowadays without a college degree. but the cost of college is growing faster than the cost of all other consumer goodstwice as fast as health care costs. The growing cost of college is preventing some from getting a degree in the first place and leaving others with unmanageable levels of debt. This is the middleclass issue of our time. Students have taken on more than $1 trillion in debt to cover the cost of college. Student debt is now the fastest growing and highest consumer debt burden behind mortgages. This debt burden is not sustainable. Saddled with this debt. young adults are delaying starting families. buying homes and cars. and starting new businesses. The rate at which students are failing to repay their loans is alarming. Over onethird of borrowers who are in repayment are delinquent on their loans by 90 days or more. Onethird of borrowers are delinquent. One of my constituents from Wahiawa. HI. took out a loan to help their son go to college. The loan was for $92.000 in 2006. Today they owe $143.000. This local resident says: The interest compounds. Its like a loan shark. pretty close. Theres no way out. No way to pay it. ever. We are hearing these stories far too often from many families in Hawaii and across the country. and they need our help. A college education is supposed to be a path to opportunity and the American dream. not a life of debt. It is clear our current system is not working. The Federal Government is giving $140 billion a year in financial aid to institutions of higher learning in Federal grants and loans. That is good. not bad. Higher education is the straightest line for us to develop the workforce we need and for people to move up the economic ladder. but with that $140 billion we should be making college more affordable for students. Instead. we are getting the opposite result for the $140 billion. Average Pell grant awards have increased by almost 20 percent in the past 10 years. In that same time period. Pell grants covered 25 percent less of the average public schools tuition and fees. We are paying more and we are getting less. There is a growing gap between the financial aid that is available to students and the cost of college. To fill that gap. students are loading up on debt. Last summer. Congress passed a bipartisan student loan compromise that lowered the student loan interest rate for new borrowers. but millions of student borrowers were left out of that deal and are paying much higher rates. I am proud to join Senator WARREN in introducing the Bank on Students Emergency Loan Refinancing Act. This bill will allow students with outstanding student loan debt to refinance at the same low interest rates offered to new borrowers under the bipartisan student loan compromise. That is fair. Students struggling with student debt deserve to get the same deal Congress is giving to new borrowers. But when we talk about making colleges more affordable. we need to remember that lowering student loan interest rates is only part of the problem. It is not just the interest. it is the principal. We need a bold longterm plan to bring down the cost of college. That is why I introduced the College Affordability and Innovation Act with Senators CHRIS MURPHY. PATTY MURRAY. and BERNIE SANDERS. The bill is about holding schools accountable to taxpayers and students. We want to reward those schools that are focused on affordability and give incentives for the rest to make affordability part of their mission. If you are a college. you can have whatever mission you want. but you have no special right to Federal funding. Our bill says. very simply. if you receive Federal dollars. part of your mission must be about affordability and access. There are potentially billions of dollars that are not being used wisely. As we invest in higher educationand we should. through student loan subsidies and Federal financial aidwe should make sure schools are actually fulfilling our Federal public policy goals of making college more affordable and more accessible for all students. Lets work together to make sure a college education is a path of opportunity for all students and not a life of debt.
1130117936,Mr. President. September 22nd marks the beginning of National Gaining Early Awareness and Readiness for Undergraduate Programs. GEAR UP. Week and I would like to take a moment to recognize the invaluable work of GEAR UP in Hawaii. For more than a decade. GEAR UP has provided lowincome students all over the country with the support and resources they need to go to college. GEAR UP helps these students. many of which are the first in their family to go to college. to overcome the challenges they face in their communities. GEAR UP Hawaii serves over 16.000 students each year from lowincome and underserved communities throughout the State in grades 7 through 12 and in their first year in college. The program provides a number of services to these students including: supporting academic preparation in high school. providing opportunities for early college options. increasing college access and financial aid information to students and families. and supporting students in their first year in college. GEAR UP Hawaii has gained national recognition for its success in closing the achievement gap and helping lowincome students prepare for college. Through its collaborative partnerships between Hawaiis State Department of Education. K12 schools. the University of Hawaii. businesses. and community organizations. GEAR UP Hawaii inspires students to see postsecondary education as something they can achieve. It also gives students the tools they need to succeed in college and their careers. The programs results demonstrate that GEAR UP Hawaii is making significant strides towards increasing the number of lowincome students who are prepared for and enroll in college. The first class of Step Up Scholars. a GEAR UP Hawaii program. graduated from high school in June 2013 and earned the collegeready Board of Education Recognition Diploma. BOERD. at nearly twice the rate of the statewide average and three times the rate of nonStep Up Scholars. In addition. across GEAR UP Hawaii schools this past year. there was a 14 percent increase in the number of students participating in dual enrollment programs who graduated high school with six or more college credits. Thanks to these programs. Hawaiis students graduate from high school better prepared for college and for their futures. A college education is a path to opportunity for our students. GEAR UP Hawaii plays a vital role in fulfilling our responsibility to ensure that every student has access to that path.*
1130119124,"Mr. President. I rise to commend the historic agreement reached yesterday between the United States and China. the worlds largest emitters of carbon pollution. This agreement is the latest and perhaps most consequential in a string of actions President Obama has taken to fight climate change. Today. we have hope. We have hope because this agreement puts the world on a path towards solving climate changehope because the worlds two largest emitters have found common cause in protecting public health and economic opportunity for their citizens and for the world and hope because we are once again reminded what American leadership and political will can accomplish. President Obama and President Xi of China recognize that climate change threatens our families. our jobs. our health. and our way of life. They deserve our thanks. as does Secretary Kerry. for their tireless work and dedication to this cause. We can solve this. We know what we need to do. and we know how to do it. Today we see what political will can accomplish. I am now more hopeful than ever that we can keep warming below 2 degrees Celsius by the end of the century. This is the level scientists say is necessary to stay below in order to avoid catastrophic global consequences. Together our two countries account for about 40 percent of the worlds greenhouse gas emissions. We have a responsibility to act early and to act together. and this agreement puts us on that path. The agreement recognizes that the United States and China must take short- and longterm measures to reduce emissions and encourage the development of clean energy. This represents a major shift for China. which had struggled to balance economic growth with growing pollution and has now agreed to cap carbon pollution for the first time ever. It is difficult to overstate what an important achievement this is. especially a full year before the next round of international negotiations in Paris. As Secretary Kerry said today. this is a major signal to other countries that they should also put forth ambitious emissions reduction goals well before international negotiations start in 2015. In addition. China has agreed to get a full 20 percent of its energy from zero emission sources by 2030. This means China will have to deploy close to 1.000 gigawatts of new zero emission powerplants. This is the amount of electricity the entire United States currently generates and shows just how serious China is about addressing this problem. American leadership was crucial in forging these goals. It wouldnt have been possible without the Presidents Clean Power Plan. which will reduce emissions from the power sector by 30 percent relative to 2005 levels by the year 2030. This agreement goes beyond even those ambitious targets. and in the coming months and years. it will be important for this President and the next to maintain and strengthen the Environmental Protection Agencys ability to protect Americans from harmful pollution. Despite near universal consensus among climate scientists that the Clean Power Plan is part of the solution to fighting climate change. today that plan is under attack in Congress. Right after the President announced this historic agreement. climate deniers in Congress started rolling out every tired argument in the book. In fact. one of our colleagues here has already dubbed this plan ""unrealistic"" and called it an ""ideological war."" These claims are the last bastion of a hopeless cause that ignores what we see all around usfrom farmers to fishermen to smalltown mayors. Theirs is an untenable position. because poll after poll shows that Americans do care about this issue. They care about it deeply. Americans care because they know fighting climate change is really about protecting their childrens health. protecting economic opportunity. and leaving our children a world better than our own. We are seeing the deniers arguments collapse around them. One of their favorite tropes was to claim that U.S. actions are meaningless without action from China. Well. it looks as though that argument took a fairly big hit yesterday. In fact. the U.S. did act first by developing the Clean Power Plan. The rules havent even been finalized. but they are already giving us the leverage to reach major international agreements. As excuse after excuse fails. we will see climate deniers retreat to tired claims that anything we do to reduce pollution will hurt the economy. But remember that we have heard these claims before. They were wrong then. and they are wrong now. The list is long. so I will mention just a few. Taking the lead out of gasoline. putting catalytic converters in cars. reducing acid rain. all were met with panicky claims of economic devastation. But what we have learned is that keeping our air and our water clean actually helps our economy. This agreement between the United States and China is historic. It is a real breakthrough. and it gives us hope that we will be able to confront and resolve one of the greatest challenges of our time. But it is still just an agreement. We need to follow through with action. We must listen to the American people and amplify their voices as they call for action to preserve our health. our economy. and our way of life. Mr. President. I yield the floor."
