speech_id,speech
980023934,"Mr. Speaker. I am proud to join my distinguished colleagues today to honor the survivors of the Holocaust especially the many Tennesseans who were able to attend this extraordinary gathering. It is mans nature to put aside unpleasant thoughts. but this cannot be done with the Holocaust. Over the years we have sought explanations of the Holocaust. but the atrocities committed against the Jews defy all human rationality. The painful memory of the 6 million Jewish men. women. and children who died at the hands of the Nazi regime. should not and will not be forgotten. Today. this burden is eased somewhat as we honor 10.000 survivors of the Holocaust who gather in Washington. Their survival offers hope to many. We pay tribute to these Jews who have displayed unfailing bravery. courage and faith. Instead of converting their pain into more hatred and violence and instead of giving up on life. these survivors gather together to commemorate life and help ease the burden of the many family members and friends they lost in Europe. The death camp survivors have not stood idle and asked for our pity. Rather. they have overcome the obstacles and have gone on to raise families and become upstanding members of their communities. Despite the punishment invoked on them for being Jewish. they have not lost their faith in God or their Jewish identity. These Holocaust survivors also stand to teach us an important lesson about humanity. We must remember the horror of the Holocaust to assure that this terrible tragedy will never again occur. The unfortunate truth is that prejudice and ignorance continues today. The forthcoming Holocaust museum in Washington affords a valuable opportunity for our generation and future generations to study and better understand the Holocaust. Many of these survivors gathered here are still searching for answers as to how the Holocaust could ever occur. We must continue to admire their bravery. and strength and lend them our support. At the same time we must continue to mourn the loss of the many who perished. As we reflect on the meaning of this gathering it is apt to keep in mind the words of Ann Frank. who wrote in her diary a year before her death by the Nazis: ""Whoever is happy will make others happy too. He who has courage and faith will never perish in miseryl""e"
980037143,Mr. Speaker. I have introduced today into the House of Representatives a resolution to declare the week of June 12. 1983. as National Brick Week. Although it has become commonplace for the Members of this Chamber to offer such resolutions. we should not lose sight of the importance of honoring the marvelously diverse commodities which have proven the source of the Nations economic strength. As representatives to the National Legislature. it must be considered part of our service to those who have elected us to bring to national attention the contributions made to the country by the citizens and businesses of our home districts. Brick is among the oldest of building materials. Its presence throughout ancient and modern cultural history has made possible the construction of such imposing and varied structures as: Independence Hall and Carperters Hall in Philadelphia. Pa.. the New State House in Boston and the Old North Church in Concord. Mass.. and Monticello in Charlottesville and Governors Palace in Williamsburg. Va. Brickmaking and bricklaying are among the oldest professions. Even before the tine of Moses. history is replete with references to the production of brick and its use by skilled craftsmen and artisans. As may be seen from any tour of the cradle of the American Republic. our 18th and 19th century forefathers heavily relied upon brick as the foundation material for the construction of both the industrial North and the agrarian South. Into the 20th century. brick remains an important source of economic opportunity and a superior building product. Annually there are 10 billion brick manufactured in the United States. In my own State of Tennessee. there are 4 plants which account for nearly 5 percent of national production. Throughout the country nearly 500.000 people derive their livelihoods from the production and use of brick. The American brick industry is a uniquely domestic one which employs local resources and talents and which should be recognized for its importance to the Nation. Although it is to be Brick Week. it is less the inanimate product and more the people of the industry to whom we wish to pay honor with this resolution. The brick industry has been a leader in the search for increased building energy efficiencies. Working with officlals of the Departments of Energy. Defense. and Housing and Urban Development. the industry has sought to improve the durability. efficiency. and inhabitability of residential and commercial buildings while seeking ways to reduce construction costs. Representatives of the Brick Institute of America and the International Union of Bricklayers & Allied Craftsmen have consistently cooperated with the Congress and their consturction industry colleagues in the design of building research and regulatory programs that have resulted in substantial savings in building energy requirements throughout the Nation. Within recent years. recession has cut deeply into the commercial and residental construction markets. The dream of every American citizen to own their own home has been severely tested throughout these past years. In response. the brick industry has sought new ways to reduce the cost and maintenance of structures. while increasing building durability. Whether in the construction of new towns in the South or the rehabilitation of the older industrial cities of the Northeast and Midwest. the brick industry has sought ways to improve the built environment. Through union training programs or manufacture and design innovations. the industry has sought to improve the quality of its product and the skill of its application while increasing the Nations inventory of affordable and durable structures. The people of the brick industry are known to all of us in whose district brick is manufactured. distributed. or applied. Its members are local and national business. labor. civic. and religious leaders. their personal and economic contributions are important to their communities. Although lower interest rates are important for continued recovery. they are no more important than high spirits and the continued dedication of this important segment of the construction industry to improving Americas built environment. Mr. Speaker. it is important and just for the Congress to recognize the achievements of the brick industry and its people. I believe that my resolution will provide such recognition and serve to tell the Nation of a job welldone. I ask for the support of my House colleagues in the dedication of the period of June 12 to 18. 1983. as National Brick Week.
980043108,"Mr. Speaker. I yield 30 minutes to my distinguished colleague. the gentleman from Kansas . pending which I yield myself such time as I may consume. Mr. Speaker. on April 26. 1983. the Committee on Energy and Commerce unanimously adopted a resolution finding Ms. Rita Lavelle in contempt of Congress for failing to appear and testify on March 21. 1983. as called for by a subpena of the committees Subcommittee on Oversight and Invesitgations. The subpena was issued by the subcommittee in connection with its longstanding and ongoing investigation into the implementation of the Comprehensive Environmental. Response. Compensation. and Liability Actcommonly known as Superfund. Superfund became law in late 1980. and since then. no one has had more important responsibility and stewardship for the administration and implementation of the act than Ms. Lavelle. former Assistant Administrator of the Environmental Protection Agency. And no one has had a better vantage point from which to observe defects in the act than Rita Lavelle. The subcommittee subpena was authorized on February 10. 1983. by a majority of the Members voting. without any dissent. and with a majority being present. Ms. Lavelle was personally served with the subpena on February 23. 1983. and she failed to appear on March 21. as required. On March 21. 1983. the Oversight Subcommittee approved. without objection. a resolution which found her in contempt and directed that the subcommittees finding be referred to the Committee on Energy and Commerce for such action as the committee deemed appropriate. A detailed chronology is included in the committees report. As the oversight arm of the Committee on Energy and Commerce. the jurisdiction of the Subcommittee on Oversight and. Investigations is concurrent with that of the parent committee. Under rule X. the Oversight Subcommittee is charged with the responsibility to ""review * * * the application. administration. execution. and effectiveness of those laws * w * "" within the jurisdiction of the Committee on Energy and Commerce and to oversee the ""operation of the Federal agencies * * having responsibilities for the administration and execution"" of the laws within our jurisdiction. In addition. the Oversikht Subcommittee is required to ""study and conditions or circumstances which may indicate the necessity or desirability of enacting new or additional legislation"" within the jurisdiction of the committee. The charge of the Oversight and Investigations Subcommittee and the authority upon which the subpena rests have their foundation in the Constitution. The authority of the Congress to obtain information is clear from Article I of the Constitution and from interpretation of that power by the Supreme Court. The Court has stated that the power of Congress to conduct investigations ""encompasses inquiries concerning the administration of existing laws as well as proposed or possibly needed statutes ** * It comprehends probes into departments of the Federal Government to expose corruption. inefficiency. or waste."" (Watkins against U.S.) The Oversight Subcommittees involvement in finding solutions to the problems presented by hazardous waste has been significant and longstanding. The subcommittee held approximately 30 hearings and issued 3 reports on the subject of hazardous waste disposal since October 1978. The subcommittees comprehensive report on hazardous waste disposal in late 1979 played a major role in spurring enactment of the Superfund legislation. which came out of Mr. FLoRIos legislative subcommittee. Another report by the subcommittee in late 1979 documented its own survey of waste disposal sites. The survey. which constituted the first national survey of its kind. identified 3.383 disposal sites used since 1950 by the 53 largest domestic chemical companies. Approximately 2.000 of those sites were previously unknown to EPA. and the Agency thereafter began its own survey of waste sites. The current investigation is an important one and the subcommittee long ago arrived at the point where the testimony of Ms. Lavelle was critical to effective pursuit of its inquiry. Serious allegations have been raised that she subordinated public trust to the pressures of industry and the vicissitudes of politics. Concerns have been voiced that certain policies and procedures were instituted by senior management officials which delayed the effective implementation of the Superfund program. Her testimony is essential to the subcommittees review of the law. the procedures. their Implementation and of Federal enforcement actions to require cleanup of hazardous waste sites by responsible parties and to recover Federal cleanup costs from responsible parties. Ms. Lavelles failure to testify is not the first difficulty encountered by the subcommittee during the course of th!i investigation. Other attempts to obstruct the subcommittee have also been made. They have all been unsuccessful. The two most egregious examples were the refusal to turn over EPA documents subpenaed by the subcommittee and the refusal to permit unfettered interviews of EPA employees. As the committee knows. the subecmmittee ultimately received all of the documents it subpenaed. and eventually heard the uninhibited testimony of numerous EPA employees during a series of executive sessions. It is regrettable that we have reached this point in our attempt to hear the testimony of Ms. Lavelle. She alone. among the many EPA employees from whom testimony was requested. has refused to cooperate with the subcommittee. It is clear to this Member that If Ms. Lavelle would have appeared and testified. her constitutional rights . would have been fully and vigorously protected by the chairman of the committee. Ms. Lavelles refusal to honor a duly authorized subpena is an act of defiance to the legitimate authority of the Congress. We are a Nation of laws. No one person can be above the law. particularly when that person has been privileged to serve in a position of high trust. In conclusion. I would note that this is not a partisan issue. The committee report contains strong and supporting supplemental views. I would urge my colleagues to vote for the committees resolution. and in so doing. to reaffirm the prerogatives of this body."
980075203,Mr. Chairman. this is a proposal to reduce the amount of money authorized for procurement of MX by $350 million and to reduce the number of missiles procured in this bill from 27 to 21. It is designed to send a dial signal from the Congress. One signal is to the President. It says that we will support having this missile potentially ready for deployment in late 1986 or early 1987. as now scheduled. but we take very seriously your statement of flexibility as to the numbers of MX ultimately needed. and we are indicating by our vote to reduce the funding for procurement. a desire to move slower rather than faster through the deployment of this missile. and we are indicating a preference for lower rather than higher numbers of MX missiles in the end. moving closer to 50 than to 100 by the current FOC date. As for te Soviets. our message would be substantially the same. with one twist. Soviet failure to negotiate seriously or a Soviet decidion. for example. to create a world crisis over the first deployment of the Pershing II rather than to keep bargaining would not be in the interest of peace and stability. These are things which can and will influence the temper of the American people and the U.S. Congress. What we hold back. we can expedite: what we restrict. we can expand. what may not suit us about this particular weapon system. we can satisfy elsewhere. The Congress is going along with the President. but only on condition that he make good on his commitment to aim for an outcome in arms control that reflects a mainline American consensus. The Congress is also putting the Soviets on notice to take advantage of a time. a mood. and an offer that are perishable. Finally. the reason for this amendment is to underscore our absolute intention to deploy a force of MX missiles well below the firststrike threshold. There has been some disagreement over the implications of a combined force of MX missiles and D5 missiles and Minuteman III equipped with the Mark 12A warhead. This amendment seeks to clarify those numbers. to make absolutely certain that we are well below that firststrike threshold.
980133964,"Mr. Chairman. I have the greatest respect for my colleaigue. lhe gentleman from Iowa . but no Member of this body shouid have any misunderstanding abotut the tact that this amendment is the key amniidmient. anid this represents the key vote on this entire bill. If Members vote for this amendinenlt. they are voting to completely gut thle effort to stop as much of tile telephone rate increase as this Coni""ess is capable of stopping. Nowt. let us be candid: Because of mafny events. some of them starting long ago and just concluded by this D~cpartment of Justice and some in the FCC developed by this administrations appointees to the Federal Coinnmunications Commission. for a lot of reasons. it will be impossible for all of the proposed rate increases to be avoidled. Buit If we want to do the best we can to avoid as much of the rate Increases as possible. we should vote against this amendment and vote In fa vor of thle pending legislation. if. on the other hand. Members vote in favor of this amendment anti vote to gut this legislation. then they will bear responsibility for the telephone rate icases which are going to come ne.ft year. If they want to do something about those increases. then they should support the legislation and should by all means defeat this amendment. Mr. Chairman. what is the Issue here? The issue here is really something called joint cost allocatlon. That sounds complicated. but it really is not complicated. Let me give thle Members a simple illustration. If the gentleman from lowa anid I together bought an auitomobile and he was going to use It four days a week and I was going to use it 3 days a week and we decided that we would share the payments to the bank. we would have allocated thle joint cost of that automobile between us because we were both using the automobile. Now. if. after a year or so. the pattern of usage changed and I found that I was using thle automobile only 2 days a week. on weekends. and the gentleman from Iowa was using it five days a week. if I then went to my friend and said. ""Look. I am not using this car- as much as. I used to. and you are going to need it anyway. Why do not you pay all of the bank payments. 100 percent. and let me pay nothing anid let me keep using the car 2 days a week for free?"" That would not seem fair and just. But that Is exactly what AT&T is trying to say to the local telephone companies. Together. the long distance business and that local telephone business jointly built a telephone system which has been and remains thle greatest in the world. An essential part of that system is that local telephone loop. Always in the past the cost of that total telephone loop has been shared both by local customers and by longdistance ctustomers. Both of them uts the local telephone loop. After all. we cannot make a longdistance telephone call unless we first originate it on local telephone lines and poles and then take it through the longdistance system and then complete the call through another extensive set of local telephone lines and poles. At the current time longdistance callers pay a share of the cost of that equipment and those lines anid poles that they use. Now. for years there have been arguments that long distance was paying too much of that cost. The word. ""subsidy"" has been used. Well. of course. the percentage that they pay is going to come down In any event. Under the legislation. it Is going to come down. But I wonder how many of my colleagues realize how radical and extremist a plan the FCC has come up with that this legislation Is trying to prevent. The FCC. incredibly. has decided that 100 percent of those local costs for lines and poles ought to be paid by the local ratepayers. anid that the longdistance business and longdistance callers ought to use all of those lines and poles fur free without paying anything for the use or those lines and poles. Now. tell tie about the word ""subsidy."" What that plan would result In is a subsidy by local ratepayers for thle longdistance businesses. That would let t.he longdistance businesses use these lines and poles for free."
