speech_id,speech
980179319,"Mr. Speaker. the people of Tennessee and. indeed. of this entire Nation have suffered a great loss in the death of former Representative Joe L. Evins. For 30 years. Congressman Evins served as a Member of this body. From the time he was first elected to Congress on November 5. 1946. until the day he retired. he dedicated himself to fulfilling the needs of the people of this Nation. While in Congress. he served as chairman of the Public Works Appropriations Subcommittee and of the Committee on Small Business. Through his devoted committee work and his persistent efforts. he became known as a champion for the common man. However. Congressman Evips did not exclusively concern or commit himself to any single group. He sought to reach all of the Nation by pushing for a plan he called the building of America. To Joe Evins. building America meant providing hospitals for those in need of medical care. building libraries to give people theopportunity to read and to educate themselves. supporting irrigation projcts for the West. and building TVA dams to control flooding and to provide electricity for the South. Even though these were the areas of major national concern. Congressman Evins continually sought to extend his philosophy. that public works projects are an investment in the American people. to all areas of American livelihood. Congressman Evins knew that the people of the United States were the backbone of this great Nation. and he encouraged us to work for progress. He was a strong force behind the model cities program to upgrade our towns and to enhance the quality of life for urban residents. He was also a staunch supporter of science and technology because he felt these areas represented American ingenuity and were the keys to progress in the future. He pushed for medical research and experimentation. for the development of new fabrics. and for the construction of new building materials. Furthermore. he sought to broaden our horizons by supporting the space program. and in acknowledgement of his unyielding support. a plaque bearing his name rests on the moon. Even though Congressman Evins was an important and influential man here in Washington. he never lost touch with the people back home. As he walked quickly down the Halls of the Capitol. he was often greeted by. ""Good morning. Mr. Chairman."" yet in his hometown of Smithville. Tenn.. it was merely. ""Hi Joe."" He came to Washington as a Representative and never forgot the people of the upper Cumberland regionhe himself was one of us. Born on a farm in DeKalb County. Tenn.. he was a deeply religious man whose honor and integrity were never questioned. He graduated from Vanderbilt University and from Cumberland Law School in the early 1930s. He served as an Army attorney in Europe. reaching the rank of major by the wars end. After the war. he first ran for the congressional seat he was to hold for 30 years under six Presidents. Throughout his years. Congressman Evins sought to bring Government to the people. In 1963. he authored ""Understanding Congress"" because he felt Congress needed to be strengthened and better understood. since it was ""the bulwark of democracy."" He worried about waste in Government and about a system which ventured to far from commonsense ideals. Fortunately. he never lost sight of what he believed were the basic cornerstones of Americas greatness: The spirit of America. the Constitution. education. our religious heritage. and the community concept of neighbors helping neighbors. Congressman Evins retired on top in 1976. having never lost an election. Throughout his tenure here. he had always been known as a hard worker and a devoted family man. He had come to Washington to represent the people of his district. and when he retired. he fittingly went back home to the district and people he loved most. Many Congressmen on both sides of the aisle have benefited from his wise advice. Certainly I. as many of you. have sought his counsel many times through the years and feel that I have lost both a good personal friend and a mentor in the death of Joe Evins. His integrity and hard work were shining examples to all of us who knew him. His devotion to his family. his district. and to the people of this Nation were unparalleled. Today we mourn the loss of Joe L. Evins. but we will always remember his compassion and his accomplishments for the people of this country. Mr. Speaker. I include for the RECORD an article from the Smithville Review. FORMER CONGRESSMAN JOE EviNs DIEs Former U.S. Representative Joe L. Evins who represented Tennessee in Congress for three decades. died Saturday at 8:17 a.m. in Vanderbilt Hospital. Nashville. after an 11day stay. He was 73. A native of DeKalb County. Evins had suffered three heart attacks. most recently in February 1982. He retired after his 15th term in Congress in 1976. saying he wanted to spend more time with his family and wanted to ""quit on top"". While in office. his power was unequaled among the states house delegation. Countless buildings. bridges. dams. sewer projects. airports and other public facilities. and millions upon millions in federal funds came to this area through Joe L. Evins. whose power in Washington and popularity at home was so great he held the office 30 years. with little or no opposition and with the approval and respect of people from both political parties. It was Evins. in fact. who persuaded President Lyndon Johnson to pour millions in federal funds to small towns rather than large cities when Johnson first came up with the idea for Model Cities. a program which is often credited with bringing Smithville into the 20th century as a leading city in the Upper Cumberland. Submitting Johnsons proposal of federal funds to aid four or five large cities wouldnt get far in Congress. the powerful Evins told Johnsons men. But a program to aid medium and small cities would draw a broad base of support. he said. * Smithville and neighboring Cookeville were two of the approximately 150 locals in the nation that went on to enjoy the Model Cities boost in the arm in the following years. Representing a rural and small town district as he did. Evins was one of the most effective and influential spokesmen for agricultural and small business interests in the House. and devoted much of his energy to promoting a governmental atmosphere favorable to the preservation of that fastvansihing phase of American existence. Despite his many years in Washington. Evins remained pretty much a country boy himself. While he was still a small child. his family moved into town. to a twostoried brick colonial house built by his grandfather in 1889. The house was only three blocks from the DeKalb County Courthouse and his father. J. Edgar Evins. was a magistrate for 35 years and mayor of Smithville for 15 years. so young Joe sort of grew up around the courthouse. The elder Evins was a businessman. banker and political power in Smithville for decades. He was a state Senator. a member of the state Democratic executive committee. a building contractor responsible for construction of many of the towns major buildings and for 24 years operator of Consoldiated Bus Lines. which ran a transportation network from Chattanooga and Knoxville to Nashville and into Kentucky. In DeKalb County High School. he belonged to the 4H Club and the Theta Epsilon Literary Society. was business manager for the schools student newspaper. Spunk. and was a member of the school debating team. The high school organized its first football team in 1926. and Evins landed a spot on the team as left end. although he weighed only 135 pounds. when the star left end broke his arm. But when we entered Vanderbilt University. the team of Coach Dan McGugin had an ample supply of heavier left ends with sound arms. so Evins became the team manager. At Vanderbilt. he was a member of Phi Kappa Sigma. a social fraternity. and Phi Delta Phi. a legal fraternity. and was a member of the sophomore Wise Owl Club. president of the PreLaw Club and assistant editor of the college annual. In his senior year. he was elected to the Commodore Club. an honorary club composed of 12 members chosen for student leadership. Upon his graduation from Vanderbilt with a bachelors of arts degree in 1933. Evins turned down an offer to become clerk and master of DeKalb County Chancery Court and. instead. entered Cumberland University Law School in Lebanon. where he graduated in 1934. He took his law degree back to Smithville. hung out his shingle. and married Ann Smartt. daughter of Circuit Court Judge R. W. Smartt of McMinnville. who was teachIng school in Smithville. Evins father was for many years a political power in the congressional district and. through his influence. young Evins was offered a job in Washington by Ewin L. Davis. chairman of the Federal Trade Commission and a former Tennessee congressman. The job. said Davis. was temporary. dependent upon the availability of.funds. but Evins rose in three years to the post of assistant secretary of the agency and was still with the FTC when World War II broke out. ""I figured someone else could do the job."" said Evins. ""I quit and volunteered for the Army."" Meanwhile. during his tenure with the PTC. Evins pursued postgraduate legal studies at George Washington University. During the war. Evins rose to the rank of major in the Judge Advocate Generals Department. spending his first two years of military service in Washington and two more years in England. France and Germany. During his last year in England. 1944. Evins was qualified as his fathers opponent in the Democratic primary for the state senate from his threecounty 12th District. The elder Evins withdrew and his son received the nomination. but after the primary. Joe Evins withdrew in his turn. and his father was nominated and elected. On his return from overseas. Evins began to receive a great deal of encouragement from friends in the district to become a soldiercandidate for Congress in the old 5th District. ""I didnt need much."" he said. ""I became GI Joe. soldierlawyer and candidate for Congress."" He wasnt conceded much chance against the oneterm incumbent. Rep. Harold H. (Doc) Earthman of Murfreesboro. but he won handily. and from that time on was never seriously challenged as representative of the sprawling district. Even after many years in the House. one of his friends called Evins ""a remarkable combination of political naivete and political shrewdness."" but the naivete had very much the upper hand when he reported as a new member of the House along with such other freshmen as John F. Kennedy and Richard M. Nixon. Eager and self confident. he asked a colleague one day if he would yield the floor so Evins could speak on a TVA appropriations bill. ""Yes."" answered his colleague. ""if the gentlemen has anything to offer."" ""I learned then. ""Evins said later. ""that it takes time to get your spurs."" He learned. too. what committees are for. Trying to help his friend. Rep. J. Percy Priest of Nashville. get money for a new Veterans Administration hospital. he topped up on the floor and offered an amendment. It was voted down immediately. Later. working through a committee. he succeeded in getting through an amendment providing $10 million for the hospital. As an exserviceman. l!e was appointed to the Veterans Affairs Committee upon his entry in Congress. and he learned there that (a) legislation without appropriation is useless and (b) appropriations are controlled in committee. : With that in mind. he made inquiries and learned that his colleagues considered Rep. Clifton A. Woodrum of Virginia. chairman of the Appropriations Committees independent offices subcommitteee. one of the few most influential men in the House Evins set his eye on the Appropriations Committee. When Rep. Albert Gore Sr. of Cordell Hulls old 4th District. father of the present congressman. went up to the Senate In 1952. Evins had his chance. He became Gores successor in the 4th. because his own 5th District and Gores 4th were combined in a reapportionment law. and Evins was elected to represent the new 4th. More important to Evins personal career. he succeeded to the spot Gore relinquished on the House Appropriations Committee. Later. he followed Woodrum as chairman of the independent offices subcommittee. but gave up that chairmanship early In 1971 to become chairman of the public works subcommittee. Evins also served on the House Armed Services Committee and the Small Business Committee during his tenure in the House. and for 12 years was chairman of the latter committee. His interest in the small businesses typical of his congressional district caused him to devote particular %itention to the Small Business Committee. where he succeeded to the membership held by the late Estes Kefauver when Kefauver advanced to the Senate in 1948. * In 1955. Evins was named chairman of a subcommittee to find out whether the Federal Trade Commission and other agencies had become ""puppets"" of the executive branch of the government. and in 1959 he was appointed head of a special ""watchdog"" subcommittee to ride herd on the Small Business Administration. He also served as chairman of the House Committee on Personnel and Patronage. which handles about 500 job appointments. including Capitol Hill pages. clerks and police officers. Sometime before his retirement. Evins had emerged as one of the top 20 members of the House in influence and power. and some insiders ranked him among the top 10. In his early 60s. he had achieved heights usually reserved for a handful of congressmen in their 70s. and there was talk that one day he might become Speaker of the House. a Mr. QUILLEN. Mr. Speaker. I would like to take this opportunity. along with my colleagues. to pay tribute to former Congressman Joe L. Evins. who recently passed away. Congressman Evins was first elected in 1946 and served with distinction until his retirement in 1977. I was privileged to serve with him for 14 of those 30 years. He chaired the House Committee on Small Business and was instrumental in the creation of the Small Business Administration. He was a champion of small businessmen. and his efforts in their behalf will long be remembered. He was known as a man who could get things done. not only for his constituents in the Fourth District of Tennessee. but throughout this great Nation. In his positions on the House Appropriations subcommittees. he was dedicated to funding projects in every Statefollowing his plan he called ""the building of America."" Congressman Evins was justifiably proud of his accomplishments directly benefiting his district and the State of Tennessee. He was responsible for bringing hospitals. schools. airports. and highways into the Fourth District. and he helped get the funding for the Veterans Administration Hospital in Nashville. Though we sat on opposite sides of the aisle. I have to say I admired him for his commitment to serving his constituents. When I first came to Washington as a Member of this body in 1963. I immediately became aware of his tremendous reputation for both individual constituent service had his skillful use of his senior legislative position on national issues. He became something of a role model for many new Members. particularly on his side of the aisle. He may never have realized how many freshmen set out to follow down the path he established. He was the dean of our delegation for a number of years. Being in that position myself. now. and looking back at the changes in our State over the years. I marvel at the impact his career had on the State and its residents. Times have changed. both here in Washington and in Tennessee. They have changed. in part. because he helped them changeall for the better. His is a name that will be longremembered both in the State he loves so well. and on Capitol Hill. In that. we can see the true measure of his life on this Earth.e"
980184427,Mr. Chairman. I would like to rise in support of H.R. 5172. and to congratulate my friend. Mr. WALGREN. chairman of the subcommittee. Chairman FuQUA. and ranking minority member. Mr. WINN. for their excellent work in creating this bill. and I urge my colleagues to support it. In particular I would like to address one component of the bill which has been sponsored by myself and the gentleman from New Mexico . the ranking minority member of the subcommittee. has resulted from the work of my Subcommitteee on Investigations and Oversight. All of us have read about failures of buildings and bridges throughout the United States that resulted from failures in their structural design. Examples such as the collapse of a walkway at the Hyatt Regency Hotel in Kansas City. or the failure of a bridge along interstate 95 in Connecticut are well known. Moreover. in many of our districts we know of some building or bridge that collapsed long before it should have. In its investigation of these structural failures. the subcommittee did not seek to assess blame In any particular case but rather sought to identify generic causes and factors responsible for these failures. The most alarming of the findings is that there is no mechanism for learning from our past mistakes. Results from the investigation of a failure usually just end up in the files of a law firm or Insurance company. or are sealed from the public aitogether in the litigation settlements. Without some public access and a central repository for this data. the professionals involved in architecture. engineering. and construction do not have easily accessible technical data on the causes of the collapse and they cannot use the data to avoid making similar mistakes. Section 307 of this bill charges the Bureau of Standards with maintaining this repository. an idea which has been widely endorsed by the professional community. Section 307 also gives the Bureau the statutory authority to conduct Investigations of major structural failures. This is not new. it merely gives the Bureau statutory authority to execute a function it has been carrying out for 15 years already. The Bureau has made a number of investigations of major failures throughout the country. which have been enormously helpful in preventing their repetition. Section 307 does not give Bureau regulatory or police powers. All language that would have preempted the authority of local and State authorities was purposefully left out of the II13096 amendment. Moreover. the report to accompany H.R. 5172 makes it clear that the committee intended that these investigations of structural failures be done in full cooperation with State and local officials. Lastly. the Bureau is not required to undertake any investigation. the decision of whether or not to investigate is left to the discretion of the Director of the Bureau of Standards. Section 307 is widely endorsed and recognizes the excellent and helpful role the Bureau has been performing.*
980199958,"Mr. Chairman. first of all let me explain why I am offering this amendment. This is essentially the BrownCoughlin amendment. It has minor changes in the wording and its principal purpose is to insure that the first vote which occurs will be on the essence of the BrownCoughlin amendment. Now. let me speak to the merits of this issue. I urge my colleagues to listen. those who are in their offices watching on television. I think this is one of the most important arms control votes in this Congress or in any other Congress. I implore you as a Member who has worked long and hard on arms control issues and as one who has worked with the administration when I felt the administration was right. I believe the administration is wrong on this antisatellite question. We have here in essence a failsafe point. If we cross this threshold. then the sky is the limit. It is ""Katie. bar the door."" Why? Because the strategic satellites are perhaps the most stabilising element in the nuclear arms race today. They give both sides the ability to see and hear what is going on in the other country. We can monitor testing programs.. We can see their ICBM sites. We can see when they launch missiles and when they test missiles. And. I might add. we in the United States have a much more elaborate and sophisticated and valuable capability in space than does the Soviet Union. It is to our advantage to have a ban on systems that threaten satellites. Now. much has been made of the fact that the Soviet Union has tested a system. The United States tested a system. We have conducted more tests than the Soviet Union has. a cumbersome system that would explode Soviet satellites. We dismantled it. We dismantled it several years ago. Their system is very primitive and very cumbersome. It relies on explosive devices. It can only get at lowaltitude systems. The F15 system which we are prepared to test against an object in space has the ability to be upgraded without the Soviet Union finding out about the upgrading. It is nonverifiable. It has the ability to be upgraded to threaten not only the lowaltitude satellites. but also the very highaltitude satellites upon which stability depends. Do not vote for the McCurdy amendment. My colleague is an excellent Member who is well intentioned. but his amendment is based on the wrong premise. He would allow the administration to go forward with what it wants to do when the chief problem is. at least on this case. that the administration has said that it does not want to even talk to the Soviets about weapons in space or about the ability to get a treaty there. Do not vote for the Byron amendment. again a wellintentioned effort. but again it is based on the wrong premise. We have a qualitative leap frog problem here. not a simple numerical effort to have the exact number of tests. It is a different system with different capabilities. Vote for the BrownCoughlin amendment. The first vote will occur on the BrownCoughlin amendment. in essence. Now. in microcosm. this issue really represents the fundamental challenge of our times. Are we going to be up to the task of arms control or are we going to surrender to the inexorable march of technology and when one side getE some new technological development. do we automatically have to get one better than them. no matter whether or not it pushes us beyond any capability to have verifiable arms control? If we are going to stop the nuclear arms race. we have got to be willing to assert arms control prerogatives and say that technology does not always come first. Stability comes first and when we have a technological development that we know threatens all future arms control efforts. we have a responsibility in this Congress to speak out and say no. let us stop it. We have an opportunity to have a moratorium. Let us vote for the BrownCoughlin amendment"
