speech_id,speech
1140068639,Mr. President. I wish to speak about the Every Student Succeeds Act that the President signed into law today. I want to first congratulate my colleagues Senator PATTY MURRAY and Senator LAMAR ALEXANDER. who have effectively been able to guide this bill through the Senate. It has been an honor to watch and participate in this processa process that has served as a great example of the way the Senate is supposed to work. When the original Senate version of the Every Child Achieves Act came to the floor for a vote on July 22. 2015. I could not support it because. while it made necessary changes to the No Child Left Behind law. I could not in good conscience support a bill that fell short of investing in the potential and promise of all of our children. especially New Jerseys most vulnerable students. I stood resolute in the belief that if Congress was truly going to invest in our children and grandchildrens future. it was vital that any legislation passed provide support. access. and opportunity to equip the next generation to succeed. regardless of their socioeconomic status. These needs were particularly poignant given the historic context of the original Elementary and Secondary Education Act as a civil rights bill. Created the same year as the Voting Rights Act of 1965 and just 11 years after the landmark Brown v. Board of Education decision. President Lyndon B. Johnsons original piece of legislation intended to address the gaping gulf in the quality of education received by lowincome students in an intensely segregated country. Indeed. this piece of legislation was a vital tool in President Johnsons arsenal on the War on Poverty. It is undeniable that education is a cornerstone of the American Dream to achieve success and financial security. We do our Nation and our children a disservice if we do not do everything in our power to ensure that President Johnsons arsenal is not only maintained. but honed and replenished with robust provisions to fight an evolving battle for educational equity in our schools. Although I did not vote for the original Senate version of ESEA that passed the Senate in July. I am glad to see a conference report. the Every Student Succeeds Act. ESSA. that takes elements from both the House and Senate bill and ultimately is a better bill for all children. teachers. and parents in our country. Chief among provisions that I believed were problematic was the lack of accountability measures to ensure Americas most vulnerable students have access to a quality education. With regards to accountability. it was critical not to be overly prescriptive while still acknowledging an intense need to identify and ask schools and districts to figure out specific plans to turn things around in the lowest performing schools and high schools who fail to graduate onethird of their students. It is also critical to identify where there are groups of students who are consistently performing worse than their peers. I do not believe these changes should come from Washington. Local teachers. principals. and parents are best equipped to know how best to turn around a failing school. and this bill gives them the arsenal to do so. I believe the new accountability provisions empower local leaders. with State and Federal guidance. to pursue the improvement strategies best suited to their local needs. These accountability measures are vital if we are to guarantee that the ideals our students pledge allegiance to every day. justice and liberty for all. are manifest in the education we provide for our youngest Americans. With this goal in mind. I am also pleased that ESSA includes my amendment to support homeless and foster youth. by ensuring educators and the public are aware of how foster and homeless children and youth are performing on critical elements compared to their peers by adding reporting for these groups on graduation rates to the State and school district report cards. The role of teachers is also prioritized in ESSA. and I was especially proud to see the amendment I authored that helps support teachers by asking school districts to identify opportunities to make working conditions better and more sustainable. With these improvements made and the spirit of the bill as an important piece of civil rights legislation maintained. I wholeheartedly support the reconciled version that has passed the House and Senate and that was signed by the President today.
1140082853,Mr. President. today the Senate Committee on Commerce. Science. and Transportation approved legislation to reauthorize the Federal Aviation Administration. I applaud the work of my colleagues Senators THUNE and NELSON. Their leadership on this important legislation was critical. I would like to make clear that. while we took important steps forward with this legislation. more work remains to be done to ensure the United States remains a global leader in aviation. safety. and innovation. Going into this year. many on the Commerce Committee. along with Department of Transportation Secretary Foxx and FAA Administrator Huerta and key stakeholders. aimed high on FAA reauthorization. We aimed high because there are big ideas we need to address when it comes to aviation in this country. From the current state and financing of our airport infrastructure. to completing NextGen implementation. to accelerating commercial use of UAS technology. to new proposals about our Air Traffic Control system. there were a lot of innovative ideas on the table. and while we made strides on some. more work remains to be done. There is widespread agreement that the status quo is not acceptable. and I was pleased to join my colleagues in taking this initial step forward to reauthorize the FAA for the upcoming 18 months. Furthermore. I am pleased that I was able to put forth amendments that were included in this bill to ensure adequate staffing levels at the Newark air traffic control tower. In addition. we were able to secure a muchneeded study of the New York and New Jersey airports. which cover the busiest airspace in the country. Findings from this study will enable us to make informed decisions about how best to address this staffing problem in the future. I am also concerned about staffing levels at the Transportation Security Administration. TSA. There have been incredibly long delays at Newark airport because of inadequate staffing of TSA agents at our airport. Safety is absolutely paramount in our airports. It is my hope that we can achieve both topnotch security and an efficient. reliable process for travelers using our airports. Increased staffing should help us achieve that goal. In this reauthorization. I was pleased to work with Senator CANTWELL to increase competition in the Newark airport with the hope that increased competition and opening up more flight slots at the airport may yield more options and price points for consumers. But I must stress that these changes cannot move forward without ensuring the airport is equipped to handle more traffic and passengers. I look forward to continuing to work with my colleagues on this issue and am excited by the opportunities this could bring for my constituents. We also made progress on furthering the integration of unmanned aerial systems. UAS. or drones into our airspace in our legislation. This technology is literally taking off around the world. It has the power to enhance search and rescue. deliver humanitarian aid. improve agriculture practices. and newsgathering. I introduced the Commercial UAS Modernization Act to help advance this technology and was pleased to see many of our ideas incorporated in this legislation. I worked with committee leadership to further advance a microUAS rule. which would allow U.S. businesses to fly microdrones under 4.4 pounds responsibly and safely. Advancing microUAS use will bring tremendous innovations and new efficiencies across the country and will keep the United States on par with other developed nations who have been making great strides ahead of us in utilizing this technology. From improving research to providing unmanned bridge inspections. the benefits of this technology are truly limitless. UAS has the power to save lives and create new efficiencies across industries. I am excited to see what the innovators and entrepreneurs come up with as a result of our rule which sets forth clear safety guidelines for responsible operation. Finally. I want to address a couple of amendments that I put forth that were not included in this legislation and express my sincere hope that the chairman and ranking member will work with me before this bill gets to floor. I introduced two amendments to the bill that would address disadvantaged business enterprise. or DBE. projects. The goal of this program. of course. is to promote equity and inclusion in federally financed transportation projects. While neither of these amendments were incorporated into this legislation as of yet. I am confident that we can work together to advance this important policy goal. One amendment would ensure conformance of the DOT size standard for small businesses to the metric defined by the Small Business Administration. This update will enable more minority and womenowned businesses to compete for infrastructure work. The second amendment sets goals for minority and womenowned businesses on projects financed only by passenger facility charges. or PFCs. I ask the chairman and ranking member to continue to work with me as this bill goes to the floor to advance these two important goals. Thank you.
1140095720,"Mr. President. I rise today to join my colleagues in supporting the conflictofinterest rule that was recently finalized by the Department of Labor. This is a fair and balanced rule that protects our Nations retirees and savers. In fact. it is a rule that makes sure that in the midst of a retirement crisis in this country. where people are having a harder and harder time making sure that after working a lifetime they have the money they need to retireit is bringing common sense back to that process. I firmly believe that the conflictofinterest rule should not be a partisan issue. That is because this rule comes down to those fundamental ideas that really know no party bounds. Again. the idea for me is about honor and common sense. By honor. I mean the idea that we are a country that believes every American deserves a fair opportunity to succeed. Fairness is at the core of our Nations idealsthis idea that we are all bound to do what we can to identify and change systems that stack the deck against hardworking families that play by the rules. This body and its history have done so much to level the playing field and make sure that we have a free market and a fair market. It is because we as a nation value dignity and stand against those who seek to exploit or take advantage of others. In fact. we understand that we have an obligation to our country men and women. We have an obligation to each other to ensure that there is a level playing field that no one can take advantage of or exploit. We participate in. abide by. and are meant to benefit from this social contract and understand that a social contract and a vibrant economy are not mutually exclusive. Actually. they reinforce one another. These principles make America exceptional. They empower and embolden our freemarket economy. They generate strength and security for more families. They ensure abundance and allow us to strive for ideals of life. liberty. and the ability to pursue happiness. So I believe we are honor bound to uphold these principles. to ensure fairness and opportunity for all. We also must understand that fairness is a key ingredient in broadbased economic growth and strength. When I talk about common sense. I mean people have a reasonable expectation. in a free market. to be treated fairly and justly. especially in those areas that are most critical to their lives. It is rational. therefore. and just common sense. for us to insist that when we are treated by a doctor. that the doctor is going to place the interest of our health over their own financial interests. It is understandable that when we go to see a doctor. what is paramount is what is in our best interest. It is also understandable that we have that standard when it comes to the law. and. when we seek legal counsel. we are right to expect our lawyers to act in our best interest. That is the standard for doctors and for lawyers. for our health and wellbeing and for those legal decisions that will affect our lives profoundly. When we seek advice on an issue as serious as our health. our livelihoods. and our finances. we expect to be treated with the highest standards of care. and those professionalsthose lawyers or doctorsshouldnt in any way be inhibited in their ability to make a livelihood. Indeed. in many cases. they should flourish. While the vast majority in the financial industry are strong advisers who put the interests of their clients first. the challenge we have right now is that unlike doctors and lawyers. those financial advisers are not required to put the interest of their clients at the high level of a fiduciary standard. As a result of not having that same high standard of care as doctors and lawyers. there are some within that industry who actually take advantage of families trying to plan for their retirement. A large money market manager recently said: ""As active equity managers we have all been on the hook lately to justify our value proposition. And we should be. since the facts clearly show that as an industry. we have not consistently provided the performance that investors deserve."" Here are folks who have incredible financial knowledge. sophistication. and acumen talking to everyday Americans and putting forth this idea that they are going to help them retire with security. but they have no obligation to do what is in their best interest. to uphold the highest standard of care. That is problematic. and industry leaders understand that. They understand we cannot allow space for those who might seek to exploit families. struggling to retire. for their own financial interest. It is this idea that is at the root of the conflictofinterest rulethe idea that hardworking Americans saving for retirement deserve to be treated with fairness. with honor. and with a mutual obligation Americans should have toward each other. so that if they seek advice from a financial adviser. they deserve to get advice that prioritizes their needs above all others. This is about fairness. This is about common sense. I was proud to stand with the Secretary of Labor. Secretary Perez. and my colleagues Senator WARREN and Senator MURRAY when this final rule was announced. I am proud that prior to that. the rule went through a very lengthy and diligent process that allowed for robust feedback from all types of stakeholders. Throughout the rulemaking process. the Department of Labor demonstrated patience and inclusiveness of all perspectives. and. most of all. an unyielding commitment to protecting our Nations workers and retireesprotecting the bedrock of our country and the very idea of the middle class. that if you work hard and play by the rules. you can retire with security and dignity. The result of all the work of the Department of Labor and their commitment to this ideal is a fair and balanced rule based on the ideas of common sense and honor. The fact is. for so many Americans. it could not come at a more important time. In fact. it could not come at a more urgent time. We have a retirement crisis in our country. So many people are working harder and harder but are finding themselves with more month at the end of their money than money at the end of their month. Many people are finding it harder and harder to save for retirement. In fact. right now one in three arent saving for retirement. The Federal Reserve found that a whopping 47 percent of Americans dont have the savings to even cover a $400 emergency expense. Since the financial crisis. retirement readiness for the average American has actually decreased. Families are seeing greater challenges now in securing their own future. They are seeing greater difficulties securing the American dream of being able to work hard. play by the rules. and retire with dignity and security. I know this personally. and my office does because we hear from constituents all the time about their real stories. not just of the difficulties of planning for retirement but in dealing with a financial industry that often takes advantage of their clients. Last year I heard from one of my constituents in Lakewood who wrote to tell me about his mother. After losing her husband. she went to seek advice from a financial adviser to help her sort out her finances and plan for her retirement. She put her trust and her livelihood in the hands of this adviser. but the conflicted advice she received ended up costing her tens of thousands of dollars. Saving for retirement is stressful. At kitchen tables in every town. every city across the country. families are struggling to figure out how best to save for retirement. and here was an adviser who provided conflicted advice. costing my resident in Lakewood tens of thousands of dollars because they trusted and relied on the fact that the advice the financial retirement adviser was giving them was in their best interest. This is wrong. and it is unfair. Especially for those Americans who dont have much to begin with. the way they manage their retirement savings means so much. Huge gulfs continue to persist in retirement savings between men and women. the poor and the wealthy. and minority families and their White peers. This is a problem for all Americans. from all different backgrounds. It is a crisis in our country. For so many Americans. in regard to this rule. there is so much at stake. Good advice from a retirement adviser can make a world of difference. In fact. it can be the difference between security and financial crisis. It can be the difference between retiring with ease versus retiring with stress and dependence. That is why the advice of a trusted retirement professional is so important. There are many good actors in this space who know that increased transparency. increased accountability. and the idea of profitability dont need to be mutually exclusive. In fact. there are people making extraordinary livings in this space by doing the right thing for their clients. Honest. hardworking brokers know that updating the standards expected of retirement advisers is common sense. fair. and it actually helps America as a whole become stronger. That is why industry leaders are already making changes to prepare for this rules implementation and why the CEO of a major money management firm recently implored his industry colleagues by saying: Lets not lose sight of why clients engage us in the first place: to help them save the money they need to buy a house. send their kids to college. retire comfortably and meet any other longterm financial goals they have. This CEO is 100 percent right. and I am happy many companies are beginning to ensure their retirement plans make the most of their employees savings. According to a recent Wall Street Journal report. the administrative cost of retirement plans fell to their lowest level in a decade in 2015 and with this rule. they will continue to fall. The needle is moving in the right direction. To attempt to block this rule now would be a step backward. and it would send a message to hardworking Americans and retirees that they simply dont matter enough to this body. that this body cares more about special interests than hardworking families. It cares more about financial advisers on Wall Street and their ability to exploit middleclass Americans than it does those middleclass Americans who believe in the American dream that is being put at risk. To not support this rule would be to roll back what we all know. that we can create a winwin and a fair economy that doesnt exploit people who are vulnerable but uplifts them. where both financial adviser and middleclass retirees can have success. I know men and women in our countryand many who serve herewho know and understand the challenges of planning for retirement. Look. on the day this rule was announced earlier this year. I understood some people would try to fight this. and I turned to the folks listening and said: Look. this fight is not over. We are going to have to continue. Let us as a nation fight for what is right. not for the special interests of the wealthy few. Lets not allow people to feast upon the retirement savings from the hard work of others. but lets fight to affirm the middleclass dream in America. Lets fight to make sure we are doing right by folks. Lets create a level playing field. This is a fight for people like the constituent of mine who not only lost her husband but too much of her savings and now is trying to pick up the pieces. This fight is not over for hardworking families across this country who are diligently saving for retirement and for whom these hidden fees. unfortunately. threaten to undermine decades of hard work. These hidden fees are insidious. These hidden fees allow some advisers to exploit people for their own enrichment. These hidden fees are unAmerican. We must continue to make sure those hardworking advisers who provide exemplary levels of service. who prioritize their clients interests. are the ones being elevated in this fairer system and not being maligned by those few bad actors who feast upon the savings of other people. This fight has to be about what it means to be an American. That is what this body did when it passed the Employee Retirement Income Security Act 40 years ago. We believed in the idea that America is a place where if you work hard and you play by the rules. you can retire with dignity and dont have to worry that your doctor or your lawyer or your financial adviser will exploit you and thrust you into insecurity or worse. This is what we must do in this body now. In the spirit of past actions. we must put the interest of our middleclass constituents first. plain and simple. This rule is fair. This rule is balanced. This rule helps our free market economy. This rule ensures that the highest standard will be applied to something as precious and fundamental as our retirement savings. It preserves honor in this business. It preserves honor for America. The needle has already moved forward. We cannot afford to go back. Mr. President. I yield the floor."
1140101269,Mr. President. I said one more question. but I have two more questions. This is sort of a progression. My friend is here today because of a commitment Senator MURPHY made in his maiden speech in the U.S. Senatea consistent sense of belief that my friend will never give up until we have commonsense gun safety in America. After the grievous act that we saw in Florida. where 49 innocent people were slaughtered. Senator MURPHY. Senator BLUMENTHAL. countless Senators. and Iat least half of our caucus has come down here and said the same thing: Enough is enough. We cant let business as usual happen. No. 2. and the reason my friend stood up and has been holding the floor for 91/2 hours. has been in order to say: Hey. the terrorist loophole should be closed. There is one more element to this progressionan indefatigable Senator with a noncontroversial element in terms of the terrorist loophole. but now there is this other piece. which is just common sense. and I want to take that one step and ask that my friend go a little deeper with it. That last step is this: If you just have the terrorist loophole closed but dont have universal background checksin other words. if you close the terrorist loophole so that anybody who goes to a Federal firearm licensed dealer or goes to a NICS check. that stops that terrorist. but if you still have these Internet and private sales. that terrorist. who probably will not even go to that Federal arms licensee. will go to the back doors that are still wide open for people to get guns. So what the Senator from Connecticut is saying is that he is not giving up. No. 2. 70plus percent of NRA members agree with me on what I am asking for. This last step. where the majority of gun owners in America agree. why is it important to also make sure that if we want to stop terrorists from doing what they did in Orlandoif we do nothing. it may happen again. God forbid. Why is this universal background check element the second thing my friend is standing up for today. along with his colleagues?
