speech_id,speech
1130037424,"Madam President. I thank the Senator from Virginia. There is no one in this body more passionate to do the work to get us to a balanced bipartisan deal. to put the budget deficit and the budget issues behind us. and to get our country back on track than the Senator from Virginia. I know he wants to get to a conference committee as badly as I donot to demand that we only have our position but to work with others to find a bipartisan solution. As he so eloquently stated. it has been more than 100 days now since the Senate did pass a budget. and we have tried now 15 times to take the next step to move to a bipartisan conference with the House. Every time we have asked. we have been blocked by a tea party Republican with the support of the Republican leadership. I understand that for some factions in the Republican Party. ""compromise"" is a dirty word. That may explain why they have offered up excuse after excuse for blocking the regular budget order we are trying to work toward. They refuse to allow a conference before we get to a socalled preconference framework. They demand we put preconditions on what can be discussed or talked about in a bipartisan conference. to claiming that moving to a budget conferencewhich leading Republicans called for just months agowas somehow now not regular order. to most recently claiming we need to look at a 30year budget window before we look at the major problems we have in front of us right now. when we canand mustdo both at the same time. I know there are significant differences between our parties values and our priorities. Some of usDemocrats and Republicansthink this is a reason to come together and try to reach a bipartisan deal in a budget conference now. It has been heartening to hear from Senators MCCAIN and COLLINS and many other Republicans who have chatted with me about why they believe we need to have a formal bipartisan negotiation move on this. Unfortunately. there is a small group of Senators who would prefer to throw up their hands and stall until we reach a crisis. when they think they can get a better deal. Last week. I was home in my State. similar to most Senators. and I talked to a lot of Americans who dont understand that kind of approach. They run their businesses and help their communities and support their families by compromising every single day. They cant afford to wait to reach agreements until the very last minute. because when that happens. they have to deal with the consequences. But that is exactly what my Republican colleagues are doing to thousands of my families in the State of Washington. Because Republicans will not allow us to come to the table. the automatic cuts from sequestration are impacting everything from children who depend on Head Start to our national security. What is more. many of the same colleagues will try to tell you that sequestration is not impacting American families. As the Senator from Virginia just talked about. I can tell you firsthand that the impacts are real. For thousands of families in my home State. these become a reality tomorrow morning. That is because furloughs for the Department of Defense employees begin this weekequivalent to a 20percent pay cut for 650.000 defense workers nationwide. Bases in my home State of Washington are being affected. and the first furlough date at Joint Base LewisMcChord in Washington State is tomorrow. So instead of going to work. thousands of workers in my State will go home. The 9111 call center and the fire department will be understaffed. Airfields are going to be shuttered except for emergencies. The military personnel office is closed. The substance abuse center is closed. The Army Medical Center is going to close clinics. and even the Wounded Care Clinic is going to be understaffed. I am reminded of one worker I met last week. Will Silba. Will is a former marine. an amputee. He works now as a fire inspector. and he told me that because of these furloughs he is going to have to get a second job. He is going to struggle with his mortgage payments. While these furloughs are going to directly impact thousands of people and civilian employees. the leaders at LewisMcChord have made it very clear that the furloughs are going to hurt our soldiers. They are going to limit their access to medical care. They are going to cut back on the family support programs. They are going to make it tougher to find a job when they finish their military careers. Why? Because our colleagues refuse to work together. To me. this is unacceptable. Because some Republicans would like to preserve the harmful cuts from sequestration despite these kinds of impacts. we have a $91 billion gap between the House and the Senate appropriations levels for next year. If we do not resolve that gap. we are headed for another round of uncertainty and brinkmanship. another unnecessary burden on our economic recovery and the millions of Americans who are looking for work every day. Some of my Republican colleagues say they are fine with that. In fact. House Republicans are reported. right now. to be busy working on a debt limit ransom noteright nowand so far that ransom note sounds quite a lot like the Ryan budget. As you know. the budget we did pass here in the Senate was very different. but that is exactly why we have to resolve our differences in conference. That is where we come together in a public fashion and talk about our differences and work out agreements. I believe we have an opportunity. a window of opportunity over the next few weeks to do what Americans across the country have asked us to docompromise and confront these problems before we head back to our home States for the work period in August. We do not have a lot of time. but I am confident that if those of us who can see working together as a responsibility rather than a liability come to the table. we can get a fair bipartisan agreement. By the way. I was very discouraged to hear just this week from some tea party Republicansmany of the same ones who are now blocking us going to conferencewho are already talking now about shutting down the government in order to defund ObamaCare. Not only do they want to push us to a crisis. but they want to do that in order to cut off health care coverage for 25 million people and reopen that doughnut hole we know so much about. causing seniors to pay more for their prescriptions. and end preventive care for seniors. and the list goes on. This is an absurd position. We should not be talking about shutting down the government. I really hope responsible Republicans reject this approach and work with us on real solutions. not more political fights. My colleagues and I are going to continue urging the Senate Republican leadership to end their tea partybacked strategy of manufacturing crises and allow us to do the work we were sent here to do and go to a conference. I urge them to listen not just to Democrats but to many Members of their own party who want to get to a budget conference and allow us to get to work to solve the Nations problems."
1130084557,There are a number of women who are going to be joining me today. They are leaders in this Capitol who are working each and every day. both here and back in their home States. to give more of their constituents a chance to succeed. Today we are here to talk about one small idea that stands to make a huge difference in the lives of our constituents. and for women in particular. and that is the idea that if you are putting in 40 or 50 or 60 hours of work per week you should be able to put food on your table and pay your bills. and you wont be stuck below the poverty line. This idea could change the lives of millions of Americans if Congress simply acted and raised the minimum wage. We need to act now because right now one in four womenone in four womenis making minimum wage today. That is 15 million American women who are making the equivalent of about 2 gallons of gas per hour. Are we prepared to tell them that should be enough to support themselves and their kids? In fact. as I am sure you will hear repeated by others today. nearly twothirds of those who earn minimum wage or less are women. This is coming at a time when more women are now depended upon as the sole income earners in their families. Right now in cities and towns across America there are millions of those women who are getting up at the crack of dawn for work every day. They are stuck living in poverty. They cannot save for a car. much less a house. They cannot pay for school so they can get better skills and a better paying job. They cannot even afford to provide their children with more winter clothes or basic medical care. That is not how it is supposed to work in America. the country where you are told if you work hard and play by the rules you can get ahead. So when we talk about the minimum wage. lets be clear: Raising the minimum wage is about bringing back our middle class. I am proud that in my State of Washington we are taking the lead. In our State our workforce enjoys the highest minimum wage in the country. and I am glad to point out to all of our friends on the other side of the aisle. Washington States economy has not been negatively impacted by our high minimum wage. In fact. our economy has benefited from a high minimum wage. Job growth has continued at a rate above the national average. Payrolls in our restaurants and bars have expanded due to people having more money in their pockets to spend at dinner or a night on the town. and poverty in Washington State has trailed the national level for at least 7 years now. That is why I support making the national minimum wage $10.10 for families from Washington to Wisconsin. from Massachusetts to Minnesota and Hawaii and everywhere inbetween. It is not enough to make you rich. but it is a small raise for millions of families who desperately need it. It is a small raise for moms and dads who need help. We have to do more. Today. twothirds of families rely on income from both parents. but thanks to our outdated Tax Code. a woman thinking about reentering the workforce as a second earner in her family may face higher tax rates than her husband. That is unfair. and it has to change. Last week I introduced the 21st Century Worker Tax Cut Act which will help solve that problem by giving struggling twoearner families with children a tax deduction on that second earners income. My hope is that over the coming weeks we can all come together in this Chamber on behalf of millions of American women wholike my own mother when I was growing upare the sole caregiver and breadwinner in their families. I hope our colleagues have gotten a sense of how the current $7.25 an hour translates to a grocery trip for a family of four. shopping for school supplies or even how it impacts peoples daily commutes. That is why we are here todayto give that mom or that dad a fair shot at succeeding in America. I am proud to be joined today by a number of my colleagues in the Senate who are strong women and fighting for women and men in their home States. I yield the floor.
1130091570,"Mr. President. I come to the floor this evening. along with my colleague Senator CANTWELL. to talk about a truly remarkable man from our own State of Washington whom we just lost last week. Billy Frank. Jr.. was many things to many different people. To his family he was a loving husband and father. to the dozens of Native American tribes in Washington State he was a hero and a champion for hardfought treaty rights. and to millions across our State. Billy Frank. Jr.. was a marine who represented what the best of America is all about. fighting for what you believe in and never. ever giving up. I was back in Washington State yesterday for Billys memorial service. and looking around at all the people there whose lives he had touched. I was reminded of what made Billy so special. Billy was the type of person who defined the term ""larger than life."" He was the type of person who had so much personality and so much ability and so much passion and love in his heart that it was very hard to believe it could all be contained in just one person. When Billy believed in something. he didnt just make his argument. he held a fishin. He built a movement. He did raise his voice just to be heard. he banged down the doors in Olympia and here in Washington. DC. until he got what he needed. Most of all. he never flinched in the face of opposition. and he faced plenty of it. from hate and discrimination to being arrested and abused. Over a lifetime that took him from the banks of the Nisqually River to the steps of the U.S. Supreme Court. Billy made sure the rights of Native Americans were protected and honored by the United States of America. He led the fight to ensure tribal rights to Native lands and salmon harvest could never be stolen away and over time he became much more than an advocate. He became in many ways a face of so many Native American communities across this country. Now as we grieve and try to think about how to move forward without this largerthanlife man. I am reminded that while we have lost Billy. so much of his lifes work truly remains with us because all he accomplished and all he achieved. whether it was power and influence or court decisions and new laws. it was never about him. It was always about his community. his tribe. and protecting treaty rights for all Native Americans. Billy was someone who did so much and worked so hard not so he could gain power or wealth but so the people. the land. and the fish he cared so much for would never be brushed aside or forgotten. That is a rare thing. Billys life wasnt a job for one man or one woman. but somehow he pulled it off by himself. So now it is going to take everyone who knew him to fill his shoes together and fight with the tribes that call Washington State home. I wish to conclude by quoting something Billy once said: I dont believe in magic. I believe in the sun and the stars. the water. the tides. the floods. the owls. the hawks flying. the river running. the wind talking. They are measurements. They tell us how healthy things are. They tell us because we and they are the same. and that is what I believe in. Those who listen to the world that sustains them can hear the message brought forth by the salmon. That is Billy and we will miss him. I yield the floor."
1130098814,Mr. President. I come to the floor today to say that this compromise is really an excellent example of what Congress can do when we work together to put our veterans first and work toward substantive solutions to the challenges they face. Passing this legislation this afternoon is a critical step toward addressing some of the immediate accountability and transparency concerns that are plaguing the VA and fixing its deepseated structural and cultural challenges. Each new report seems to paint a more serious and more disturbing picture of the VAs systemwide failure to provide timely access to care for our Nations heroes. I am especially concerned by the number of facilities that serve Washington State veterans that have been flagged for further review and investigation. The VA has promised to get to the bottom of this. and I expect them to do so immediately. However. these new reports are not only consistent with what I hear so often from veterans and VA employees but also with what the inspector general and GAO have been reporting on for more than a decade. These are not new problems. and Congress must continue to take action on them while addressing the inevitable issues that will be uncovered as ongoing investigations and reviews are completed. I expect this Chamber to come together. as the House did yesterdaytwice. in factto move this bill forward so we can work on our differences with the House and send this legislation to the Presidents desk as soon as possible. As we all know. there are serious problems at the VA that will not be solved through legislation alone or by simply replacing the Secretary. However. I am very hopeful these steps that are in this legislation will spark longoverdue changefrom the top downin order to ensure that our veterans are given the care and support they expect and deserve. So I wanted to come today to commend the Senator from Arizona and the Senator from Vermont for their commitment to bipartisanship and putting the needs of our veterans first. This is an important compromise. and I urge our colleagues to continue the bipartisan collaboration that made this bill possible. Lets get it passed and in place so these reforms can begin to get started. And then we must keep working to address the management. resource. and personnel shortcomings that we all know exist at the VA. I yield the floor.
1130103241,I want to thank our chairman and ranking member. Senator HARKIN and Senator ALEXANDER. for their tremendous work and backing us as we worked through this process. I again thank my partner. Senator ISAKSON. who was so diligent and true to his word and worked through every issue with us. I want to thank him for that. I also will take a minute this afternoon to extend a sincere thank you to all of the staff who worked so hard to help put this bill together. worked through its challenges. and got us to this point today where we have passed it in the Senate. If the Senate will bear with me. we have a lot of names. but I think that tells you how many people worked so hard on this. From my office: senior advisor Scott Cheney. my chief of staff Mike Spahn. my Budget Committee staff director Evan Schatz. Stacy Rich and Emma Fulkerson from my floor and leadership staff. my entire communications team. especially Eli Zupnick and Sean Coit. and everyone else from my team who has worked so very hard to move this bill forward. I thank the wonderful staff from Senator ISAKSONS office: Tommy Nguyen. staff director of the HELP Subcommittee on Employment and Workplace Safety. as well as Brett Layson and Michael Black who have been incredible to work with. I thank Chairman HARKINs Health. Education. Labor and Pensions Committee team: senior education policy adviser Crystal Bridgeman. chief education counsel Mildred Otero. disability policy director Michael GamelMcCormick. disability counsel Lee Perselay. Derek Miller. staff director of the HELP Committee. deputy staff director and labor policy director of the HELP Committee Lauren McFerren. and labor policy adviser Liz Weiss. and many more on his staff who have helped. I also thank the staff of Senator ALEXANDER: education policy adviser Patrick Murray. education policy director and counsel Peter Oppenheim. Bill Knudsen. education policy advisor. and HELP Committee staff director and chief of staff David Cleary. We also benefited from the expertise of the Congressional Research Service. I thank David Bradley. Benjamin Collins. and Adrienne FernandesAlcantara. I would be remiss if I did not thank the professionals in the Senate Legislative Counsels office. especially Liz King. Amy Gaynor. Kristin Romero. and Katie Grendon. As you can see. a lot of people worked a very long time to get us where we are. This has been an 11year process. so there have been a lot of staff who worked on various versions of this reauthorization over the years. I cannot name them all. but there are some who deserve recognition as well: Gerri Fiala. Bill Kamela. Beth Buehlmann. Kelly Hastings. Pam Smith. David Johns. and Glee Smith. Of course. my thanks to the staff in the House and the administration. of whom there are far too many to mention here. I think that tells all of us that this is a bill that was worked on diligently by many over the years. Who will benefit at the end of the day are our workforce and our employers and our country. I thank again my counterpart Senator ISAKSON for working with me to get this done.
1130110295,"Madam President. I come to the floor today to speak for a few minutes about the absolutely devastating wildfires currently burning through the farms. communities. and public lands of our home State of Washington. As a lifelong resident of Washington State and the Pacific Northwest. I have always been aware of the annual risks and dangers that wildfires pose to our region. Every summer. a combination of rising temperatures. months of dry weather. and our States obvious abundance of forest and fields have resulted in wildfires capable of threatening homes and businesses across our State. Each summer we have worked to become better and better prepared to help protect our communities. But one wildfire burning this year is the single largest we have seen in Washington State. Since last Tuesday. massive wildfires covering hundreds of thousands of acres have ravaged our farm lands. our agricultural areas. our cherished public lands. and. most importantly. communities throughout Chelan County. Okanogan County. and others across eastern Washington. I am talking about a massive wave of flames that has burned an area now four times the size of Seattle. which is our States largest city. Even for those of us who have lived our entire lives with the reality of wildfires. this is unprecedented. So while I am here in what we call ""the other Washington."" today. my heart. my thoughts. and my prayers are in Central and Eastern Washington. Even here on the Senate floor. I cant help but think of the firefighters and first responders and everyone who is neglecting sleep and rest to protect their communities. Most of all. I cant stop thinking about the families who lost their homes and all they own to this horrific disaster. If there is one thing I know about our State. it is that we dont turn away from hard times or hard work. Over the last several weeks I have talked with a number of the local leaders in the communities that are facing these fires. including Sheriff Frank Rogers in Okanogan County. Sheriff Brian Burnett in Chelan County. and Mayor Libby Harrison in the small town of Pateros. where dozens of homes. including hers. have been lost to this fire. Every one of them told me that while their community is facing hard times. nobody is giving up. They have been doing everything they can to protect each and every person in their rural communities. and so far they have been able to do that. I wish to share one story that speaks to what is happening in my home State right now. As I mentioned. this small town of Pateros has been hit very hard. They havent lost any lives. but they have lost more than 100 homes and buildings throughout their community. But one building they did not lose was their school. which has always been to them the central place of their community. and it is now the central staging area as these fires rage on. As in many other small communities. the school in Pateros serves kids in grades K through 12. and last week that fire came within just a few feet of that school. Firefighters and responders were working elsewhere. So the school could easily have burned down. until a local man by the name of Augustine Morales decided to do something about it. He and a friend used hoses on the backs of their own trucks to fight back that fire and save their kids school. Augustine was interviewed by a local TV station and here is what he said: Everything was going through my mind because I have my kids and I have to take care of my kids. and I [was] just thinking . . . if you die. I dont know whats going to happen. So that is what so many people just like Augustine are facing right now in Central and Eastern Washington. and I know they will not be giving up. In addition to our thoughts and our prayers. we have to make sure we are working to have all of the Federal resources they need available. I am thrilled the Senate supplemental funding bill that was released yesterday actually includes $615 million for firefighting efforts in Western Statesmoney I requested along with my colleague Senator CANTWELL and 10 other colleagues. But we know there is a lot more work to be done. We have to get that funding passed through the Senate and the House and to the Presidents desk right away. I am really very pleased that early yesterday morning the President. in fact. made an emergency declaration that is going to help those communities fight these wildfires. I know that I and Senator CANTWELL and all of us are going to be working with our local officials and Federal officials all the way up to the President to make sure those communities get what they need. Thank you. Madam President. I yield the floor and suggest the absence of a quorum."
